AimmuneTherapeuticsInc_20200205_8-K_EX-10.3_11967170_EX-10.3_Development Agreement.pdf,"['LICENSE, DEVELOPMENT AND COMMERCIALIZATION AGREEMENT']","['The Aimmune Know- How shall be transferred pursuant to the procedure to transfer Xencor Know-How, Regulatory Materials, and Regulatory Data in Section 2.7 applied mutatis mutandis.', ""Upon the termination of this Agreement, Aimmune will promptly, in each case within [***] ([***]) days thereafter:\n\n(a) assign to Xencor, [***], all of Aimmune's right, title and interest in and to any agreements (or portions thereof) between Aimmune and Third Parties that relate to the Development, Commercialization or Manufacture of the Product, where such assignment is permitted without charge to Aimmune or its Affiliates and where Xencor shall assume all future payments due under any agreement assigned pursuant to this subsection;\n\n(b) assign to Xencor, [***], and subject to the execution of a standard trademark license between the Parties prior to such assignment, all of Aimmune's right, title and interest in and to any (i) Promotional Materials, (ii) copyrights and trademarks (including the Product Trademarks and Product Trade Dress), including any goodwill associated therewith, and any registrations and design patents for the foregoing, and (iii) any internet domain name registrations for such trademarks and slogans, all to the extent solely related to the Product; provided, however, in the event Xencor exercises such right to have assigned such Promotional Materials, Aimmune shall grant, and hereby does grant, a royalty-free right and license to any housemarks, trademarks, names and logos of Aimmune contained therein for a period of [***] ([***]) months in order to use such Promotional Materials solely in connection with the Commercialization of the Product;\n\n(c) assign to Xencor, [***], the management and continued performance of any Clinical Trials for the Product ongoing hereunder as of the effective date of such termination in respect of which Xencor shall assume full financial responsibility from and after the effective date of such termination;\n\n(d) transfer to Xencor all of Aimmune's right, title and interest in and to any and all regulatory filings, Regulatory Approvals and other Regulatory Materials for the Product;<omitted>(e) transfer to Xencor all of Aimmune's right, title and interest in and to any and all Development-related data and Commercialization Data Controlled by Aimmune for the Product; and\n\n(f) provide a copy of (i) the material tangible embodiments of the foregoing and (ii) any other material books, records, files and documents Controlled by Aimmune solely to the extent related to the Product and which may be redacted to exclude Confidential Information of Aimmune;\n\nprovided, however, that to the extent that any agreement or other asset described in this Section 14.2 is not assignable by Aimmune (whether because such agreement or asset is explicitly non-assignable or because the Third Party consent required for such assignment is not obtained), then such agreement or other asset will not be assigned, and upon the request of Xencor, Aimmune will take such steps as may be reasonably necessary to allow Xencor to obtain and to enjoy the benefits of such agreement or other asset. For purposes of clarity, (1) [***] and (2) to the extent Xencor requests [***].""]",Yes,"['All Joint Inventions shall be jointly owned by the Parties, and Patents Covering Joint Inventions shall be referred to as ""Joint Collaboration Patents"".']",Yes,"['Aimmune hereby covenants and agrees that it shall not (and shall cause the other Aimmune Agreement Entities not to), either directly or indirectly,<omitted>Develop, Manufacture, or Commercialize the Product for use outside the Licensed Field.', ""Subject to the terms and conditions of this Agreement, Xencor hereby grants to Aimmune during the Term an exclusive, worldwide, payment-bearing license under and with respect to Xencor Patents and Xencor's interest in Joint Collaboration Patents, and a non-exclusive, payment bearing license under and with respect to Xencor Know-How, in each case, with the right to sublicense solely in accordance with Section 2.3.2, solely to Develop, Manufacture and Commercialize the Product in and for the Licensed Field; provided that notwithstanding the foregoing, Xencor shall retain the right under and with respect to Xencor Patents and Xencor's interest in Joint Collaboration Patents to the extent necessary to perform its obligations under this Agreement."", 'Aimmune hereby grants to Xencor an exclusive license under and with respect to Aimmune Patents, and a non-exclusive license under and with respect to Aimmune Know-How, in each case, where such license is an irrevocable, perpetual, royalty-bearing license, with the right to sublicense, to Develop, Manufacture and Commercialize the Product(s), as the Product(s) exist as of the effective date of such termination, or optimized versions thereof that are Products.', 'Aimmune covenants that it will not research or develop (including Develop) the Antibody itself, including not developing any modification, variant, fragment, progeny or derivatives of such Antibody, in each case, in a way that would produce a molecule that is neither the Antibody nor a molecule that falls within the definition of a Product.']",Yes,"[""Subject to the terms and conditions of this Agreement, Xencor hereby grants to Aimmune during the Term an exclusive, worldwide, payment-bearing license under and with respect to Xencor Patents and Xencor's interest in Joint Collaboration Patents, and a non-exclusive, payment bearing license under and with respect to Xencor Know-How, in each case, with the right to sublicense solely in accordance with Section 2.3.2, solely to Develop, Manufacture and Commercialize the Product in and for the Licensed Field; provided that notwithstanding the foregoing, Xencor shall retain the right under and with respect to Xencor Patents and Xencor's interest in Joint Collaboration Patents to the extent necessary to perform its obligations under this Agreement.""]",Yes,"['""Xencor Know-How"" means any and all Know-How, whether or not patented or patentable, (i) to the extent Controlled by Xencor or its Affiliates as of the Effective Date, or, if transferred to Aimmune thereafter during the Term of this Agreement, and that is necessary in connection with the Development, Manufacture, Commercialization or other use of the Antibody or Product or (ii) constituting a Xencor Invention. Notwithstanding the foregoing, in all cases, Xencor Know-How does not include (a) [***], (b) [***], (c) [***], (d) [***], (e) [***], or (f) [***].<omitted>Subject to the terms and conditions of this Agreement, Xencor hereby grants to Aimmune during the Term an exclusive, worldwide, payment-bearing license under and with respect to Xencor Patents and Xencor\'s interest in Joint Collaboration Patents, and a non-exclusive, payment bearing license under and with respect to Xencor Know-How, in each case, with the right to sublicense solely in accordance with Section 2.3.2, solely to Develop, Manufacture and Commercialize the Product in and for the Licensed Field; provided that notwithstanding the foregoing, Xencor shall retain the right under and with respect to Xencor Patents and Xencor\'s interest in Joint Collaboration Patents to the extent necessary to perform its obligations under this Agreement.']",Yes,"['Aimmune shall [***] the right (but not the obligation) to sublicense the rights granted to it under Section 2.1 to its Affiliates or Third Parties (each, a ""Sublicensee""); provided, however, that Aimmune shall remain responsible for the performance by any of its direct and indirect Sublicensees and shall cause its direct and indirect Sublicensees to comply with the applicable provisions of this Agreement in connection with such performance.']",Yes,[],No,"['Aimmune hereby grants to Xencor an exclusive license under and with respect to Aimmune Patents, and a non-exclusive license under and with respect to Aimmune Know-How, in each case, where such license is an irrevocable, perpetual, royalty-bearing license, with the right to sublicense, to Develop, Manufacture and Commercialize the Product(s), as the Product(s) exist as of the effective date of such termination, or optimized versions thereof that are Products.']",Yes,[],No
CnsPharmaceuticalsInc_20200326_8-K_EX-10.1_12079626_EX-10.1_Development Agreement.pdf,['Development Agreement'],[],No,[],No,[],No,[],No,[],No,[],No,[],No,[],No,[],No
ClickstreamCorp_20200330_1-A_EX1A-6 MAT CTRCT_12089935_EX1A-6 MAT CTRCT_Development Agreement.pdf,['APPLICATION DEVELOPMENT AGREEMENT'],"['To the extent such work may not be deemed a ""work for hire"" under applicable law, the Developer hereby assigns to the Client all of its right, title, and interest in and to such work.', 'The Developer expressly acknowledges and agrees that any all proprietary materials prepared by the Developer under this Agreement shall be considered ""works for hire"" and the exclusive property of the Client unless otherwise specified.', 'The Developer recognizes that the complete Intellectual Property of the project belongs to the Client']",Yes,[],No,"['If the Client, in its reasonable discretion, consents, the Client is hereby granted an exclusive, worldwide, royalty-free, perpetual, irrevocable license to use, distribute, modify, publish, and otherwise exploit the incorporated items in connection with the work product developed for the Client.']",Yes,[],No,[],No,[],No,[],No,"['If the Client, in its reasonable discretion, consents, the Client is hereby granted an exclusive, worldwide, royalty-free, perpetual, irrevocable license to use, distribute, modify, publish, and otherwise exploit the incorporated items in connection with the work product developed for the Client.']",Yes,[],No
CoherusBiosciencesInc_20200227_10-K_EX-10.29_12021376_EX-10.29_Development Agreement.pdf,['LICENSE AND DEVELOPMENT AGREEMENT'],"['Notwithstanding any other rights Bioeq may have under this Agreement or Applicable Law; if Licensee does not transfer and assign to Bioeq or its designee its rights in any Biologics License Applications and Biologics License Application Approvals controlled by Licensee for the Licensed Products in the Field in the Territory within the above [***] ([***]) day time period (provided that the physical or electronic transfer of files and documentation in connection with such transfer and assignment<omitted>of rights may occur after such [***] ([***]) day period without being deemed a breach of this Section 15.3.2 by Licensee), [***].', ""In addition, upon Bioeq's request, Licensee shall notify the competent Regulatory Authority of such transfer, supply Bioeq with all documents already prepared by Licensee or its Affiliates for the filing of applications in relation to the Licensed Products with any Regulatory Authority and/or apply for the closing of any such application."", ""Following such transfer, Licensee shall have the sole right and shall use Commercially Reasonable Efforts to maintain such Regulatory Approvals for the Licensed Product in the Field in the Territory at Licensee's expense (subject to the remainder of this Section 4.4), and shall have the sole right to communicate and correspond with Regulatory Authorities in the Territory in connection therewith, in each case, in consultation with Bioeq."", 'Prior to the First Commercial Sale of any Licensed Product in the Territory, Bioeq shall transfer or cause to be transferred the applicable Regulatory Approvals and Biologics License Applications for such Licensed Product to Licensee, including by preparing and submitting a transfer letter notifying the FDA of the transfer of the applicable Regulatory Approvals and Biologics License Applications for such Licensed Product to Licensee.', ""Licensee shall, within [***] ([***]) days of the effective date of termination of the Agreement at the latest (and at no cost to Bioeq if this Agreement is terminated by Bioeq pursuant to Sections 15.2.1, 15.2.2, 15.2.3, 15.2.4, 15.2.8 or 15.2.9, or by Licensee pursuant to Section 15.2.5, or at Bioeq's cost and expense if this Agreement is terminated by Licensee pursuant to Sections 15.2.1, 15.2.6, 15.2.7 or 15.2.8, as applicable) transfer and assign to Bioeq or its designee all of Licensee's right, title and interest in and to any and all Biologics License Applications and Biologics License Application Approvals controlled by Licensee for the Licensed Products in the Field in the Territory as of the effective date of such termination, including any and all documentation pertaining to such filings and Biologics License Application Approvals (provided that the physical or electronic transfer of files and documentation in connection with such transfer and assignment of rights may occur after such [***] ([***]) day period without being deemed a breach of this Section 15.3.2 by Licensee).""]",Yes,"['Each Party hereby assigns to the other Party a joint equal and undivided interest in and to all Joint Inventions (including Joint Improvements) to effect such joint ownership of such Joint Inventions (including Joint Improvements).', ""For those countries where a specific license is required for a joint owner of a Joint Invention or Joint Improvement to practice such Joint Invention or Joint Improvement, in such country, each Party hereby grants to the other Party a perpetual, irrevocable, non-exclusive, worldwide, royalty-free, fully paid-up license, transferable and sublicensable, under such Party's right, title and interest in and to such Joint Invention or Joint Improvement to freely exploit such Joint Invention or Joint Improvement in such country, subject to the terms and conditions of this Agreement and the licenses granted hereunder."", 'As between the Parties, the Parties shall jointly own all Inventions (including Improvements) developed, conceived or reduced to practice jointly by or on behalf of both Bioeq and Licensee (such Inventions, Joint Inventions, and such Improvements, Joint Improvements), and all Intellectual Property Rights and Know-How therein.']",Yes,"[""Solely in the event that this Agreement is terminated by Bioeq pursuant to Sections 15.2.1, 15.2.2, 15.2.3, 15.2.4, 15.2.8 or 15.2.9 or by Licensee pursuant to Section 15.2.5 , Licensee shall grant, and hereby grants to Bioeq an exclusive, royalty-free, fully paid, sublicenseable, license to use the Licensee-Controlled Trademarks which were actually used by Licensee to Commercialize the Licensed Products in the Territory in connection with Bioeq's Commercialization of the Licensed Products in the Territory. I"", 'Licensee hereby grants to Bioeq during the term of this Agreement (and, subject to Section 15.3.4, after termination<omitted>or expiration of this Agreement) a non-exclusive, fully-paid, irrevocable license (including the right to grant sublicenses) under all Intellectual Property Rights and Know-How Controlled by Licensee and embodied within, or claiming or covering the Licensee Improvements, to Develop, Manufacture, sell, import, or otherwise Commercialize Licensed Products outside of the Territory.', 'Subject to the provisions of this Agreement, Bioeq hereby grants to Licensee an exclusive (even as to Bioeq), milestone- and royalty-bearing, non-transferable license (including the right to grant sublicenses only to the extent permitted by Section 2.1.2) under the Licensed Technology (including the Licensed Patents) to use, sell, have sold, import, have imported or otherwise Commercialize the Licensed Products in the Field in the Territory.', ""For those countries where a specific license is required for a joint owner of a Joint Invention or Joint Improvement to practice such Joint Invention or Joint Improvement, in such country, each Party hereby grants to the other Party a perpetual, irrevocable, non-exclusive, worldwide, royalty-free, fully paid-up license, transferable and sublicensable, under such Party's right, title and interest in and to such Joint Invention or Joint Improvement to freely exploit such Joint Invention or Joint Improvement in such country, subject to the terms and conditions of this Agreement and the licenses granted hereunder.""]",Yes,"['Subject to the provisions of this Agreement, Bioeq hereby grants to Licensee an exclusive (even as to Bioeq), milestone- and royalty-bearing, non-transferable license (including the right to grant sublicenses only to the extent permitted by Section 2.1.2) under the Licensed Technology (including the Licensed Patents) to use, sell, have sold, import, have imported or otherwise Commercialize the Licensed Products in the Field in the Territory.']",Yes,[],No,"['Licensee shall be entitled to grant sublicenses under its license pursuant to Section 2.1 to Affiliates only, provided that any sublicense granted by Licensee under this Section 2.1.2 shall be made through a written agreement in the English language and shall be consistent with the terms of this Agreement.', ""For those countries where a specific license is required for a joint owner of a Joint Invention or Joint Improvement to practice such Joint Invention or Joint Improvement, in such country, each Party hereby grants to the other Party a perpetual, irrevocable, non-exclusive, worldwide, royalty-free, fully paid-up license, transferable and sublicensable, under such Party's right, title and interest in and to such Joint Invention or Joint Improvement to freely exploit such Joint Invention or Joint Improvement in such country, subject to the terms and conditions of this Agreement and the licenses granted hereunder.""]",Yes,[],No,"[""For those countries where a specific license is required for a joint owner of a Joint Invention or Joint Improvement to practice such Joint Invention or Joint Improvement, in such country, each Party hereby grants to the other Party a perpetual, irrevocable, non-exclusive, worldwide, royalty-free, fully paid-up license, transferable and sublicensable, under such Party's right, title and interest in and to such Joint Invention or Joint Improvement to freely exploit such Joint Invention or Joint Improvement in such country, subject to the terms and conditions of this Agreement and the licenses granted hereunder."", 'Licensee hereby grants to Bioeq during the term of this Agreement (and, subject to Section 15.3.4, after termination<omitted>or expiration of this Agreement) a non-exclusive, fully-paid, irrevocable license (including the right to grant sublicenses) under all Intellectual Property Rights and Know-How Controlled by Licensee and embodied within, or claiming or covering the Licensee Improvements, to Develop, Manufacture, sell, import, or otherwise Commercialize Licensed Products outside of the Territory.']",Yes,[],No
ElPolloLocoHoldingsInc_20200306_10-K_EX-10.16_12041700_EX-10.16_Development Agreement.pdf,['FRANCHISE DEVELOPMENT AGREEMENT (Non-exclusive/Exclusive)'],[],No,[],No,"['Franchisor hereby grants to Developer, subject to the terms and conditions of this Agreement (if Section 2.20 is applicable add "", and specifically Section 2.20 hereof,"") and as long as Developer shall not be in default of this Agreement or any other development, franchise or other agreement between Developer and Franchisor, (non-exclusive/exclusive) development rights to establish and operate ____ franchised restaurant(s), and to use the El Pollo LocoÂ® System solely in connection therewith, at specific locations to be designated in separate Franchise Agreement(s) (the ""Franchise Agreements"").']",Yes,[],No,[],No,[],No,[],No,[],No,[],No
EmeraldHealthBioceuticalsInc_20200218_1-A_EX1A-6 MAT CTRCT_11987205_EX1A-6 MAT CTRCT_Development Agreement.pdf,['Consulting and Product Development Agreement'],[],No,[],No,[],No,[],No,[],No,[],No,[],No,[],No,[],No
