Filename,Document Name,Ip Ownership Assignment,Ip Ownership Assignment-Answer,Joint Ip Ownership,Joint Ip Ownership-Answer,License Grant,License Grant-Answer,Non-Transferable License,Non-Transferable License-Answer,Affiliate License-Licensor,Affiliate License-Licensor-Answer,Affiliate License-Licensee,Affiliate License-Licensee-Answer,Unlimited/All-You-Can-Eat-License,Unlimited/All-You-Can-Eat-License-Answer,Irrevocable Or Perpetual License,Irrevocable Or Perpetual License-Answer,Source Code Escrow,Source Code Escrow-Answer
CybergyHoldingsInc_20140520_10-Q_EX-10.27_8605784_EX-10.27_Affiliate Agreement.pdf,['MARKETING AFFILIATE AGREEMENT'],[],No,[],No,"['Company hereby grants MA, during the term of this Agreement, the right to use Company and/or Company trade names, trademarks or service marks on Technology or in advertising or promotion relating directly to these products.', 'Subject to the terms and conditions of this Agreement, Company hereby grants to MA the right to advertise, market and sell to corporate users, government agencies and educational facilities (""Clients"") for their own internal language learning, soft skills and communication purposes only, and not for remarketing or redistribution, and not for use in a data center environment for multiple users Clients, unless otherwise agreed to by Company prior in writing, the Technology listed in Schedule A of this Agreement, and to sell and/or bundle Technology Maintenance for the Technology and to provide first line technical support and implementation services for the Technology in the territories listed in Schedule A of this Agreement, providing MA meets the criteria required for delivering services according to Schedule A.', 'MA is authorized to resell Technology within the following territory according to the terms of the Agreement:\n\nWorldwide']",Yes,[],No,[],No,[],No,[],No,[],No,[],No
EuromediaHoldingsCorp_20070215_10SB12G_EX-10.B(01)_525118_EX-10.B(01)_Content License Agreement.pdf,['VIDEO-ON-DEMAND CONTENT LICENSE AGREEMENT'],[],No,[],No,"['During the Term, Rogers shall have the non-exclusive right to distribute and exhibit each Licensed Program on a VOD basis for a period of ninety (90) consecutive days, or such longer period as may be agreed to by Rogers and Licensor (the ""License Period"").', 'Licensor grants to Rogers the non-exclusive license and right to distribute and exhibit in Canada (the ""Territory"") all entertainment programming to which Licensor owns or controls the VOD distribution and exhibition rights in the Territory (collectively, ""Licensed Programs"") to residential subscribers of Rogers\' digital cable television service on a Video-on-Demand (""VOD"") basis.']",Yes,[],No,[],No,[],No,['Multiple viewings of the Licensed Program shall be permitted during the Viewing Period for no additional fee and all such viewings shall be considered a single exhibition of the Licensed Program for the purposes of calculating License Fees hereunder.'],Yes,[],No,[],No
FulucaiProductionsLtd_20131223_10-Q_EX-10.9_8368347_EX-10.9_Content License Agreement.pdf,['CONTENT DISTRIBUTION AND LICENSE AGREEMENT'],[],No,[],No,"['Producer further grants to ConvergTV the right and license to Distribute and re-Distribute, including relicensing or sublicensing, the Program at such dates and times as are determined by ConvergTV in its sole discretion.', 'For the License Term and within the Licensed Territory, Producer hereby grants to ConvergTV a right and license to Distribute the program, file or video listed on the Deal Terms above (the ""Program"") consisting of<omitted>episodes (series) or<omitted>one-offs, for unlimited runs for the License Term through ConvergTV channels and/or other distribution outlets, in accordance with the License Rights.', '""Licensed Rights"" to ConvergTV and ConvergTV Channels and/or Distribution Outlets x All, including but not limited to: xSimultaneous Internet Streaming x OTT Television x Internet Protocol Television x Radio, short wave, microwave, fiber optic x Alternative, secondary and specialty distribution x Stored as VOD, Content Distribution Networks/Company Servers x Full Television Broadcast Rights: x Free: Terrestrial, Cable, Satellite x Pay: Terrestrial, Cable, Satellite x Direct Satellite IP Distribution Systems', 'Producer further grants to ConvergTV the right and license to create (re-edit), at its sole cost and expense, new and different versions of the Program, create foreign language, subtitled or translated versions of the Program as well as to create closed captioned versions of the Program, including NTCS, PAL, SEACAM standards, or other standards, including those yet to be developed.', 'The grant of rights and license pursuant to this Section 1 shall include, but not be limited to, the right of ConvergTV to Distribute and re-Distribute all or any portions of the Program and Promotional Works, including excerpts therefrom, and any new and different versions of the Program, on simultaneous internet transmission or streaming, internet protocol television and any television networks and stations, and/or other distribution outlets, via domestic or foreign television signals, as well as through CATV and DBS systems, satellite, microwave, fiber optic and/or other modes of Distribution yet to be developed, but which may be utilized by ConvergTV in the future.', 'Producer further grants to ConvergTV the right and license to utilize any and all footage from the Program for promotional and marketing purposes related to the Distribution of the Program and for promotion of channels or other distribution methods.', 'Producer further grants to ConvergTV the right and license to Distribute the Program on any ConvergTV channel, and/or other distribution outlets, that exists today or that is created or developed in the future and this right includes the right to Distribute on any channels of a ConvergTV affiliate and/or other distribution outlets without limitation.']",Yes,[],No,[],No,"['Producer further grants to ConvergTV the right and license to Distribute the Program on any ConvergTV channel, and/or other distribution outlets, that exists today or that is created or developed in the future and this right includes the right to Distribute on any channels of a ConvergTV affiliate and/or other distribution outlets without limitation.']",Yes,"['License Term Perpetual, unlimited runs x Other: 2 years Commencing: November 15, 2012', 'Producer further grants to ConvergTV the right and license to Distribute the Program on any ConvergTV channel, and/or other distribution outlets, that exists today or that is created or developed in the future and this right includes the right to Distribute on any channels of a ConvergTV affiliate and/or other distribution outlets without limitation.', 'For the License Term and within the Licensed Territory, Producer hereby grants to ConvergTV a right and license to Distribute the program, file or video listed on the Deal Terms above (the ""Program"") consisting of<omitted>episodes (series) or<omitted>one-offs, for unlimited runs for the License Term through ConvergTV channels and/or other distribution outlets, in accordance with the License Rights.']",Yes,[],No,[],No
GopageCorp_20140221_10-K_EX-10.1_8432966_EX-10.1_Content License Agreement.pdf,['WEBSITE CONTENT LICENSE AGREEMENT'],[],No,[],No,"[""Subject to Licensee's on\xadgoing compliance with Section 3.2 and all other terms and conditions of this Agreement, Licensor grants to Licensee an exclusive (save for rights reserved to Licensor hereunder), non-transferable (except as provided in Section 11.7) and non- sublicensable license, during the License Term, to reproduce, perform, display, transmit and distribute the Licensed Content on the Licensee Siteand Related Media intended solely for use by End Usersin the Territory within the scope set forth in Schedule 1 (License Scope), which is attached hereto and incorporated herein by this reference."", ""Licensor grants to Licensee a limited, non-exclusive, non-transferable (except as provided in Section 11.7) and non-sublicensable royalty-free license during the Term to those of Licensor's Marks designated by Licensor from time to time to:   (i)display such Marks on the Licensee Site: (x) with the Licensed Content to provide source attribution; or (y) as links to the Licensed Content;   (ii)comply with its express obligations under this Agreement; and   (iii)advertise, market and promote the availability of the Licensed Content or the Licensee Site and identify the Licensor as a content provider;   provided, that all uses of Licensor's Marks shall require Licensor's prior written approval.""]",Yes,"[""Subject to Licensee's on\xadgoing compliance with Section 3.2 and all other terms and conditions of this Agreement, Licensor grants to Licensee an exclusive (save for rights reserved to Licensor hereunder), non-transferable (except as provided in Section 11.7) and non- sublicensable license, during the License Term, to reproduce, perform, display, transmit and distribute the Licensed Content on the Licensee Siteand Related Media intended solely for use by End Usersin the Territory within the scope set forth in Schedule 1 (License Scope), which is attached hereto and incorporated herein by this reference."", ""Licensor grants to Licensee a limited, non-exclusive, non-transferable (except as provided in Section 11.7) and non-sublicensable royalty-free license during the Term to those of Licensor's Marks designated by Licensor from time to time to:   (i)display such Marks on the Licensee Site: (x) with the Licensed Content to provide source attribution; or (y) as links to the Licensed Content;   (ii)comply with its express obligations under this Agreement; and   (iii)advertise, market and promote the availability of the Licensed Content or the Licensee Site and identify the Licensor as a content provider;   provided, that all uses of Licensor's Marks shall require Licensor's prior written approval.""]",Yes,[],No,[],No,[],No,[],No,[],No
IdeanomicsInc_20160330_10-K_EX-10.26_9512211_EX-10.26_Content License Agreement.pdf,['CONTENT LICENSE AGREEMENT'],[],No,[],No,"['Limitations on Rights Granted: the following distribution methods are permitted: non-theatrical, public video, ship and hotel rights (all not earlier than the US theatrical release); home video rental, home video sell through, and commercial video rights (all not earlier than the US video release); cable TV (pay & free), terrestrial TV (pay & free), satellite pay TV; internet TV (pay & free), residential and non-residential pay-per-view, residential and non-residential internet pay-per-view, VOD, near VOD, and internet VOD (all no earlier than the corresponding exploitation in the USA).', ""copy and dub the Titles, and authorize any person to do the foregoing Licensee shall also have the right to make (or have made on its behalf) translations of the Titles with prior written approval by Licensor and subject to the applicable limitations (if any) in Section 2(a)(i) [License Grant];\n\niii. promote each Title in any manner or media, including, without limitation, the right to use and license others to use Licensor's name, the title of, trailers created for and excerpts from such Title (including but not limited to audio portions only), Materials and the name, voice and likeness of and any biographical material concerning all persons appearing in or connected with such Title for the purpose of advertising, promoting and/or publicizing such Title, Licensee and the program service on which the Title is exhibited subject to the applicable limitations (if any) in Section 2(a)(i) [License Grant] ;\n\niv. use the Titles for (i) audience and marketing testing, (ii) sponsor/advertiser screening, and (iii) reference and file purposes, subject to the applicable limitations (if any) in Section 2(a)(i) [License Grant]; and\n\nv. include Licensee's name, trademark and logo in the Titles to identify Licensee as the exhibitor of the Titles."", 'In exchange for the Share Consideration, Licensor hereby grants to Licensee a non-exclusive, royalty-free, perpetual and non-perpetual license (subject to the duration and scope, and format limitations for which Licensor has the rights to each Title as specified in Schedule A1-A6 of Schedule A) to:\n\ni. license, exhibit, distribute, reproduce, transmit, perform, display, and otherwise exploit and make available each Title within the Territory in any language by VOD (including SVOD, TVOD, AVOD and free VOD) for Internet, TV and mobile platforms (including, but not limited to, OTT streaming services, Sites and Mobile Sites), subject to these limitations for each of the Title in Schedule A1-A6:\n\n1) For Titles listed in Schedule A1-A2:\n\nLicensor can only grant Licensee distribution rights to up to six (6) MSOs plus two (2) of China\'s Internet TV license holders or their OTT Internet-based video partners by VOD (including SVOD, TVOD, AVOD and free VOD). China\'s current Internet TV license holders include: CNTV (ä¸­å½ç½ç»çµè§å°/æªæ¥çµè§), BesTV (ç¾è§é), Wasu (åæ°), Southern Media Cooperation (åæ¹ä¼ åª), Hunan TV (èæ TV), China National Radio/Galaxy Internet TV (GITV) (é¶æ²³çµè§), and China Radio International (ä¸­å½å½é å¹¿æ­çµå°);<omitted>2) For Titles listed in Schedule A3:\n\nFor ""å¤©ä¸å¥³äºº"": No satellite TV broadcasting rights granted. Titles other than ""ç çå¥³äººå¿"", ""èµæ·±è¶æ"" ,  ""èåºæ°å¥³æ§ææè¡å¨"", "" æ¨æ¾è®¿è°å½""  (èªç¬¬192æåä»¥åçè ç®),""äººçç¸å¯¹è®º "", "" å¤©ä¸å¥³äºº"", and ""æ­£éæ¥"" cannot be edited in any way;\n\n3) For Titles listed in Schedule A4:\n\nOther than the versions (dubbed or translated) in which the Titles in Schedule A4 already exist in (and were delivered in), no further dubbing, translation, or editing may be performed by any party on Schedule A4\'s Titles.', 'Licensor hereby grants Licensee a non-exclusive license to use the logos, trademarks and service marks used by Licensor to identify the Titles (collectively, ""Licensor Marks"") in connection with the use of the Titles as set forth in this Agreement.']",Yes,[],No,[],No,[],No,[],No,"['In exchange for the Share Consideration, Licensor hereby grants to Licensee a non-exclusive, royalty-free, perpetual and non-perpetual license (subject to the duration and scope, and format limitations for which Licensor has the rights to each Title as specified in Schedule A1-A6 of Schedule A) to:\n\ni. license, exhibit, distribute, reproduce, transmit, perform, display, and otherwise exploit and make available each Title within the Territory in any language by VOD (including SVOD, TVOD, AVOD and free VOD) for Internet, TV and mobile platforms (including, but not limited to, OTT streaming services, Sites and Mobile Sites), subject to these limitations for each of the Title in Schedule A1-A6:\n\n1) For Titles listed in Schedule A1-A2:\n\nLicensor can only grant Licensee distribution rights to up to six (6) MSOs plus two (2) of China\'s Internet TV license holders or their OTT Internet-based video partners by VOD (including SVOD, TVOD, AVOD and free VOD). China\'s current Internet TV license holders include: CNTV (ä¸­å½ç½ç»çµè§å°/æªæ¥çµè§), BesTV (ç¾è§é), Wasu (åæ°), Southern Media Cooperation (åæ¹ä¼ åª), Hunan TV (èæ TV), China National Radio/Galaxy Internet TV (GITV) (é¶æ²³çµè§), and China Radio International (ä¸­å½å½é å¹¿æ­çµå°);<omitted>2) For Titles listed in Schedule A3:\n\nFor ""å¤©ä¸å¥³äºº"": No satellite TV broadcasting rights granted. Titles other than ""ç çå¥³äººå¿"", ""èµæ·±è¶æ"" ,  ""èåºæ°å¥³æ§ææè¡å¨"", "" æ¨æ¾è®¿è°å½""  (èªç¬¬192æåä»¥åçè ç®),""äººçç¸å¯¹è®º "", "" å¤©ä¸å¥³äºº"", and ""æ­£éæ¥"" cannot be edited in any way;\n\n3) For Titles listed in Schedule A4:\n\nOther than the versions (dubbed or translated) in which the Titles in Schedule A4 already exist in (and were delivered in), no further dubbing, translation, or editing may be performed by any party on Schedule A4\'s Titles.\n\n4) For Titles listed in Schedule A5 (except ""Summer in February""):\n\nLimitations on Rights Granted: the following distribution methods are permitted: non-theatrical, public video, ship and hotel rights (all not earlier than the US theatrical release); home video rental, home video sell through, and commercial video rights (all not earlier than the US video release); cable TV (pay & free), terrestrial TV (pay & free), satellite pay TV; internet TV (pay & free), residential and non-residential pay-per-view, residential and non-residential internet pay-per-view, VOD, near VOD, and internet VOD (all no earlier than the corresponding exploitation in the USA).', 'Sections 2(a) [License Grant], 2(b) [Sublicensing], 2(c) [Display of Titles], 2(d) [Removal of Titles], 3, and 11 shall survive the expiration or termination of this Agreement: (i) in perpetuity with respect to Titles for which the licenses granted in Section 2(a) [License Grant] are perpetual; and (ii) for the duration of the applicable license term specified in Schedule A with respect to Titles for which the license term specified in Schedule A extends beyond the expiration or termination of this Agreement.']",Yes,[],No
DeltathreeInc_19991102_S-1A_EX-10.19_6227850_EX-10.19_Co-Branding Agreement_ Service Agreement.pdf,['CO-BRANDING AND SERVICES AGREEMENT'],[],No,[],No,"[""Throughout the Term of this Agreement, the parties hereby agree to grant to each other a limited license to use each other's proprietary marks solely in connection with the sale, distribution, marketing and promotion of each party's calling cards by the other party.""]",Yes,[],No,[],No,[],No,[],No,[],No,[],No
EdietsComInc_20001030_10QSB_EX-10.4_2606646_EX-10.4_Co-Branding Agreement.pdf,['CO-BRANDING AGREEMENT'],[],No,[],No,"[""Women.com hereby grants eDiets a non-exclusive, non-transferable, royalty-free worldwide right and license without the right to sublicense to use the Women.com Marks during the Term solely in connection with (i) the fulfillment of eDiets' obligations under this Agreement, and (ii) in advertising and marketing collateral related to this Agreement."", 'eDiets hereby grants to Women.com, subject to the terms and conditions of this Agreement, a non-exclusive, nontransferable, worldwide, royalty-free license to use, copy, reproduce and display the editorial content and other data, branding and other identification provided by eDiets to Women.com in connection with this Agreement (the ""eDiets Content"") on the Women.com Sites: (i) for publication in the Diet Center and elsewhere throughout the Women.com Sites; (ii) for the promotion of eDiets and the Diet Center on the Women.com Sites and in collateral advertising materials; and (iii) for such other purposes as are consistent with or otherwise authorized under this Agreement.', ""eDiets hereby grants Women.com a non-exclusive, non-transferable, royalty-free worldwide right and license without the right to sublicense to use the eDiets Marks during the Term solely in connection with (i) the fulfillment of Women.com's obligations under this Agreement, and (ii) in advertising and marketing collateral related to this Agreement.""]",Yes,"[""Women.com hereby grants eDiets a non-exclusive, non-transferable, royalty-free worldwide right and license without the right to sublicense to use the Women.com Marks during the Term solely in connection with (i) the fulfillment of eDiets' obligations under this Agreement, and (ii) in advertising and marketing collateral related to this Agreement"", 'eDiets hereby grants to Women.com, subject to the terms and conditions of this Agreement, a non-exclusive, nontransferable, worldwide, royalty-free license to use, copy, reproduce and display the editorial content and other data, branding and other identification provided by eDiets to Women.com in connection with this Agreement (the ""eDiets Content"") on the Women.com Sites: (i) for publication in the Diet Center and elsewhere throughout the Women.com Sites; (ii) for the promotion of eDiets and the Diet Center on the Women.com Sites and in collateral advertising materials; and (iii) for such other purposes as are consistent with or otherwise authorized under this Agreement.', ""eDiets hereby grants Women.com a non-exclusive, non-transferable, royalty-free worldwide right and license without the right to sublicense to use the eDiets Marks during the Term solely in connection with (i) the fulfillment of Women.com's obligations under this Agreement, and (ii) in advertising and marketing collateral related to this Agreement.""]",Yes,[],No,[],No,[],No,[],No,[],No
IntegrityMediaInc_20010329_10-K405_EX-10.17_2373875_EX-10.17_Co-Branding Agreement.pdf,['PRODUCT DEVELOPMENT AND CO-BRANDING AGREEMENT'],[],No,"['The parties hereby agree that the                   copyright in the Product sound recording compilation will be                   jointly registered by Integrity in the names of Integrity                   and TL.', 'TL will trademark the series name in joint                   names of TL and Integrity.']",Yes,"['TL hereby grants to Integrity the right to use                   its ""TL Music"" name and logo (""the TL Trademarks"") in                   connection with the products produced during the Term of this                   Agreement for as long as the parties continue to sell and                   distribute such products at no additional cost to Integrity,                   and in accordance with the terms and conditions contained                   herein.', 'Integrity hereby grants to TL the right                   to use its ""Integrity Music"" name and logo (""the Integrity                   Trademarks\') in connection with the products produced during                   the Term of this Agreement for as long as the parties continue                   to sell and distribute such products at no additional cost to                   TL, and in accordance with the terms and conditions contained                   herein.', 'TL will hold exclusive worldwide                   rights to promote and sell the product through the following                   distribution channels: Outgoing telemarketing, General Market                   retail, and General Market catalogs, and exclusive rights                   within the United States for Television Direct response.']",Yes,[],No,[],No,[],No,[],No,[],No,[],No
