HarpoonTherapeuticsInc_20200312_10-K_EX-10.18_12051356_EX-10.18_Development Agreement_Option Agreement.pdf,['DEVELOPMENT AND OPTION AGREEMENT'],"[""EXCEPT (A) FOR FRAUD, WILLFUL MISCONDUCT OR GROSS NEGLIGENCE, (B) FOR A PARTY'S BREACH OF ITS OBLIGATIONS UNDER [ARTICLE 9 OR SECTION 5.8], (C) AS PROVIDED UNDER [***] AND (D) TO THE EXTENT ANY SUCH DAMAGES ARE REQUIRED TO BE PAID TO A THIRD PARTY AS PART OF A CLAIM FOR WHICH A PARTY PROVIDES INDEMNIFICATION UNDER THIS ARTICLE 11, NEITHER PARTY NOR ANY OF ITS AFFILIATES SHALL BE LIABLE FOR INDIRECT, INCIDENTAL, SPECIAL, EXEMPLARY, PUNITIVE OR CONSEQUENTIAL DAMAGES, INCLUDING LOSS OF PROFITS OR BUSINESS INTERRUPTION, HOWEVER CAUSED AND ON ANY THEORY OF LIABILITY, WHETHER IN CONTRACT, TORT, NEGLIGENCE, BREACH OF STATUTORY DUTY OR OTHERWISE IN CONNECTION WITH OR ARISING IN ANY WAY OUT OF THE TERMS OF THIS AGREEMENT OR THE TRANSACTIONS CONTEMPLATED HEREBY OR THE USE OF THE LICENSED COMPOUNDS OR LICENSED PRODUCTS, EVEN IF ADVISED OF THE POSSIBILITY OF SUCH DAMAGES.""]",Yes,"[""EXCEPT (A) FOR FRAUD, WILLFUL MISCONDUCT OR GROSS NEGLIGENCE, (B) FOR A PARTY'S BREACH OF ITS OBLIGATIONS UNDER [ARTICLE 9 OR SECTION 5.8], (C) AS PROVIDED UNDER [***] AND (D) TO THE EXTENT ANY SUCH DAMAGES ARE REQUIRED TO BE PAID TO A THIRD PARTY AS PART OF A CLAIM FOR WHICH A PARTY PROVIDES INDEMNIFICATION UNDER THIS ARTICLE 11, NEITHER PARTY NOR ANY OF ITS AFFILIATES SHALL BE LIABLE FOR INDIRECT, INCIDENTAL, SPECIAL, EXEMPLARY, PUNITIVE OR CONSEQUENTIAL DAMAGES, INCLUDING LOSS OF PROFITS OR BUSINESS INTERRUPTION, HOWEVER CAUSED AND ON ANY THEORY OF LIABILITY, WHETHER IN CONTRACT, TORT, NEGLIGENCE, BREACH OF STATUTORY DUTY OR OTHERWISE IN CONNECTION WITH OR ARISING IN ANY WAY OUT OF THE TERMS OF THIS AGREEMENT OR THE TRANSACTIONS CONTEMPLATED HEREBY OR THE USE OF THE LICENSED COMPOUNDS OR LICENSED PRODUCTS, EVEN IF ADVISED OF THE POSSIBILITY OF SUCH DAMAGES.""]",Yes,[],No,[],No,"[""The types of insurance, and minimum limits shall be:\n\n(a) Worker's Compensation with statutory limits in compliance with the Worker's Compensation laws of the state or states in which the Party has employees in the United States (excluding Puerto Rico).\n\n(b) Employer's Liability coverage with a minimum limit of [***] provided that a Party has employees in the United States (excluding Puerto Rico).<omitted>(c) General Liability Insurance with a minimum limit of [***] and [***] in the aggregate. General Liability Insurance shall include Clinical Trial Insurance. The limits may be met with a combination of primary and commercial umbrella insurance."", 'Upon request by a Party, the other Party shall provide Certificates of Insurance evidencing compliance with this Section. The insurance policies shall be under an occurrence form, but if only a claims-made form is available to a Party, then such Party shall continue to maintain such insurance after the expiration or termination of this Agreement for the longer of (a) a period of [***] following termination or expiration of this Agreement in its entirety, or (b) with respect to a particular Party, [***] by a Party.', 'Such insurance (a) shall be primary insurance with respect to each Party\'s own participation under this Agreement, (b) shall be issued by a recognized insurer rated by A.M. Best ""A-VII"" (or its equivalent) or better, or an insurer pre- approved in writing by the other Party, and (c) shall list the other Party as an additional insured under the General Liability Policy.', 'Each Party shall obtain and carry in full force and effect the minimum insurance requirements set forth herein.']",Yes,"['Harpoon shall not, and shall not permit its Affiliates to, attack, dispute, or contest the validity of or ownership of such Product Trademark anywhere in the Territory or any registrations issued or issuing with respect thereto or use in their respective businesses, any Trademark that is confusingly similar to, misleading or deceptive with respect to or that dilutes any (or any part) of the Product Trademarks.']",Yes,[],No
IbioInc_20200313_8-K_EX-10.1_12052678_EX-10.1_Development Agreement.pdf,['MASTER JOINT DEVELOPMENT AGREEMENT'],"['Except for claims arising out of Articles 4.3 and 7.0, or as may be set forth in a SOW, neither Party will be liable for any consequential damages, lost profits, lost savings, loss of anticipated revenue, or any exemplary, punitive, special or indirect damages, even if advised of their possibility.']",Yes,"['Except for claims arising out of Articles 4.3 and 7.0, or as may be set forth in a SOW, neither Party will be liable for any consequential damages, lost profits, lost savings, loss of anticipated revenue, or any exemplary, punitive, special or indirect damages, even if advised of their possibility.']",Yes,[],No,[],No,[],No,[],No,[],No
HfEnterprisesInc_20191223_S-1_EX-10.22_11931299_EX-10.22_Development Agreement.pdf,['OUTSOURCE TECHNOLOGY DEVELOPMENT AGREEMENT'],[],No,[],No,[],No,[],No,[],No,"[""Developer may not contest the validity of, by act or omission jeopardize, or take any action inconsistent with, DSS's ownership rights or goodwill in the Technology or Improvements, including any attempted registration of the Technology or Improvements in Hong Kong or in any other legal jurisdiction, or any attempts to license the same to any unauthorized third Person."", 'Developer agrees that it will not at any time (i) do or cause to be done any act or thing contesting or in any way impairing any part of such right, title and interest or (ii) represent, expressly or by implication that it has any right, title or interest in or to any of the foregoing other than as expressly set forth herein.']",Yes,[],No
LegacyEducationAllianceInc_20200330_10-K_EX-10.18_12090678_EX-10.18_Development Agreement.pdf,['REAL ESTATE EDUCATION TRAINING PROGRAM DEVELOPMENT AGREEMENT'],"[""EXCEPT FOR AMOUNTS PAYABLE TO THIRD PARTIES IN CONNECTION WITH CLAIMS SUBJECT TO THE INDEMNIFICATION PROVISIONS OF SECTION 9.1 OR A BREACH OF EITHER PARTY'S OBLIGATIONS UNDER SECTION 5 (CONFIDENTIALITY), NEITHER PARTY WILL, UNDER ANY CIRCUMSTANCES, BE LIABLE TO THE OTHER PARTY FOR ANY LOST PROFITS OR ANY OTHER SPECIAL, INDIRECT OR CONSEQUENTIAL DAMAGES ARISING OUT OF OR RELATING TO THIS AGREEMENT EVEN IF THE PARTY HAS BEEN NOTIFIED OF THE POSSIBILITY OF SUCH DAMAGES.""]",Yes,"[""EXCEPT FOR AMOUNTS PAYABLE TO THIRD PARTIES IN CONNECTION WITH CLAIMS SUBJECT TO THE INDEMNIFICATION PROVISIONS OF SECTION 9.1 OR A BREACH OF EITHER PARTY'S OBLIGATIONS UNDER SECTION 5 (CONFIDENTIALITY), NEITHER PARTY WILL, UNDER ANY CIRCUMSTANCES, BE LIABLE TO THE OTHER PARTY FOR ANY LOST PROFITS OR ANY OTHER SPECIAL, INDIRECT OR CONSEQUENTIAL DAMAGES ARISING OUT OF OR RELATING TO THIS AGREEMENT EVEN IF THE PARTY HAS BEEN NOTIFIED OF THE POSSIBILITY OF SUCH DAMAGES.""]",Yes,[],No,[],No,"['In any instance to which such indemnities pertain, LEA shall obtain and maintain necessary insurance, including, without limitation, Commercial General Liability Insurance, including product liability insurance, trademark infringement, copyright infringement, defamation, contractual liability and personal and advertising injury liability insurance in an amount no less than ten million dollars ($10,000,000.00) per occurrence and ten million dollars ($10,000,000.00) aggregate combined single limit.', 'T&B and Tarek El Moussa shall be named as an additional insured on such insurance and proof of such inclusion shall be provided to T&B.']",Yes,"[""LEA shall not at any time do or cause to be done any act, omission, or thing contesting or in any way impairing or tending to impair any part of T&B's right, title and interest in the Licensed Intellectual Property.""]",Yes,[],No
LiquidmetalTechnologiesInc_20200205_8-K_EX-10.1_11968198_EX-10.1_Development Agreement.pdf,['BUSINESS DEVELOPMENT AGREEMENT'],[],No,"['NEITHER PARTY SHALL BE LIABLE TO OTHER PARTY FOR ANY LOST PROFITS, LOST REVENUES, OR ANY OTHER INCIDENTAL, INDIRECT, PUNITIVE, SPECIAL OR CONSEQUENTIAL DAMAGES WHATSOEVER ARISING OUT OF THIS AGREEMENT OR ANY ORDER, OR OUT OF THE PERFORMANCE OR BREACH OF THIS AGREEMENT OR ANY ORDER, EVEN IF THE PARTY HAS BEEN ADVISED OF THE POSSIBILITY OF SUCH DAMAGES.']",Yes,[],No,"['Unless Liquidmetal notifies Eutectix that the Liquidmetal Product does not meet the Specifications within thirty (30) calendar days after receipt of the Liquidmetal Product, then the Liquidmetal Product shall be deemed Accepted.']",Yes,"['To the extent any insurance coverage required under this Agreement is purchased on a ""claims-made"" basis, such insurance shall cover all prior acts of Eutectix during the term of this Agreement, and such insurance shall be continuously maintained until at least two (2) years beyond the expiration or termination of the term of this Agreement, or Eutectix shall purchase ""tail"" coverage, effective upon termination of any such policy or upon termination or expiration of the term of this Agreement, to provide coverage for at least two (2) years from the occurrence of either such event.', 'Eutectix shall obtain, pay for, and maintain insurance meeting or exceeding the minimum insurance requirements set forth on Schedule 2 attached hereto, with policy terms satisfactory to Liquidmetal.', ""Eutectix shall obtain, pay for, and maintain in full force and effect throughout the term of this Agreement insurance as follows: (a) Workers' Compensation and Employers' Liability insurance with limits to conform with the greater of the amount required by applicable law or one million dollars ($1,000,000) each accident, including occupational disease coverage and an endorsement to the Workers' Compensation and Employers' Liability insurance policy, in form acceptable to Liquidmetal, containing a waiver of subrogation by the insurance carrier with respect to Liquidmetal and its parent, subsidiaries, divisions and Affiliates, and all of their respective directors, officers, shareholders, employees and representatives; (b) Commercial General Liability insurance with limits of not less than five million dollars ($5,000,000) combined single limit for bodily injury, death, and property damage, including personal injury, contractual liability, independent contractors, broad- form property damage, and products and completed operations coverage; and, (c) Commercial Automobile Liability insurance with limits of not less than one million dollars ($1,000,000) each occurrence combined single limit of liability for bodily injury, death, and property damage, including owned and non-owned and hired automobile coverages, as applicable."", 'Eutectix shall, at its own expense: (c) keep the Licensed Equipment in a suitable place, safe from loss or damage; (d) subscribe to an insurance policy from an insurance company reasonably acceptable to Eutectix covering the Licensed Equipment at full replacement value against fire, theft and such other normal business risks, with a waiver of subrogation in favor of Liquidmetal and with Liquidmetal to be named as an additional insured and loss payee, and provide, upon receipt of a written request from Liquidmetal, a certificate evidencing such insurance, and comply with all requirements associated with such insurance policy;', ""Eutectix's liability under the Agreement shall not be limited or modified in any way by the amount or terms of any insurance it is required to maintain hereunder.""]",Yes,[],No,[],No
NlsPharmaceuticsLtd_20200228_F-1_EX-10.14_12029046_EX-10.14_Development Agreement.pdf,['License and Development Agreement'],[],No,"['Either Party shall only be liable for direct losses incurred by the other Party as a direct consequence of a negligent or intentional breach of this Agreement by such liable Party, and shall not be liable for any punitive or indirect damages, losses caused by business interruptions, loss of revenues, loss of profit, damages and loss of goodwill, or any reputational damages, and both Parties waive any claims to such losses.', 'In addition, neither Party shall be liable for any claim under this Agreement which is capable of remedy, unless and until the other Party has given such Party written notice containing full details of the breach and such Party has failed to remedy the breach within sixty (60) days of receipt of the notice.']",Yes,[],No,[],No,[],No,[],No,[],No
PhasebioPharmaceuticalsInc_20200330_10-K_EX-10.21_12086810_EX-10.21_Development Agreement.pdf,['CO-DEVELOPMENT AGREEMENT'],[],No,"['TO THE MAXIMUM EXTENT PERMITTED BY LAW AND NOTWITHSTANDING ANY PROVISION IN THIS AGREEMENT TO THE CONTRARY, NEITHER PARTY WILL BE LIABLE TO THE OTHER PARTY FOR ANY INDIRECT, INCIDENTAL, CONSEQUENTIAL, SPECIAL, RELIANCE OR PUNITIVE DAMAGES OR LOST OR IMPUTED PROFITS OR ROYALTIES OR COST OF PROCUREMENT OF SUBSTITUTE GOODS OR SERVICES, WHETHER LIABILITY IS ASSERTED IN CONTRACT, TORT (INCLUDING NEGLIGENCE AND STRICT PRODUCTS LIABILITY), INDEMNITY OR CONTRIBUTION, AND IRRESPECTIVE OF WHETHER THAT PARTY OR ANY REPRESENTATIVE OF THAT PARTY HAS BEEN ADVISED OF, OR OTHERWISE MIGHT HAVE ANTICIPATED THE POSSIBILITY OF, ANY SUCH LOSS OR DAMAGE.', 'THE PARTIES AGREE THAT THE LIMITATIONS SPECIFIED IN THIS SECTION 15.11 WILL APPLY EVEN IF ANY LIMITED REMEDY SPECIFIED IN THIS AGREEMENT IS FOUND TO HAVE FAILED OF ITS ESSENTIAL PURPOSE. WITHOUT LIMITING THE GENERALITY OF THE FOREGOING, ""CONSEQUENTIAL DAMAGES"" WILL BE DEEMED TO INCLUDE, AND NEITHER PARTY WILL BE LIABLE TO THE OTHER PARTY OR ANY OF SUCH OTHER PARTY\'S AFFILIATES, REPRESENTATIVES OR STOCKHOLDERS FOR ANY DAMAGES BASED ON OR MEASURED BY LOSS OF PROJECTED OR SPECULATIVE FUTURE SALES OF THE PRODUCT, ANY PAYMENT DUE UPON ANY UNACHIEVED EVENT UNDER ARTICLE 6, OR ANY OTHER UNEARNED, SPECULATIVE OR OTHERWISE CONTINGENT PAYMENTS PROVIDED FOR IN THIS AGREEMENT.', 'Each Party expressly waives and foregoes any right to consequential, punitive, special, exemplary or similar damages or lost profits.']",Yes,"['In the event that SFJ terminates this Agreement pursuant to this Section 14.2.1 then in exchange for purchasing the Trial Data Package including the Research Results included therein as set forth in Section 11.1.1.4, PB will pay SFJ, within [***] of the date of termination, an amount equal to three hundred percent (300%) of Development Costs paid or incurred by SFJ prior to such termination.']",Yes,[],No,"['PB will obtain such Clinical Trials Liability insurance on a global basis, and, if required, supplemented Clinical Trials Liability Insurance in the US, at its expense and SFJ will obtain supplemental Clinical Trials Liability insurance for the SFJ Territory and on a country specific basis in the European Clinical Trial Countries as required by Applicable Law at its expense, which will be considered Development Costs.', 'Coverage must be maintained for as long as required by Applicable Law in each country after release of the last Subject from the Clinical Trials or where there is no legal requirement at least [***] after the termination of this Agreement.', 'Commencing as of the start of the Clinical Trials and thereafter, during the Term (or longer if otherwise stated below), at a minimum, each Party will maintain the following types of insurance coverage at a minimum level that is the greater of (a) the highest minimum level required by Applicable Law in the countries in which the Clinical Trials and other obligations hereunder are being performed or (b) the following (to the extent different).', 'Coverage must be maintained for at least [***] after the later of (i) expiration or early termination of this Agreement and (ii) release of the last Subject from the Clinical Trials.', ""Each Party will include the other Party and its Affiliates as additional insured parties on such Party's Clinical Trial Liability insurance, as set forth in Section 12.3.2.3 for [***] after the later of termination of this Agreement or release of the last Subject from the Clinical Trials."", 'Prior to a Program Transfer, PB will be responsible for maintaining product liability insurance related to the Development and<omitted>Commercialization of the Product at its expense with SFJ to be named as an additional insured party.', 'Any subcontractor, including any Permitted Third Party, who provides professional services to such Party for the Clinical Trials, will obtain Professional Liability Insurance in lieu of Clinical Trial Insurance, with a minimum limit of [***] dollars ($[***]) per occurrence.', 'Any deductibles for such insurance policies will be assumed by the insuring Party.', 'Umbrella Excess Liability: [***] dollars ($[***]) per occurrence.', 'From and after a Program Transfer, SFJ will be responsible for maintaining product liability insurance related to the Development and Commercialization of the Product at its expense with PB to be named as an additional insured party.', 'Commercial General Liability: [***] dollars ($[***]) per occurrence; [***] dollars ($[***]) Product and Completed Operations aggregate, including Premises & Operations, Personal Injury, Product and Completed Operations; [***] dollars ($[***]) combined single limit on all owned, non-owned and hired vehicles of such Party.', 'Clinical Trials Liability: [***] dollars ($[***]) per occurrence.', 'Commencing as of the Effective Date and thereafter during the Development Term, and subject to Section 12.3.2 below, each Party will carry and maintain, at its own expense, insurance coverage of the kind and with liability limits that, at a minimum, satisfy the requirements of Section 12.3.2, to protect itself and the other Party against any claims or liabilities that may arise from the conduct of the Clinical Trials and all other rights and obligations hereunder with insurers with a minimum ""A-"" A.M. Best rating.']",Yes,[],No,[],No
RevolutionMedicinesInc_20200117_S-1_EX-10.1_11948417_EX-10.1_Development Agreement.pdf,"['COLLABORATIVE RESEARCH, DEVELOPMENT AND COMMERCIALIZATION AGREEMENT']","[""NOTHING IN THIS SECTION 14.5 IS INTENDED TO OR SHALL LIMIT OR RESTRICT THE INDEMNIFICATION RIGHTS OR OBLIGATIONS OF ANY PARTY UNDER SECTION 14.1 OR SECTION 14.2, OR DAMAGES AVAILABLE FOR A PARTY'S BREACH OF ITS OBLIGATIONS RELATING TO CONFIDENTIALITY UNDER ARTICLE XI OR INTELLECTUAL PROPERTY UNDER ARTICLE X.""]",Yes,"['NEITHER PARTY SHALL BE LIABLE TO THE OTHER FOR ANY SPECIAL, CONSEQUENTIAL, INCIDENTAL, PUNITIVE, OR INDIRECT DAMAGES OR LOST PROFITS ARISING FROM OR RELATING TO ANY BREACH OF THIS AGREEMENT, REGARDLESS OF ANY NOTICE OF THE POSSIBILITY OF SUCH DAMAGES.']",Yes,[],No,[],No,"['Each Party shall procure and maintain insurance, including product liability insurance, with respect to its activities hereunder and under the Ancillary Agreements and which is consistent with normal business practices of companies similarly situated at all times during which any SHP2 Inhibitors or Product is being clinically tested in human subjects or commercially distributed or sold.', 'Each Party shall provide the other Party with evidence of such insurance upon request and, in the case of RevMed, shall provide Sanofi with written notice at least [***] prior to the cancellation, non-renewal or material changes in such insurance.']",Yes,[],No,[],No
RitterPharmaceuticalsInc_20200313_S-4A_EX-10.54_12055220_EX-10.54_Development Agreement.pdf,['DISTRIBUTION AND DEVELOPMENT AGREEMENT'],[],No,[],No,"['In the event of any breach of Sections 9.1 through 9.3, including without limitation, any actions by stockholders of Qualigen that result in a Sale Transaction without complying with Sections 9.1 through 9.3 above, or otherwise hinder the intent and purpose of the provisions of Sections 9.1 through 9.3 above, in addition to any other remedies available to Sekisui under the terms of this Agreement, including the right to specific performance and other equitable remedies, Sekisui shall be entitled to liquidated damages in the amount of three times any and all Financing Payments made to date.']",Yes,"['Qualigen shall provide to Sekisui and for the benefit of Sekisui\'s customers of Products a standard commercial written warranty that the Products will be free of defects in materials or workmanship starting from the date the Product has been received by Sekisui\'s customer and ending after the length of time stated for the applicable Product on Exhibit D hereto (the ""User Warranty"").']",Yes,"['Combined single limit for bodily and property damage of not less than $1,000,000 for each occurrence and $2,000,000 annual aggregate providing: â Assault and Battery coverage, â Broad form property damage coverage, â Broad form contractual liability coverage, â Products and completed operations coverage, and â Personal and advertising injury coverage.', 'The Insurance shall be primary for all purposes to other insurance coverage, whether such other insurance is stated to be primary, contributory, excess, contingent or otherwise, without recourse to or contribution from any Sekisui-owned coverage.', 'Sekisui shall be named as an additional insured with respect to the Insurance.', 'insurance program that is approved by Sekisui. Qualigen shall provide Sekisui, upon request, with written evidence of the Insurance, including where it is provided through qualified self-insurance.', ""Workers' Compensation and Employer's Liability Insurance - With limits of liability for: â Workers' compensation as required by statute; â Employer's liability for bodily injury by accident: $500,000 each accident; bodily injury by disease: $500,000 policy limit; and bodily injury by disease: $500,000 each employee."", 'Qualigen, at its own expense, shall procure and maintain during the Term, insurance policies with the minimum coverages set forth below (""Insurance"").', ""All Qualigen's Insurance shall be placed with an insurer that (a) has an A.M. Best rating of A- or better or (b) is a qualified self- insurance program that is approved by Sekisui.""]",Yes,"['During and after the Term, neither Party shall register, use or claim ownership or other rights in any logo, trade name, brand name or trademark of the other Party in existence during the Term (nor any logo, trade name, brand name or trademark confusingly similar to any logo, trade name, brand name or trademark of the other Party in existence during the Term), nor assist anyone else to do so, nor make or assist in any challenge to any logo, trade name, brand name or trademark of the other Party in existence during the Term.']",Yes,[],No
VgrabCommunicationsInc_20200129_10-K_EX-10.33_11958828_EX-10.33_Development Agreement.pdf,['Mobile Application Development Agreement'],[],No,[],No,[],No,"['Change Orders do not however cover any bug or glitch fixing produced out of the code written by Developer as any ""bug"" will be fixed by Developer for free up to 3 months after final delivery (Bug Fixing Warranty).']",Yes,[],No,[],No,[],No
ChinaRealEstateInformationCorp_20090929_F-1_EX-10.32_4771615_EX-10.32_Content License Agreement.pdf,['DOMAIN NAME AND CONTENT LICENSE AGREEMENT'],[],No,[],No,[],No,[],No,[],No,"['Except as expressly permitted under the Trademark License Agreement, Licensee shall not knowingly (a) use the Licensed  Domain Names in any manner that tarnishes, degrades, disparages or reflects adversely on Licensor or Licensor\'s business or reputation, (b) in  any jurisdiction, register or attempt to register any domain names that consist of, in whole or in part, or are confusingly similar to, the term ""SINA"",  (c) contest, challenge or otherwise make any claim or take any action adverse to Licensor\'s interest in the Licensed Domain Names, (d) register any  trademarks, trade names or company names that consist of, in whole or in part, or are confusingly similar to the term ""SINA"" in the name of  Licensee or of any of its Affiliates, or (e) use the Licensed Content and other Content for any unlawful purpose, including but not limited to  displaying or distributing any pornographic, obscene or sexually explicit material, materials of a violent nature, or politically sensitive materials.']",Yes,[],No
AlliedEsportsEntertainmentInc_20190815_8-K_EX-10.19_11788293_EX-10.19_Content License Agreement.pdf,['JOINT CONTENT LICENSE AGREEMENT'],"['EXCEPT IN CASES OF GROSS NEGLIGENCE, WILLFUL MISCONDUCT OR FRAUD, INDEMNIFICATION CLAIMS UNDER SECTION 5 OR BREACHES OF SECTION 2 (TRADEMARKS), 8 (CONFIDENTIALITY), OR 9 (NO AGENCY RELATIONSHIP), IN NO EVENT SHALL EITHER PARTY OR ITS OFFICERS, DIRECTORS, OR EMPLOYEES BE LIABLE TO THE OTHER PARTY IN CONNECTION WITH THE SUBJECT MATTER HEREOF, FOR ANY SPECIAL, INDIRECT, CONSEQUENTIAL OR PUNITIVE DAMAGES OF ANY KIND, LOST PROFITS OR LOST REVENUE, WHETHER ARISING IN CONTRACT, TORT, NEGLIGENCE, STATUTE, OR OTHERWISE, EVEN IF ADVISED OF THE POSSIBILITY THEREOF.']",Yes,"['EXCEPT IN CASES OF GROSS NEGLIGENCE, WILLFUL MISCONDUCT OR FRAUD, INDEMNIFICATION CLAIMS UNDER SECTION 5 OR BREACHES OF SECTION 2 (TRADEMARKS), 8 (CONFIDENTIALITY), OR 9 (NO AGENCY RELATIONSHIP), IN NO EVENT SHALL EITHER PARTY OR ITS OFFICERS, DIRECTORS, OR EMPLOYEES BE LIABLE TO THE OTHER PARTY IN CONNECTION WITH THE SUBJECT MATTER HEREOF, FOR ANY SPECIAL, INDIRECT, CONSEQUENTIAL OR PUNITIVE DAMAGES OF ANY KIND, LOST PROFITS OR LOST REVENUE, WHETHER ARISING IN CONTRACT, TORT, NEGLIGENCE, STATUTE, OR OTHERWISE, EVEN IF ADVISED OF THE POSSIBILITY THEREOF.']",Yes,[],No,[],No,['Each party agrees to carry liability insurance sufficient to cover the risks posed under this Agreement.'],Yes,"[""Licensee will not, at any time during or after this Agreement, register, attempt to register, claim any interest in, contest the use of, or otherwise adversely affect the validity of any of Licensor's marks (including, without limitation, any act or assistance to any act, which may infringe or lead to the infringement of any such marks).""]",Yes,[],No
