Filename,Document Name,Uncapped Liability,Uncapped Liability-Answer,Cap On Liability,Cap On Liability-Answer,Liquidated Damages,Liquidated Damages-Answer,Warranty Duration,Warranty Duration-Answer,Insurance,Insurance-Answer,Covenant Not To Sue,Covenant Not To Sue-Answer,Third Party Beneficiary,Third Party Beneficiary-Answer
CybergyHoldingsInc_20140520_10-Q_EX-10.27_8605784_EX-10.27_Affiliate Agreement.pdf,['MARKETING AFFILIATE AGREEMENT'],[],No,"['The foregoing states the entire liability of Company with respect to infringement of intellectual property rights.', ""Company's liability shall not exceed the fees that MA has paid under this Agreement."", 'Company is not liable for incidental, special or consequential damages for any reason (including loss of data or other business or property damage), even if foreseeable or if MA or Customer has advised of such a claim.', 'IN NO EVENT SHALL COMPANY BE LIABLE TO ""MA"", ITS CLIENTS, OR ANY THIRD PARTY FOR ANY TORT OR CONTRACT DAMAGES OR INDIRECT, SPECIAL, GENERAL, INCIDENTAL OR CONSEQUENTIAL DAMAGES, INCLUDING BUT NOT LIMITED TO, LOSS OF PROFITS OR ANTICIPATED PROFITS AND LOSS OF GOODWILL, ARISING IN CONNECTION WITH THE USE (OR INABILITY TO USE) OR DISTRIBUTION OF THE TECHNOLOGY FOR ANY PURPOSE WHATSOEVER.', ""COMPANY'S SOLE AND EXCLUSIVE LIABILITY FOR THE WARRANTY PROVIDED IN SUBPARAGRAH (A) HEREOF SHALL BE TO CORRECT THE TECHNOLOGY TO OPERATE IN SUBSTANTIAL ACCORDANCE WITH ITS THEN CURRENT SPECIFICATIONS OR REPLACE, AT ITS OPTION, THE TECHNOLOGY NOT IN COMPLIANCE WITH COMPANY'S AND COMPANY' PUBLISHED SPECIFICATIONS REGARDING THE TECHNOLOGY; PROVIDED, ANY CLAIM FOR BREACH OF WARRANTY UNDER SUBPARAGRAPH (A) HEREOF MUST BE MADE IN WRITING WITHIN (90) DAYS FROM DATE OF SHIPMENT""]",Yes,[],No,"[""COMPANY'S SOLE AND EXCLUSIVE LIABILITY FOR THE WARRANTY PROVIDED IN SUBPARAGRAH (A) HEREOF SHALL BE TO CORRECT THE TECHNOLOGY TO OPERATE IN SUBSTANTIAL ACCORDANCE WITH ITS THEN CURRENT SPECIFICATIONS OR REPLACE, AT ITS OPTION, THE TECHNOLOGY NOT IN COMPLIANCE WITH COMPANY'S AND COMPANY' PUBLISHED SPECIFICATIONS REGARDING THE TECHNOLOGY; PROVIDED, ANY CLAIM FOR BREACH OF WARRANTY UNDER SUBPARAGRAPH (A) HEREOF MUST BE MADE IN WRITING WITHIN (90) DAYS FROM DATE OF SHIPMENT.""]",Yes,[],No,[],No,[],No
EuromediaHoldingsCorp_20070215_10SB12G_EX-10.B(01)_525118_EX-10.B(01)_Content License Agreement.pdf,['VIDEO-ON-DEMAND CONTENT LICENSE AGREEMENT'],"['Except with respect to any claim or liability arising from an infringement of any third party intellectual property right, in no event shall either party be liable for any special, indirect, consequential, punitive or incidental damages of any kind.']",Yes,"['Except with respect to any claim or liability arising from an infringement of any third party intellectual property right, in no event shall either party be liable for any special, indirect, consequential, punitive or incidental damages of any kind']",Yes,[],No,[],No,[],No,[],No,[],No
FulucaiProductionsLtd_20131223_10-Q_EX-10.9_8368347_EX-10.9_Content License Agreement.pdf,['CONTENT DISTRIBUTION AND LICENSE AGREEMENT'],[],No,[],No,[],No,[],No,[],No,[],No,[],No
GopageCorp_20140221_10-K_EX-10.1_8432966_EX-10.1_Content License Agreement.pdf,['WEBSITE CONTENT LICENSE AGREEMENT'],"[""The provisions of Section 9.1 and Section 9.2 will not apply to limit the Licensee's indemnification obligations under Section 8.2, or in the case of Licensee's gross negligence or wilful misconduct.""]",Yes,"['NEITHER PARTY SHALL BE LIABLE UNDER OR IN CONNECTION WITH THIS AGREEMENT FOR INDIRECT, INCIDENTAL, CONSEQUENTIAL, LIQUIDATED, SPECIAL OR EXEMPLARY DAMAGES OR PENALTIES, INCLUDING WITHOUT LIMITATION, LOSSES OF BUSINESS, REVENUE OR ANTICIPATED PROFITS, REGARDLESS OF WHETHER SUCH DAMAGE WAS FORESEEABLE AND WHETHER LICENSOR HAS BEEN ADVISED OF THE POSSIBILITY OF SUCH DAMAGES.', ""EACH PARTY'S LIABILITY ARISING OUT OF OR RELATED TO THIS AGREEMENT WILL NOT EXCEED AN AMOUNT EQUAL TO THE AGGREGATE AMOUNTS PAID OR PAYABLE TO LICENSOR IN THE TWELVE (12) MONTHS PRECEDING THE COMMENCEMENT OF THE CLAIM.""]",Yes,[],No,[],No,[],No,[],No,[],No
IdeanomicsInc_20160330_10-K_EX-10.26_9512211_EX-10.26_Content License Agreement.pdf,['CONTENT LICENSE AGREEMENT'],"['EXCEPT FOR THE ABOVE INDEMNIFICATION OBLIGATIONS AND FOR BREACHES OF SECTION 14, NEITHER PARTY SHALL BE LIABLE TO THE OTHER FOR ANY INCIDENTAL, CONSEQUENTIAL, SPECIAL OR PUNITIVE DAMAGES ARISING OUT OF THIS AGREEMENT (INCLUDING, BUT NOT LIMITED TO, LOSS OF PROFITS), WHETHER IN AN ACTION OR ARISING OUT OF BREACH OF CONTRACT, TORT OR ANY OTHER CAUSE OF ACTION EVEN IF SUCH PARTY HAS BEEN ADVISED OF THE POSSIBILITY OF SUCH DAMAGES.']",Yes,"['EXCEPT FOR THE ABOVE INDEMNIFICATION OBLIGATIONS AND FOR BREACHES OF SECTION 14, NEITHER PARTY SHALL BE LIABLE TO THE OTHER FOR ANY INCIDENTAL, CONSEQUENTIAL, SPECIAL OR PUNITIVE DAMAGES ARISING OUT OF THIS AGREEMENT (INCLUDING, BUT NOT LIMITED TO, LOSS OF PROFITS), WHETHER IN AN ACTION OR ARISING OUT OF BREACH OF CONTRACT, TORT OR ANY OTHER CAUSE OF ACTION EVEN IF SUCH PARTY HAS BEEN ADVISED OF THE POSSIBILITY OF SUCH DAMAGES.']",Yes,[],No,[],No,[],No,[],No,[],No
DeltathreeInc_19991102_S-1A_EX-10.19_6227850_EX-10.19_Co-Branding Agreement_ Service Agreement.pdf,['CO-BRANDING AND SERVICES AGREEMENT'],[],No,"[""THE LIABILITY OF DELTATHREE FOR DAMAGES OR ALLEGED DAMAGES HEREUNDER, WHETHER IN CONTRACT, TORT OR ANY OTHER LEGAL THEORY, IS LIMITED TO, AND WILL NOT EXCEED, PRIMECALL'S DIRECT DAMAGES."", ""THE LIABILITY OF PRIMECALL FOR DAMAGES OR ALLEGED DAMAGES HEREUNDER, WHETHER IN CONTRACT, TORT OR ANY OTHER LEGAL THEORY, IS LIMITED TO, AND WILL NOT EXCEED, DELTATHREE'S DIRECT DAMAGES."", 'IN NO EVENT SHALL PRIMECALL BE LIABLE TO DELTATHREE FOR ANY SPECIAL, INCIDENTIAL OR CONSEQUENTIAL DAMAGES, INCLUDING, WITHOUT LIMITATION, LOSS OF PROFITS, REVENUES OR DATA WHETHER BASED ON BREACH OF CONTRACT, TORT OR OTHERWISE, WHETHER OR NOT DELTATHREE HAS BEEN ADVISED OF THE POSSIBILITY OF SUCH DAMAGE.', 'IN NO EVENT SHALL DELTATHREE BE LIABLE TO PRIMECALL FOR ANY SPECIAL, INCIDENTIAL OR CONSEQUENTIAL DAMAGES, INCLUDING, WITHOUT LIMITATION, LOSS OF PROFITS, REVENUES OR DATA WHETHER BASED ON BREACH OF CONTRACT, TORT OR OTHERWISE, WHETHER OR NOT PRIMECALL HAS BEEN ADVISED OF THE POSSIBILITY OF SUCH DAMAGE.']",Yes,[],No,[],No,[],No,[],No,[],No
EdietsComInc_20001030_10QSB_EX-10.4_2606646_EX-10.4_Co-Branding Agreement.pdf,['CO-BRANDING AGREEMENT'],"[""THE LIMITATIONS ON LIABILITY FOR DAMAGES SET FORTH IN THIS AGREEMENT SHALL BE INAPPLICABLE TO EACH PARTY'S CONTRACTUAL OBLIGATION TO INDEMNIFY THE OTHER PARTY AS SET FORTH IN SECTIONS 2.6 AND 13."", 'EXCEPT FOR BREACHES OF SECTION 11 OR BREACHES OF ANY LICENSE GRANT SET FORTH IN THIS AGREEMENT, IN NO EVENT WILL EITHER PARTY BE LIABLE TO THE OTHER FOR ANY SPECIAL, INCIDENTAL, INDIRECT OR CONSEQUENTIAL DAMAGES, WHETHER BASED ON BREACH OF CONTRACT, TORT (INCLUDING NEGLIGENCE) OR OTHERWISE, WHETHER OR NOT THAT PARTY HAS BEEN ADVISED OF, KNEW, OR SHOULD HAVE KNOWN OF, THE POSSIBILITY OF SUCH DAMAGE AND NOTWITHSTANDING THE FAILURE OF ESSENTIAL PURPOSE OF ANY LIMITED REMEDY.']",Yes,"['Each party agrees that the sole and exclusive remedy for a breach of the warranties set forth in this Section 12 shall be the indemnification set forth in Section 13 below.', 'EXCEPT FOR BREACHES OF SECTION 11 OR BREACHES OF ANY LICENSE GRANT SET FORTH IN THIS AGREEMENT, IN NO EVENT WILL EITHER PARTY BE LIABLE TO THE OTHER FOR ANY SPECIAL, INCIDENTAL, INDIRECT OR CONSEQUENTIAL DAMAGES, WHETHER BASED ON BREACH OF CONTRACT, TORT (INCLUDING NEGLIGENCE) OR OTHERWISE, WHETHER OR NOT THAT PARTY HAS BEEN ADVISED OF, KNEW, OR SHOULD HAVE KNOWN OF, THE POSSIBILITY OF SUCH DAMAGE AND NOTWITHSTANDING THE FAILURE OF ESSENTIAL PURPOSE OF ANY LIMITED REMEDY.']",Yes,[],No,[],No,[],No,"['At no time during the term of the Agreement or thereafter shall eDiets attack, challenge or file any application with respect to any Women.com Mark.', 'At no time during the term of the Agreement or thereafter shall Women.com attack, challenge or file any application with respect to any eDiets Mark.', ""Women.com acknowledges that eDiets owns all right, title and interest in and to the eDiets Content, and Women.com shall not now or in the future contest the validity of the eDiets' ownership rights in and to the eDiets Content.""]",Yes,[],No
IntegrityMediaInc_20010329_10-K405_EX-10.17_2373875_EX-10.17_Co-Branding Agreement.pdf,['PRODUCT DEVELOPMENT AND CO-BRANDING AGREEMENT'],[],No,[],No,[],No,[],No,[],No,"[""Integrity recognizes TL's title to the                   TL Trademarks and will not at any time do or suffer to be done                   any act or thing which will in any way impair TL's rights in                   and to the TL Trademarks."", ""TL recognizes Integrity's title                   to the Integrity Trademarks and will not at any time do or                   suffer to be done any act or thing which will in any way                   impair Integrity's rights in and to the Integrity Trademarks.""]",Yes,[],No
MusclepharmCorp_20170208_10-KA_EX-10.38_9893581_EX-10.38_Co-Branding Agreement.pdf,['ENDORSEMENT LICENSING AND CO-BRANDING AGREEMENT'],[],No,"['IN NO EVENT SHALL THE AS PARTIES BE LIABLE FOR SPECIAL, CONSEQUENTIAL, OR PUNITIVE DAMAGES.', ""In no event shall the AS Parties' indemnification obligations to MusclePharm hereunder exceed the after-tax value of the Cash Consideration received by Lender under this Agreement.""]",Yes,[],No,[],No,"[""MusclePharm shall, throughout the Term of the Agreement and for a period of not less than four years thereafter, obtain and maintain at its own cost and expense from a qualified insurance company licensed to do business in California and New York, a commercial general liability insurance policy including coverage for contractual liability (applying to the terms and conditions of this agreement), product liability, personal injury liability, and advertiser's liability, in a form approved by the AS Parties, in the amount of at least Five Million Dollars (US$5,000,000) per occurrence naming the AS Parties (for the avoidance of doubt, specifically including each of Lender, Endorser, and Fitness) as additional named insureds"", 'Without limiting the generality of the foregoing, such policy shall provide protection against any and all claims, demands, and causes of action arising out of any defects or failure to perform, alleged or otherwise, of the Products and Licensed Products or any material used in connection therewith or any use thereof.', 'MusclePharm shall be responsible to pay the deductible under any such insurance policies with respect to any claims made under such policies.', 'MusclePharm agrees to furnish the AS Parties a certificate of insurance evidencing same within thirty (30) days after execution of this Agreement and, in no event, shall MusclePharm manufacture, distribute, advertise, or sell the Licensed Products prior to receipt by the AS Parties of such evidence of insurance.', 'The policy shall provide for ten (10) days notice to the AS Parties from the insurer by Registered or Certified Mail, return receipt requested, in the event of any modification, cancellation, or termination thereof.', 'MusclePharm shall be responsible to provide for any appearances pursuant to this Agreement by Endorser appropriate certificates of insurance with coverage limits of at least Five Million Dollars (US$5,000,000) per occurrence endorsed to name the AS Parties as additional named insureds with respect to claims arising out of appearances by Endorser.']",Yes,"[""During the Term and after expiration or termination of this Agreement, MusclePharm shall not contest or otherwise challenge or attack the AS Parties' rights in the Trademarks or Name and Appearance Rights or the validity of the license being granted herein.""]",Yes,[],No
TomOnlineInc_20060501_20-F_EX-4.46_749700_EX-4.46_Co-Branding Agreement.pdf,['CO-BRANDING AGREEMENT'],"[""THE PARTIES ACKNOWLEDGE AND AGREE THAT NOTHING IN THIS SECTION 12.2 SHALL LIMIT A PARTY'S OBLIGATION TO PAY ANY AMOUNTS DUE AND OWING TO THE OTHER PARTY UNDER SECTION 5 ON OR BEFORE ANY DATE OF EXPIRATION OR TERMINATION HEREOF."", 'TO THE MAXIMUM EXTENT PERMISSIBLE UNDER APPLICABLE LAW, EXCEPT FOR THE WILFUL MISAPPROPRIATION OR INFRINGEMENT OF THE INTELLECTUAL PROPERTY OF A PARTY TO THIS AGREEMENT, OR THE OBLIGATIONS OF THE PARTIES TO THIS AGREEMENT PURSUANT TO SECTION 13, (A) THE LIABILITY OF ANY PARTY TO THIS AGREEMENT, IF ANY, FOR DAMAGES FOR ANY CLAIM OF ANY KIND WHATSOEVER AND REGARDLESS OF THE LEGAL THEORY, WITH REGARD TO THE RIGHTS GRANTED HEREUNDER OR THE SERVICES PERFORMED HEREUNDER, SHALL NOT INCLUDE COMPENSATION, REIMBURSEMENT OR DAMAGES ON ACCOUNT OF THE LOSS OF PRESENT OR PROSPECTIVE PROFITS, EXPENDITURES, DATA, OPPORTUNITY, ANTICIPATED SAVINGS, INVESTMENTS OR COMMITMENTS, WHETHER MADE IN ESTABLISHMENT, DEVELOPMENT OR MAINTENANCE OF REPUTATION OR GOODWILL OR FOR ANY OTHER REASON WHATSOEVER; AND (B) IN NO EVENT SHALL ANY PARTY TO THIS AGREEMENT BE LIABLE TO THE OTHER PARTIES TO THIS AGREEMENT FOR SPECIAL, INDIRECT, CONSEQUENTIAL, INCIDENTAL, PUNITIVE OR CONSEQUENTIAL DAMAGES.']",Yes,"['TO THE MAXIMUM EXTENT PERMISSIBLE UNDER APPLICABLE LAW, EXCEPT FOR THE WILFUL MISAPPROPRIATION OR INFRINGEMENT OF THE INTELLECTUAL PROPERTY OF A PARTY TO THIS AGREEMENT, OR THE OBLIGATIONS OF THE PARTIES TO THIS AGREEMENT PURSUANT TO SECTION 13, (A) THE LIABILITY OF ANY PARTY TO THIS AGREEMENT, IF ANY, FOR DAMAGES FOR ANY CLAIM OF ANY KIND WHATSOEVER AND REGARDLESS OF THE LEGAL THEORY, WITH REGARD TO THE RIGHTS GRANTED HEREUNDER OR THE SERVICES PERFORMED HEREUNDER, SHALL NOT INCLUDE COMPENSATION, REIMBURSEMENT OR DAMAGES ON ACCOUNT OF THE LOSS OF PRESENT OR PROSPECTIVE PROFITS, EXPENDITURES, DATA, OPPORTUNITY, ANTICIPATED SAVINGS, INVESTMENTS OR COMMITMENTS, WHETHER MADE IN ESTABLISHMENT, DEVELOPMENT OR MAINTENANCE OF REPUTATION OR GOODWILL OR FOR ANY OTHER REASON WHATSOEVER; AND (B) IN NO EVENT SHALL ANY PARTY TO THIS AGREEMENT BE LIABLE TO THE OTHER PARTIES TO THIS AGREEMENT FOR SPECIAL, INDIRECT, CONSEQUENTIAL, INCIDENTAL, PUNITIVE OR CONSEQUENTIAL DAMAGES.', 'THE FOREGOING PROVISIONS OF THIS SECTION 13.5 STATE THE ENTIRE LIABILITY AND THE EXCLUSIVE REMEDY OF THE PARTIES TO THIS AGREEMENT WITH RESPECT TO INFRINGEMENT OR ALLEGED INFRINGEMENT OF INTELLECTUAL PROPERTY RIGHTS.']",Yes,[],No,[],No,[],No,[],No,[],No
ConformisInc_20191101_10-Q_EX-10.6_11861402_EX-10.6_Development Agreement.pdf,['DEVELOPMENT AGREEMENT'],"['EXCEPT FOR [**], IN NO EVENT WILL EITHER PARTY BE LIABLE TO THE   OTHER PARTY FOR [**], EVEN IF SUCH PARTY WAS ADVISED OR AWARE OF THE POSSIBILITY OF SUCH   DAMAGES.']",Yes,"[""Notwithstanding   anything to the contrary, Stryker's sole remedy and Conformis' exclusive liability for breach of Section 3.2 with respect to a   Product or a Stryker Product shall be as set forth in Section 10.1(i) of the Distribution Agreement."", ""Such termination, together with the provisions of Section 5.2 of the License Agreement,   constitutes as Stryker's sole remedy and Conformis' exclusive liability in the event of any such rejection or failure by Conformis to   deliver materially conforming Deliverables hereunder so long as such rejection or failure does not arise from Conformis' fraud,   willful misconduct, gross negligence or bad faith."", ""CONFORMIS' LIABILITY ON A PER OCCURRENCE BASIS UNDER SECTION 7.3(A)(IV) SHALL NOT   EXCEED THE GREATER OF (I) $[**] AND (II) THE AMOUNT OF INSURANCE COVERAGE ACTUALLY PAID TO   CONFORMIS UNDER THEN-CURRENT INSURANCE POLICIES OF CONFORMIS IN RESPECT OF SUCH   DAMAGES."", 'EXCEPT FOR [**], IN NO EVENT WILL EITHER PARTY BE LIABLE TO THE   OTHER PARTY FOR [**], EVEN IF SUCH PARTY WAS ADVISED OR AWARE OF THE POSSIBILITY OF SUCH   DAMAGES.']",Yes,[],No,[],No,[],No,[],No,[],No
EtonPharmaceuticalsInc_20191114_10-Q_EX-10.1_11893941_EX-10.1_Development Agreement.pdf,['EXCLUSIVE LICENSE AND PRODUCT DEVELOPMENT AGREEMENT'],[],No,"['NOTWITHSTANDING ANYTHING TO THE CONTRARY HEREIN, NEITHER PARTY SHALL BE LIABLE FOR ANY INDIRECT, SPECIAL, INCIDENTAL, CONSEQUENTIAL OR EXEMPLARY DAMAGES, WHETHER FORESEEABLE OR NOT, THAT ARE IN ANY WAY RELATED TO THIS AGREEMENT.']",Yes,[],No,[],No,"['The Parties shall provide written proof of such insurance to each other upon request.', 'At all times from the first commercial sale of any Product(s) or after the Effective Date through the date which is five (5) years after the final sale of such Product(s), the Parties will maintain general liability insurance in amounts that are reasonable and customary in the pharmaceutical industry, provided in no event shall the general liability insurance amounts be less than five million dollars ($5,000,000) per occurrence and ten million dollars ($10,000,000) in the aggregate limit of liability per year.']",Yes,[],No,[],No
FuelcellEnergyInc_20191106_8-K_EX-10.1_11868007_EX-10.1_Development Agreement.pdf,['JOINT DEVELOPMENT AGREEMENT'],"[""Notwithstanding anything to the contrary in this Agreement, each Party will bear full responsibility, without limit, for the following:\n\n(i) Gross Negligence or Willful Misconduct attributable to its personnel, and, in no event, will a Party be required to release or indemnify the other Party for Gross Negligence or Willful Misconduct attributable to the other Party; and\n\n(ii) its legal obligations to third parties wherein nothing in this Agreement is intended to impair a party's contribution and indemnity rights under law with respect to third party claims.""]",Yes,"['In no event will either Party be liable to the other Party under this Agreement for any consequential, indirect, special, incidental, punitive or exemplary loss or damage, including, without limitation, business interruption, cost of capital, loss of anticipated revenues and profits, loss of goodwill or increased operating costs, whether arising from contract, warranty, tort, strict liability or otherwise regardless of whether the possibility of such losses or damages have been made known to the first Party, and each Party hereby expressly waives all such rights and remedies, except for breach of any confidentiality or restricted use provisions of this Agreement and except as provided in Paragraph 11.04 (Exceptions to Limitations of Liability).']",Yes,[],No,[],No,[],No,[],No,[],No
ReedsInc_20191113_10-Q_EX-10.4_11888303_EX-10.4_Development Agreement.pdf,['RECIPE DEVELOPMENT AGREEMENT'],"['EXCEPT WITH RESPECT TO THE INDEMNIFICATION OBLIGATIONS SET FORTH IN SECTION 9 WITH REGARD TO CLAIMS BY THIRD PARTIES, IN NO EVENT SHALL EITHER PARTY BE LIABLE FOR CONSEQUENTIAL, INDIRECT, INCIDENTAL, SPECIAL, EXEMPLARY, PUNITIVE OR ENHANCED DAMAGES, LOST PROFITS OR REVENUES OR DIMINUTION IN VALUE ARISING OUT OF, RELATING TO, OR IN CONNECTION WITH ANY BREACH OF THIS AGREEMENT OR CLAIM HEREUNDER, REGARDLESS OF (A) WHETHER SUCH DAMAGES WERE FORESEEABLE, (B) WHETHER OR NOT IT WAS ADVISED OF THE POSSIBLITY OF SUCH DAMAGES, AND (C) THE LEGAL OR EQUITABLE THEORY (CONTRACT, TORT OR OTHERWISE) UPON WHICH THE CLAIM IS BASED.']",Yes,"['EXCEPT WITH RESPECT TO THE INDEMNIFICATION OBLIGATIONS SET FORTH IN SECTION 9 WITH REGARD TO CLAIMS BY THIRD PARTIES, IN NO EVENT SHALL EITHER PARTY BE LIABLE FOR CONSEQUENTIAL, INDIRECT, INCIDENTAL, SPECIAL, EXEMPLARY, PUNITIVE OR ENHANCED DAMAGES, LOST PROFITS OR REVENUES OR DIMINUTION IN VALUE ARISING OUT OF, RELATING TO, OR IN CONNECTION WITH ANY BREACH OF THIS AGREEMENT OR CLAIM HEREUNDER, REGARDLESS OF (A) WHETHER SUCH DAMAGES WERE FORESEEABLE, (B) WHETHER OR NOT IT WAS ADVISED OF THE POSSIBLITY OF SUCH DAMAGES, AND (C) THE LEGAL OR EQUITABLE THEORY (CONTRACT, TORT OR OTHERWISE) UPON WHICH THE CLAIM IS BASED.']",Yes,[],No,[],No,[],No,"[""Reed's shall not at any time acquire any rights, title or interest in Company's Intellectual Property. Reed's agrees that it will not at any time contest the ownership or validity of any Company Intellectual Property, nor register or attempt to register any rights with respect to Company Intellectual Property, nor do anything that would jeopardize or diminish Company's rights to or the value of Company Intellectual Property."", ""Company agrees that it will not at any time contest the ownership or validity of any Reed's Intellectual Property or Deliverables, nor register or attempt to register any rights with respect to Reed's Intellectual Property, nor do anything that would jeopardize or diminish Reed's rights to or the value of Reed's Intellectual Property or Deliverables.""]",Yes,[],No
FuseMedicalInc_20190321_10-K_EX-10.43_11575454_EX-10.43_Distributor Agreement.pdf,['Distributorship agreement'],[],No,[],No,[],No,[],No,"['During the Term, the Supplier shall maintain product liability insurance with a reputable insurer of no less than AU$10 million for any one occurrence for any and all liability (however arising) for a claim that the Products are faulty or defective.', 'The Supplier shall add the distributor to their current insurance certificate.']",Yes,"['The Distributor shall not do, or omit to do, anything in its use of the Trade Marks that could adversely affect their validity or the goodwill of the Supplier.']",Yes,[],No
GentechHoldingsInc_20190808_1-A_EX1A-6 MAT CTRCT_11776814_EX1A-6 MAT CTRCT_Distributor Agreement.pdf,['DISTRIBUTOR AGREEMENT'],[],No,"['IN NO EVENT SHALL EITHER PARTY BE LIABLE TO THE OTHER FOR ANY SPECIAL, INDIRECT, EXEMPLARY OR CONSEQUENTIAL DAMAGES ARISING OUT OF THIS AGREEMENT OR PURCHASE OR USE OF THE PRODUCTS.']",Yes,[],No,"['Within Seven (7) days of receipt of such Products, Distributor will notify Company of any shortages, defects, non-conformance, and Company will promptly replace such Products free of charge.']",Yes,[],No,"['Distributor shall not dispute or contest for any reason whatsoever, directly or indirectly, during the term of this Agreement and thereafter, the validity, ownership or enforceability of any of the trademarks of Company, nor directly or indirectly attempt to acquire or damage the value of the goodwill associated with any of the trademarks of Company, nor counsel, procure or assist any third Party to do any of the foregoing', ""Distributor will not institute any proceedings with respect to the trademarks of Company either in Distributor's own name or on behalf of Company without express written permission of Company.""]",Yes,[],No
ImineCorp_20180725_S-1_EX-10.5_11275970_EX-10.5_Distributor Agreement.pdf,['NON-EXCLUSIVE DISTRIBUTOR AGREEMENT'],[],No,"['NO ACTIONS, REGARDLESS OF FORM, ARISING OUT OF THIS AGREEMENT, MAY BE BROUGHT BY DISTRIBUTOR MORE THAN ONE (1) YEAR AFTER THE CAUSE OF ACTION HAS ARISEN.', 'IN NO EVENT SHALL JRVS BE LIABLE FOR COSTS OF PROCUREMENT OF SUBSTITUTE PRODUCTS OR SERVICES, LOST PROFITS OR ANY CONSEQUENTIAL, SPECIAL, INCIDENTAL, OR INDIRECT DAMAGES, HOWEVER CAUSED AND ON ANY THEORY OF LIABILITY (INCLUDING NEGLIGENCE OR STRICT LIABILITY), ARISING OUT OF THIS AGREEMENT.', 'In the event of termination by either party in accordance with any of the provisions of this Agreement, neither party shall be liable to the other, because of such termination, for compensation, reimbursement or damages on account of the loss of prospective profits or anticipated sales or on account of expenditures, inventory, investments, leases or commitments in connection with the business or goodwill of either party.', ""IN NO EVENT SHALL JRVS'S LIABILITY ARISING OUT OF THIS AGREEMENT EXCEED THE AMOUNT RECEIVED BY JRVS FROM THE DISTRIBUTOR HEREUNDER FOR THE PRODUCT GIVING RISE TO THE LIABILITY.""]",Yes,[],No,"['The Distributor shall have thirty (30) days (the ""Inspection Period"") upon receipt of each shipment to inspect and test the Products.']",Yes,[],No,"['At no time during or after the term of this Agreement will the Distributor challenge or assist others to challenge JRVS Trademarks or the registration thereof or attempt to register any trademarks, marks or trade names confusingly similar to those of JRVS. T', 'The Distributor will not challenge any intellectual property rights claimed by JRVS in such trademarks.']",Yes,[],No
InnerscopeHearingTechnologiesInc_20181109_8-K_EX-10.6_11419704_EX-10.6_Distributor Agreement.pdf,['EXCLUSIVE DISTRIBUTOR AGREEMENT'],[],No,"['IN NO EVENT SHALL Erchonia BE LIABLE FOR ANY LOSS OF PROFIT OR ANY OTHER COMMERCIAL DAMAGE, INCLUDING BUT NOT LIMITED TO SPECIAL, INCIDENTAL, CONSEQUENTIAL OR OTHER INDIRECT DAMAGES UNDER ANY CAUSE OF ACTION ARISING OUT OF OR RELATING TO THIS AGREEMENT, INCLUDING, WITHOUT LIMITATION, CLAIMS ARISING FROM MALFUNCTION OR DEFECTS IN THE PRODUCTS.']",Yes,[],No,[],No,[],No,[],No,[],No
WaterNowInc_20191120_10-Q_EX-10.12_11900227_EX-10.12_Distributor Agreement.pdf,['EXCLUSIVE DISTRIBUTOR AGREEMENT'],[],No,"['The arbitrator shall not award any Party punitive, exemplary, multiplied or consequential damages, and each Party hereby irrevocably waives any right to seek such damages in arbitration or in judicial proceedings.']",Yes,[],No,[],No,[],No,[],No,[],No
GridironBionutrientsInc_20171206_8-K_EX-10.2_10972556_EX-10.2_Endorsement Agreement.pdf,['ENDORSEMENT AGREEMENT ADDENDUM I'],[],No,[],No,[],No,[],No,[],No,[],No,[],No
EcoScienceSolutionsInc_20171117_8-K_EX-10.1_10956472_EX-10.1_Endorsement Agreement.pdf,['ENDORSEMENT AGREEMENT'],[],No,[],No,[],No,[],No,[],No,[],No,[],No
NakedBrandGroupInc_20150731_POS AM (on S-1)_EX-10.75_9196027_EX-10.75_Endorsement Agreement.pdf,['COLLABORATION & ENDORSEMENT AGREEMENT'],[],No,[],No,[],No,[],No,[],No,[],No,[],No
RgcResourcesInc_20151216_8-K_EX-10.3_9372751_EX-10.3_Franchise Agreement.pdf,['GAS FRANCHISE AGREEMENT'],[],No,[],No,[],No,[],No,[],No,[],No,[],No
