"BELLICUMPHARMACEUTICALS,INC_05_07_2019-EX-10.1-Supply Agreement.PDF",['Supply Agreement'],"[""IN NO ONE EVENT SHALL EITHER PARTY'S AGGREGATE LIABILITY FOR DAMAGES OR LOSSES UNDER THIS AGREEMENT EXCEED THE AGGREGATE AMOUNT OF THE PRODUCT PRICES PAID BY BELLICUM FOR THE MILTENYI PRODUCT(S) DURING THE TWELVE (12) MONTH PERIOD IMMEDIATELY PRECEDING THE EVENT GIVING RISE TO SUCH LIABILITY; AND FURTHER PROVIDED THAT SUCH AGGREGATE LIABILITY DURING SUCH PERIOD ALSO SHALL NOT EXCEED THE AMOUNT OF SUCH PARTY'S INSURANCE COVERAGE FOR SUCH AGGREGATE LIABILITY."", ""Except for liability for (i) breach of the confidentiality obligations described in Article 14, (ii) misappropriation or infringement by a Party of the other Party's Intellectual Property Rights, or (iii) gross negligence or willful misconduct:\n\n(a) IN NO EVENT SHALL A PARTY BE LIABLE FOR ANY PUNITIVE, EXEMPLARY, INDIRECT, INCIDENTAL, SPECIAL, OR CONSEQUENTIAL DAMAGES OR EXPENSES, INCLUDING LOSS OF PROFITS, REVENUE, DATA, OR USE, WHETHER IN AN ACTION IN CONTRACT OR TORT (INCLUDING ERRORS OR OMISSIONS OR BREACH OF WARRANTY), EVEN IF SUCH PARTY HAS BEEN ADVISED OF THE POSSIBILITY OF SUCH DAMAGES;""]",Yes,"[""The foregoing shall be Bellicum's sole and exclusive remedy and Miltenyi's sole obligation with respect to claims that any Miltenyi Product fails to comply with the Miltenyi Product Warranty or the warranties in Section 11."", ""Miltenyi's sole obligation, and Bellicum's sole and exclusive remedy for breach of the Miltenyi Product Warranty in Section 11.1, shall be as set forth in Article 7, including replacement or refund in accordance with Section 7.6, provided that Miltenyi shall pay reasonable return freight and shipping charges."", ""Bellicum acknowledges and agrees that Bellicum's rights to a refund or credit for, or to receive replacement of, properly rejected shipments of Miltenyi Products hereunder shall be Bellicum's sole and exclusive remedy, and Miltenyi's sole obligation, with respect to non-conforming Miltenyi Products delivered hereunder."", 'Miltenyi will not in any event be liable for increased manufacturing costs, downtime costs, purchase of substitute products, lost profits, revenue, or goodwill, or any other indirect incidental, special, or consequential damages caused by a breach of the Miltenyi Product Warranty or the warranties in Section 11.2.', ""EACH PARTY'S MAXIMUM LIABILITY FOR ANY DAMAGES FOR BREACH OF THIS AGREEMENT SHALL BE LIMITED TO DIRECT AND ACTUAL DAMAGES. IN NO ONE EVENT SHALL EITHER PARTY'S AGGREGATE LIABILITY FOR DAMAGES OR LOSSES UNDER THIS AGREEMENT EXCEED THE AGGREGATE AMOUNT OF THE PRODUCT PRICES PAID BY BELLICUM FOR THE MILTENYI PRODUCT(S) DURING THE TWELVE (12) MONTH PERIOD IMMEDIATELY PRECEDING THE EVENT GIVING RISE TO SUCH LIABILITY; AND FURTHER PROVIDED THAT SUCH AGGREGATE LIABILITY DURING SUCH PERIOD ALSO SHALL NOT EXCEED THE AMOUNT OF SUCH PARTY'S INSURANCE COVERAGE FOR SUCH AGGREGATE LIABILITY."", 'The total amount of any reduction(s) pursuant to this Section 11.5(b) shall in no event exceed [...***...] percent ([...***...]%) of the Product Price payable for the applicable Miltenyi Product in that Contract Year (with the right to carry forward any unused offset).', ""Except for liability for (i) breach of the confidentiality obligations described in Article 14, (ii) misappropriation or infringement by a Party of the other Party's Intellectual Property Rights, or (iii) gross negligence or willful misconduct:\n\n(a) IN NO EVENT SHALL A PARTY BE LIABLE FOR ANY PUNITIVE, EXEMPLARY, INDIRECT, INCIDENTAL, SPECIAL, OR CONSEQUENTIAL DAMAGES OR EXPENSES, INCLUDING LOSS OF PROFITS, REVENUE, DATA, OR USE, WHETHER IN AN ACTION IN CONTRACT OR TORT (INCLUDING ERRORS OR OMISSIONS OR BREACH OF WARRANTY), EVEN IF SUCH PARTY HAS BEEN ADVISED OF THE POSSIBILITY OF SUCH DAMAGES;""]",Yes,[],No,"['Except in the case of latent defects as described in Section 7.3, each shipment of Miltenyi Products shall be deemed accepted by Bellicum if Bellicum or its designated recipient of the shipment does not provide Miltenyi with written notice of rejection (a ""Rejection Notice"") within [...***...] days from the date of receipt of the relevant shipment of Miltenyi Product, describing the reasons for the rejection and the non-conforming characteristics of such Rejected Product in reasonable detail.', ""Notification to Miltenyi by Bellicum must occur within [...***...] days after Bellicum or Bellicum's designated recipient of the shipment becomes aware or reasonably should have become aware that the Miltenyi Product fails to comply with the Miltenyi Product Warranty."", 'Once a Delivery of Miltenyi Products is accepted or deemed accepted hereunder, Bellicum shall have no recourse against Miltenyi in the event any such Miltenyi Product is subsequently deemed unsuitable for use for any reason, except for Miltenyi Product that does not conform to the Miltenyi Product Warranty after said 30-day period due to a latent defect in the Miltenyi Product that could not be detected through the performance of the Testing Methods.', 'Further, Bellicum shall have a period of [...***...] days from the date of Delivery to<omitted>perform, or have its Affiliate, Subcontractor, or Licensee (as the case may be) perform, incoming quality assurance testing on each shipment of Miltenyi Product in accordance with the Bellicum-approved quality control testing procedures as set forth in the Product Specifications or the Quality Agreement, as applicable (the ""Testing Methods""), to verify conformance with the Product Specifications.']",Yes,"['Each Party will maintain at its sole cost and expense, an adequate amount of commercial general liability and product liability insurance throughout the Term and for a period of five (5) years thereafter, to protect against potential liabilities and risk arising out of products supplied or activities to be performed under this Agreement and any Quality Agreement related hereto upon such terms (including coverages, deductible limits and self-insured retentions) as are customary in the industry for the products supplied or activities to be conducted by such Party under this Agreement.', 'Subject to the preceding sentence, such Bellicum liability insurance or self-insurance program will insure against personal injury, physical injury or property damage arising out of the pre-clinical, clinical and commercial manufacture, sale, use, distribution or marketing of Bellicum Product, and such Miltenyi liability insurance or self-insurance program will insure against personal injury, physical injury or property damage arising out of use of a Miltenyi Product in the manufacture of a Bellicum Product', 'Each Party shall provide the other Party with written proof of the existence of such insurance upon reasonable written request.', 'In addition, from time to time during the Term, each Party shall increase their levels of insurance coverage if reasonably deemed prudent by such Party in light of the overall products supplied and/or activities performed under this Agreement.']",Yes,[],No,[],No
FLOTEKINDUSTRIESINCCN_05_09_2019-EX-10.1-SUPPLY AGREEMENT.PDF,['SUPPLY AGREEMENT'],[],No,[],No,[],No,"['FCC shall promptly, but in no event later than three (3) days after the date of such purchase order, confirm its acceptance or rejection of such purchase order by written notice to Flotek.']",Yes,"['FCC agrees to provide $5,000,000 of commercial liability insurance in support of this indemnity which names Flotek as additional insured, with waiver of subrogation']",Yes,[],No,[],No
GRANTIERRAENERGYINC_05_07_2012-EX-10.6-TRANSPORTATION CONTRACT.PDF,['TRANSPORTATION CONTRACT  GENERAL CONDITIONS'],[],No,"['Save the event of gross negligence or willful misconduct, if any claims arise by the SENDER such as the loss of profit, this shall not  exceed twenty five percent (25%) of the value that ECOPETROL is obliged to indemnify the SENDER under this numeral 11.2(d) of the  Contract hereof.', 'Save the event of gross negligence or willful misconduct, pursuant to the provisions in this numeral 11.2, the responsibility of  ECOPETROL under the Contract hereof under no circumstance shall exceed seventy five per cent (75%) of the value of the Crude lost or  damaged by causes attributable to ECOPETROL.']",Yes,"['The Transporter shall only accept extemporary nominations as long as the Pipeline  has available Capacity. If the nomination is accepted, the Third Party or Sender shall Pay to the Transporter as a penalty, two (2%) of the  applicable rate to the volumes in barrels delivered in the Pipeline in the respective month.', 'In case of failing to fulfill the obligations of the SENDER as a result of any actions or illegal omissions or deviations from the Contract, the  SENDER agrees to pay ECOPETROL as a penalty, an amount equivalent to ten percent (10%) of the final value of the Contract.']",Yes,"['For claims regarding the quantity or quality of Hydrocarbons, these shall be presented in writing at the latest within fifteen (15) calendar days  after the date of delivery or withdrawal of the Hydrocarbon or the date in which the report for the Volumetric Compensation for Quality is issued.']",Yes,"['Bonds and Insurance: the Transporter and the interested Senders in the Sole Risk Proposal shall obtain the necessary bonds and insurance  to cover any Risk derived from the Sole Risk Proposal under terms reasonably acceptable for the Transporter, without prejudice of obtaining all  other bonds and insurance requested by the Transporter.', 'Performance Insurance Policy Four thousand forty seven millions of Colombian pesos ($4.047.000.000)', 'The policy hereof shall not expire by failure of payment of the premium and said premium shall not be revocable in a unilateral manner neither by  the insurance company nor by the contractor.']",Yes,[],No,[],No
ATMOSENERGYCORP_11_22_2002-EX-10.17-TRANSPORTATION SERVICE AGREEMENT.PDF,['TRANSPORTATION SERVICE AGREEMENT'],[],No,[],No,[],No,[],No,[],No,[],No,[],No
DYNAMEXINC_06_06_1996-EX-10.4-TRANSPORTATION SERVICES AGREEMENT.PDF,['MARKETING AND TRANSPORTATION SERVICES AGREEMENT'],[],No,"[""Such liability shall not exceed the        other Party's contractual liability to its customers."", 'The Parties        acknowledge that their contract of carriage with their customers provides        that liability for loss, damage or delay, including liability for        consequential loss, is limited to Four Dollars and Forty One Cents        ($4.41) per kilogram or Two Dollars ($2.00) per pound unless a higher        value has been declared for insurance purposes.', ""Notwithstanding anything contained herein to the contrary, the        indemnifying party's liability to the other hereunder shall not        exceed the insurance coverage set out in Section 9.0.""]",Yes,"[""For each Default Month, the Party in default shall pay a penalty equal         to five (5) times the Party not in default's corporate average yield         during the Default Month for each shipment below the performance\n\n\n\n\n\n     commitment"", 'In the event a Party has, in any twelve (12) month period, more than         three (3) Monthly Performance Failures, then the defaulting Party shall         pay a penalty to the Party not in default, which the Parties acknowledge         is a pre-estimation of damages suffered by the non-defaulting Party due         to the current month\'s Monthly Performance Failure (""Default Month"").']",Yes,[],No,"['Each Party shall purchase and maintain, at its own expense, the        following insurance coverages:\n\n    (a)     cargo liability insurance, subject to a combined single limit of                not less than One Hundred Thousand dollars ($100,000.00)                inclusive per occurrence. The other Party shall be named as an                additional insured and the policy shall contain a cross                liability clause;\n\n    (b)     automobile, non-owned automobile, fleet, comprehensive general,                public and property liability insurance with a limit of not less                than Two Million dollars ($2,000,000.00) inclusive of bodily                injury and property damage for any one occurrence arising out of                one (1) cause. The policy shall cover all non-air operations,                non-owned automobile, contractual liability and liability                specifically assumed under this Agreement. The other party shall                be named as an additional insured and the policy shall contain a                cross liability clause;', 'Each Party shall deliver to the other, prior to commencing to provide        the Services and thereafter, annually, a certificate or certificates of        insurance evidencing that the required insurance coverages as        provided for in paragraph 9.1 are in effect and that each Party shall be        given thirty (30) days prior written notice of cancellation or         expiry of or material change to such insurance coverages.', 'Each Party shall maintain the insurance coverages provided for in        paragraph 9.1 hereof, in full force and effect during the term of        this Agreement and covenants that nothing shall be done whereby any        policy will be cancelled and shall pay all renewal premiums thereon on or        before the due date and shall forthwith furnish the other Party with        copies of certificates of insurance of such renewals.', 'Each Party shall ensure that any subcontractor or other party with whom        it contracts in providing the Services shall carry adequate        insurance coverage, but not less than that provided in paragraph 9.1.']",Yes,[],No,[],No
MPLXLP_06_17_2015-EX-10.1-TRANSPORTATION SERVICES AGREEMENT.PDF,['TRANSPORTATION SERVICES AGREEMENT'],"[""Except as otherwise provided in Section 10.5, in the event of any breach of a term or condition of this Agreement by either Party, the other Party's remedy shall be limited to the direct damages caused thereby and in no event shall a Party be liable to the other Party for any consequential, indirect, pecuniary, punitive, or economic damages, howsoever caused.""]",Yes,"[""Except as otherwise provided in Section 10.5, in the event of any breach of a term or condition of this Agreement by either Party, the other Party's remedy shall be limited to the direct damages caused thereby and in no event shall a Party be liable to the other Party for any consequential, indirect, pecuniary, punitive, or economic damages, howsoever caused.""]",Yes,"['If Shipper fails to notify MPL within one hundred and eighty (180) days of the Project\'s in-service date or if MPL is unsuccessful in obtaining additional volume commitments as provided for in Section 3.8 to<omitted>fully replace Shipper\'s original volume commitment as submitted in its Capacity Request Form in Exhibit C, Shipper will reimburse MPL for Shipper\'s pro rata portion of actual and committed Construction Costs, plus, an administrative fee of ten (10) percent of said costs (such reimbursement is hereinafter referred to as the ""Construction Cost Reimbursement"").', ""The Parties agree that the Construction Cost Reimbursement shall be deemed liquidated damages and that such amount shall not be deemed a penalty, but rather represents a reasonable amount of liquidated damages in light of the anticipated or actual harm caused by Shipper's termination of this Agreement as stated, the difficulties of proof of loss, and the inconvenience or non- feasibility of otherwise obtaining an adequate remedy, and that the payment of such amount shall be MPL's sole and exclusive remedy for such termination by Shipper.""]",Yes,[],No,[],No,[],No,[],No
CHAPARRALRESOURCESINC_03_30_2000-EX-10.66-TRANSPORTATION CONTRACT.PDF,['TRANSPORTATION CONTRACT'],[],No,[],No,[],No,[],No,[],No,[],No,[],No
KENTUCKYUTILITIESCO_03_25_2003-EX-10.65-TRANSPORTATION AGREEMENT.PDF,['GAS TRANSPORTATION AGREEMENT'],[],No,[],No,[],No,[],No,[],No,[],No,[],No
MACROGENICSINC_08_02_2013-EX-10-COLLABORATION AGREEMENT.PDF,['Collaboration Agreement'],"[""NOTWITHSTANDING THE FOREGOING, NOTHING IN THIS SECTION 14.7 IS INTENDED TO OR SHALL LIMIT OR RESTRICT THE INDEMNIFICATION RIGHTS OR OBLIGATIONS OF ANY PARTY UNDER ARTICLE 14, OR DAMAGES AVAILABLE FOR A PARTY'S BREACH OF CONFIDENTIALITY OBLIGATIONS IN ARTICLE 12.""]",Yes,"['NEITHER PARTY SHALL BE LIABLE TO THE OTHER FOR ANY SPECIAL, CONSEQUENTIAL, INCIDENTAL, PUNITIVE, OR INDIRECT DAMAGES OR FOR LOST PROFITS ARISING FROM OR RELATING TO ANY BREACH OF THIS AGREEMENT, REGARDLESS OF ANY NOTICE OF THE POSSIBILITY OF SUCH DAMAGES.']",Yes,[],No,[],No,[],No,"[""MacroGenics may terminate this Agreement immediately upon written notice to Green Cross in the event Green Cross or any of its Affiliates:\n\n(a) directly or indirectly oppose, or assist any Third Party to oppose, in any patent office proceeding, the grant of any patent or patent application within the MacroGenics Licensed Patents, or, in any patent office proceeding, dispute or directly or indirectly assist any Third Party to dispute, the validity of any patent within the MacroGenics Licensed Patents or any of the claims thereof, including opposing any application for amendment thereto;<omitted>(b) directly or indirectly oppose, or assist any Third Party to oppose, in any court proceeding, the grant of any patent or patent application within the MacroGenics Licensed Patents, or, in any court proceeding, dispute or directly or indirectly assist any Third Party to dispute, the validity of any patent within the MacroGenics Licensed Patents or any of the claims thereof; or\n\n(c) bring any claim or proceedings of whatever nature in relation to the MacroGenics Licensed Patents against MacroGenics and/or any of MacroGenics' Affiliates (or in respect of the foregoing their directors and officers) in respect of any activities carried out by them under any MacroGenics Licensed Patents which may be the subject of a Valid Claim of the MacroGenics Licensed Patents.""]",Yes,[],No
CHINARECYCLINGENERGYCORP_11_14_2013-EX-10.6-Cooperation Agreement.PDF,['Cooperation Agreement'],[],No,[],No,[],No,[],No,[],No,[],No,[],No
IDREAMSKYTECHNOLOGYLTD_07_03_2014-EX-10.39-Cooperation Agreement on Mobile Game Business.PDF,['Cooperation Agreement'],[],No,[],No,"[""If Party A discovers in its spot checks conducted from time to time that any game, software, business, works, content or service provided by Party B is not in compliance with laws, regulations, industry rules, Party A's management measures or contractual agreement, Party B shall pay Party A additional amount of performance bond at RMB5,000 per violation, or RMB10,000 per business, to be payable to by Party B within 10 working days after the results of copyright spot checks are posted."", 'For the third time of the aforementioned violation, Party A will withhold the full amount of the performance bond already paid by Party B, and terminate the full-range business cooperation for one year.', ""If Party A discovers that Party B has violated the Integrity Agreement attached hereto by bribing Party A's working personnel, Party A may elect to impose a penalty of RMB10,000 to 100,000, suspend cooperation for 1-3 years or terminate the cooperation depending on the seriousness of the violation and the consequences thus brought about, and any loss thus incurred to Party A shall be borne by Party B"", 'For the second time of the aforementioned violation, the amount of performance bond shall be additionally paid at RMB3,000 per time on the basis of the amount previous paid']",Yes,[],No,[],No,[],No,[],No
TUNIUCORP_03_06_2014-EX-10-COOPERATION AGREEMENT.PDF,['Cooperation Agreement (2014 Amendment)'],[],No,"['Notwithstanding the foregoing provisions, neither Party shall be responsible to the other Party in respect of any indirect loss or damage caused hereunder.', 'The demand for liquidated damages and specific performance in respect of any breach during the Term of Cooperation are all remedies that the non-breaching Party shall have under this Agreement.']",Yes,"['Except as otherwise agreed hereunder, if Party A or its subsidiaries fail to pay the Service Fee in full on schedule according to provisions of Article 4.1 and Article 4.2, then Party A or its subsidiaries shall, in addition to the continuance of the payment of Service Fee in full, it shall pay Party B the liquidated damages at a daily interest rate of 0.03% in respect of the outstanding Service Fee.']",Yes,[],No,[],No,[],No,[],No
SENMIAOTECHNOLOGYLTD_02_19_2019-EX-10.5-Collaboration Agreement.PDF,['Collaboration Agreement'],[],No,"[""Party B's use of the Platform and the acquisition of any information by using the Platform are solely at Party B's independent judgment and is at Party B's own risk (including but not limited to the losses caused by damage to Party B's computer system or mobile phone system or loss of data.)"", 'Party B has fully understood the functions and characteristics of services of the Platform prior to the use of the Platform and agrees that Party A shall not be liable to Party B for any defect in software, insufficiency of function or any necessary improvement.', 'Unless any party is in violation of the confidentiality clause, in any case, neither party shall be liable for any indirect, punitive claims, or claims for losses of commercial profits, or damages for business losses of the company or any third Party Arising from this Agreement, or for any loss or inaccuracy of data of any form, whether based on Agreement, tort or any other legal principle, even though the party has been informed of the possibility of such damage.']",Yes,"['If Party B shall pay liquidated damages for breach of this Agreement or violation of the platform rules, Party A is entitled to request Party B to pay the liquidated damages.', 'In this case, Party B shall pay additional deposit equivalent to the liquidated damages when it pays the liquidated damages.', 'The following acts constitute Class B breaches. In the event of any breach below by Party B, Party B shall immediately remedy the breach, and Party A is entitled to request Party B to pay the liquidated damages of an amount from RMB1,000 (RMB ONE THOUSAND) to RMB 5,000 (RMB FIVE THOUSAND) based on the consequences of the breach, and send the Confirmation Letter on the Breach of the Partner of Xiaoju Online Ride-hailing Marketplace to Party B.', 'In the case of a written notice 15 days in advance from either party to the other Party And a payment of the liquidated damages of RMB10,000 (RMB TEN THOUSAND), this Agreement shall terminate as of the date of termination stated in the notice of termination.', 'In case that the Driver User unilaterally terminates the Financial Leasing Agreement in advance, Party B shall collect the liquidated damages from the Driver User within 30% of the ""down payment + total monthly rent + last payment"" stipulated in the Financial Leasing Agreement;', 'Any violation of this article by Party B shall be considered as a material breach of the this Agreement, and Party A is entitled to immediately terminate this Agreement and the cooperation relationship between the Parties, and request Party B to pay the liquidated damages of RMB 50,000 (RMB FIFTY THOUSAND) and indemnify for all losses incurred to Party A thereby.', 'For example, if Party B shall pay liquidated damages as much as RMB N, it shall pay additional RMB N to increase the deposit paid in accordance with Article 4.2 after it pays the liquidated damages or Party A deducts the liquidated damages from the deposit.', 'The following acts constitute Class D breaches. In the event of any breach below by Party B, Party B shall immediately remedy the breach, and Party A is entitled to request Party B to pay the liquidated damages of not less than RMB50,000 (RMB FIFTY THOUSAND) based on the consequences of the breach, and send the Confirmation Letter on the Breach of the Partner of Xiaoju Online Ride-hailing Marketplace to Party B, and terminate the Agreement.', 'In such case, Party A is entitled to immediately terminate the Agreement and the cooperation relationship between the Parties, and request Party B to pay the liquidated damages of RMB50,000 (RMB FIFTY THOUSAND) and indemnify for all losses incurred to Party A thereby.', 'The following acts constitute Class C breaches. In the event of any breach below by Party B, Party B shall immediately remedy the breach, and Party A is entitled to request Party B to pay the liquidated damages of an amount from RMB5,000 (RMB FIVE THOUSAND) to RMB50,000 (RMB FIFTY THOUSAND) based on the consequences of the breach, and send the Confirmation Letter on the Breach of the Partner of Xiaoju Online Ride-hailing Marketplace to Party B.']",Yes,[],No,[],No,[],No,[],No
