LIMEENERGYCO_09_09_1999-EX-10-DISTRIBUTOR AGREEMENT.PDF,['DISTRIBUTOR AGREEMENT'],[],No,[],No,[],No,"['In the event that Company is unable or unwilling to                   promptly  perform any warranty work without  reasonable  cause                   and following  full and fair  opportunity  to do so, or in the                   event of the necessity  for  emergency  repairs of a defective                   Product  for  which  there  is no  reasonable  possibility  of                   performance by Company,  Distributor may perform such warranty                   work or hire a third party to perform such  warranty  work and                   the reasonable cost thereof shall be paid by Company.', ""Company  further  warrants that the                   Products sold hereunder  shall be free from defects in design,                   materials and  workmanship  for a period of  twenty-four  (24)                   months after delivery to Distributor's  end-user."", 'The  Company  represents  that,  to the  best  of its                            knowledge,  Products are in compliance with all laws,                            and  that  the  Products  will  not be  hazardous  or                            dangerous  when  used  for  their  intended  purpose.                            Products  do not  cause  harmful  emissions  or other                            environmental  hazards and Products do not violate or                            infringe any patents, copyrights, trademarks or other                            rights  of  nay  third  party(ies).', 'The Company reserves the                   right to reject any Products  that are not factory  sealed and                   in new and unused  condition.', 'If Company does not give Annual                            Notice  pursuant to Section  3.1 hereof,  Distributor                            may, within 90 days of  modification,  improvement or                            alteration,  return the Products to the Company.', ""If, within the twenty-four  (24) month warranty                   period set forth above,  Company  received from Distributor or                   any of  Distributor's  end-user's  a notice  which may be oral                   notice  confirmed in writing)  that any of the  Products  sold                   hereunder do not meet the Warranties  specified above, Company                   shall  thereupon  correct  each such defect by  providing  the                   necessary repairs,  and/or replacement parts, or if necessary,                   Products."", 'The                            Company shall not have any obligation with respect to                            Products  after  365  days   following   delivery  to                            Distributor, except as provided herein.', ""In the event of any  damages or                            other  defect in a  Product  which is  discovered  by                            Distributor   within   365   days   of   satisfactory                            installation  of  a  Product  at  Distributor's  or a                            subdistributor's   customer,  the  Distributor  shall                            promptly   report  the  same  to  the   Company   and                            reasonably  demonstrate the defect to the Company.""]",Yes,"['Company will carry a reasonable                   amount of product  liability  insurance  through a  reasonably                   acceptable  products liability insurance company and will name                   the  Distributor  as an additional  insured under that policy.                   Company  will make  reasonable  efforts  to  procure a policy,                   which is non-cancelable, except upon thirty (30) days, advance                   notice to the Distributor.']",Yes,"['During the Term of this Agreement and                   for three  years  thereafter,  the  Distributor  (on behalf of                   itself and each of its affiliates) agrees not to commence,  or                   provide any  information to or otherwise  assist any person or                   entity in  connection  with,  any suit,  action or  proceeding                   contesting the ownership,  validity or  enforceability  of any                   patent,  copyright,  trademark,  trade name or other propriety                   right owned by or licensed to the Company,  whether  currently                   existing or hereinafter invented, developed or acquired unless                   required to by court order.']",Yes,[],No
NEOMEDIATECHNOLOGIESINC_12_15_2005-EX-16.1-DISTRIBUTOR AGREEMENT.PDF,['DISTRIBUTOR AGREEMENT'],[],No,"[""For the avoidance of          doubt, PPG SHANGHAI hereby declares and represents that PPG SHANGHAI is          not responsible for any damage to the Products after they have been          taken away from PPG SHANGHAI's warehouse and caused by DISTRIBUTOR or          its transport agent."", 'In no event shall PPG SHANGHAI be liable for consequential damages.', 'PPG          SHANGHAI will not accept any claims for discrepancy in delivery beyond          the 48 hours period.', 'Notwithstanding the provisions of any law, rule, or regulation to the contrary, on the termination of this Agreement for any cause whatsoever, DISTRIBUTOR shall not be entitled to claim or receive from PPG SHANGHAI any compensation, reimbursement, or damages on account of any expenditure or commitment of any kind in connection with its business or on account of goodwill or on account of loss of prospective profits or otherwise.', ""In the event that the Product fails to          conform to the warranties herein given, DISTRIBUTOR's exclusive remedy          and PPG SHANGHAI's sole responsibility is, at PPG SHANGHAI's option,          limited to the replacement of such nonconforming Product at PPG          SHANGHAI's expense or the refund of the purchase price attributable to          a specific delivery as to which a claim is made.""]",Yes,[],No,"['PPG          SHANGHAI will not accept any claims for discrepancy in delivery beyond          the 48 hours period.', 'If Products are found damaged upon delivery,          DISTRIBUTOR or its customers who directly receive the delivery shall          report to PPG SHANGHAI in writing within 48 hours.', 'In case of discrepancy found in Products\n\n\n\n\n\n         delivered, DISTRIBUTOR shall report to PPG SHANGHAI in writing,          detailing all the discrepancies within 48 hours after delivery.']",Yes,[],No,"[""DISTRIBUTOR acknowledges PPG SHANGHAI's exclusive right and interests          in relation to the PPG Trademarks and further acknowledges that all          copyrights, patent, utility model rights and all other industrial          property rights of whatever kind used in or in connection with the          Products are the sole and exclusive property of PPG SHANGHAI or PPG and          that DISTRIBUTOR will not, whether during the Term of this appointment          or after its expiry or termination, knowingly do or cause to be done          any act or thing directly or indirectly, contest or in any way impair          or attempting to impair PPG SHANGHAI or PPG's rights, titles or          interests in the PPG Trademarks.""]",Yes,[],No
NANOPHASETECHNOLOGIESCORP_11_01_2005-EX-99.1-DISTRIBUTOR AGREEMENT.PDF,['DISTRIBUTOR AGREEMENT'],"[""Buyer, for itself and its insurers, expressly waives any and all limitations or liability caps, if any, on Buyer's contribution liability to Seller, and any and all statutory or common law lien rights or Claims against Seller arising from any applicable workers compensation or disability acts, which Buyer might or could assert against Seller or Seller's insurers in the event of the personal injury or death of Buyer's employees, representatives or servants.""]",Yes,"[""Seller shall not be liable for indirect, special, incidental or consequential damages arising under this Agreement or otherwise with respect to the sale of the products, including any lost revenues or profits, consequential and/or incidental damages, business interruption or damage to business reputation, regardless of the theory upon which any claim may be based, including any statutory causes of action or claims. In no event will Seller's entire liability to Buyer, including any liability in the event the exclusive remedy set forth in this Agreement fails of its essential purpose, exceed the purchase price actually paid by Buyer for the products hereunder, or any defective portion thereof, whichever is the lesser amount."", ""THE CORRECTION OF SUCH DEFECT BY REPAIR OR CREDITING ALFA AESAR'S ACCOUNT FOR THE COST OF THE PRODUCT IN THE MANNER SET FORTH ABOVE SHALL CONSTITUTE THE SOLE AND EXCLUSIVE REMEDY OF DISTRIBUTOR WITH RESPECT TO ANY WARRANTY GIVEN HEREIN RELATING TO ANY PRODUCT SOLD OR DELIVERED HEREUNDER."", ""SELLER EXPRESSLY DISCLAIMS ANY AND ALL LIABILITY TO BUYER FOR ANY CONSEQUENTIAL DAMAGES, DAMAGES FOR LOSS OF USE, LOSS OF PROFITS, INCOME, OR REVENUE, LOSS OF TIME OR INCONVENIENCE, LOSS OR DAMAGE TO ASSOCIATED EQUIPMENT, COST OF SUBSTITUTED OR REPLACEMENT EQUIPMENT, LOSS TO FACILITIES, LOSS OF CAPITAL, LOSS OF SERVICES OR ANY OTHER INCIDENTAL, CONSEQUENTIAL OR SPECIAL DAMAGE ARISING OUT OF THIS ORDER OR THE OPERATION, FUNCTION OR CHARACTERISTICS OF THE PRODUCTS PURCHASED HEREUNDER OR OTHERWISE PROVIDED BY SELLER. IN THE EVENT THAT PRODUCTS DO NOT SATISFY SPECIFICATIONS, THEY WILL BE REPLACED, AT SELLER'S OPTION, WITH PRODUCTS THAT DO SATISFY THE SPECIFICATIONS AT SELLER'S SOLE EXPENSE. SAID REPLACEMENT IS THE SOLE AND EXCLUSIVE REMEDY OF BUYER."", 'To the fullest extent permitted by law, the parties waive and relinquish any claims, demands, causes of action or recoveries for punitive damages, exemplary damages, or statutory damages.']",Yes,[],No,"[""Any rejection or revocation of acceptance by Buyer (a) must be made within thirty (30) days of the products being made available for shipment to Buyer, (b) any attempted rejection or revocation of acceptance made thereafter shall be null and void, and (c) any rejection or revocation of acceptance shall comply with Seller's return protocol.""]",Yes,"['Each party agrees to maintain and provide the other with evidence of insurance coverage for comprehensive general liability in an amount no less than $2,000,000.00 U.S. dollars.', 'Buyer shall obtain comprehensive general liability coverage, including contractual liability coverage, naming Seller as an additional named insured, in amounts sufficient to fully protect Seller under this Agreement from loss, damage or casualty caused by Buyer or incurred by Seller under this Agreement.']",Yes,[],No,[],No
"OPTIMIZEDTRANSPORTATIONMANAGEMENT,INC_07_26_2000-EX-6.6-DISTRIBUTOR AGREEMENT.PDF",['DISTRIBUTOR AGREEMENT'],[],No,[],No,[],No,"['ITS  Products  are  warranted  free from  defects of material or      workmanship  for 3 years after  shipment from the  manufacturer.  Equipment      purchased from ITS, which becomes defective within that time period will be      repaired by ITS at its  headquarters  in San  Antonio,  Texas at no cost to      COMWARE  beyond cost of shipping  the  equipment  to ITS.', 'ITS will provide free technical support to customers who have           purchased ITS systems for a period of 30 days.']",Yes,[],No,[],No,[],No
"VISIUMTECHNOLOGIES,INC_10_20_2004-EX-10.20-DISTRIBUTOR AGREEMENT.PDF",['DISTRIBUTOR AGREEMENT'],[],No,"['The warranty and remedies set forth in Exhibit B are exclusive and in lieu of any other warranties or remedies, express or implied, including the implied warranties of merchantability and fitness for intended or particular purpose.', 'The liability of WLI to Power2Ship for any claim whatsoever related to the Products or the Licensed Programs or this Agreement, including any cause of action in contract, tort, or strict liability, shall not exceed the total amount payable under this Agreement by Power2Ship to WLI within the most recent six-month period for the Licensed Programs (if such claim relates to the Licensed Programs), or for the WLI Products (if such claim relates to the WLI Products).', 'REPAIR OR REPLACEMENT BY WLI AS PROVIDED IN THIS LIMITED WARRANTY IS YOUR EXCLUSIVE REMEDY UNDER THIS LIMITED WARRANTY.', 'WLI SHALL NOT BE LIABLE FOR ANY SPECIAL, INCIDENTAL, CONSEQUENTIAL OR EXEMPLARY DAMAGES.', 'Neither party shall be liable to the other party for any special, incidental, or consequential damages arising in connection with, or out of termination of, this agreement.', 'Under no circumstances shall WLI be liable to Power2Ship or to any other person or entity for any incidental, special or consequential damages whether arising out of breach of warranty, breach of contract or otherwise even if WLI has been advised of the possibility of such claims or demands.']",Yes,[],No,"['The first year warranty starts with the date of shipment      and terminates on the anniversary of the first year.', ""Replacement or repaired units will be returned to      the Integrator within 14 working days of receipt of a defective unit at      WLI's cost."", 'Any implied warranties of the Licensed Software are LIMITED to one year starting from the date of purchase or for the period described in the contractual agreement with the Power2Ship.', 'Wireless Links (WLI) warrants to the original end user purchaser (""You"") that the Equipment will be free from defects in workmanship and materials (""Limited Warranty"") for a period of one (1) year from the date of the purchase of the Equipment (the ""Warranty Period"").', 'WLI at\n\n\n\n\n\nits discretion will repair or replace the Equipment in accordance with the terms of this limited warranty and send it back to you.', 'Any implied warranties of the Licensed Software are LIMITED to one year      starting from the date it was shipped to the integrator or starting with      the date specified as the starting date in the leasing and / or purchase      agreement with the Integrator.', 'Within 14 days from discovery of a defect, the Integrator shall notify WLI      in writing of said defect.', 'WLI will provide a one year limited warranty      for its hardware products as per the terms and conditions described in      ""Attachment B"".', 'In addition, during the warranty period and/or duration of this agreement WLI from time to time may furnish Power2Ship with further releases of the Licensed Programs to provide corrections of significant programming or software errors.', 'The first year limited warranty starts on the day of the activation of the Unit on a wireless network.']",Yes,"['Power2Ship is advised to obtain and maintain property and casualty insurance for the Equipment against all risks of loss or damage.', 'The amount of such insurance shall not be less than the replacement cost of the Equipment.']",Yes,"['All applicable rights to copyrights, patents, trademarks, trade names, logos and identifying slogans and other intellectual property rights in the products are the exclusive property of WLI and Power2Ship shall not contest such ownership.', 'Power2Ship shall not contest the right of WLI and its affiliates to the use of any trademarks, service marks, commercial symbols or trade names used or claimed by WLI.']",Yes,[],No
ENERGYXXILTD_05_08_2015-EX-10.13-Transportation AGREEMENT.PDF,['Transportation Agreement'],"['EXCEPT WITH REGARD TO OBLIGATIONS TO INDEMNIFY A PARTY FOR CLAIMS MADE BY THIRD PARTIES, NEITHER PARTY SHALL BE LIABLE TO THE OTHER PARTY (OR ITS AFFILIATES) PURSUANT TO THIS AGREEMENT FOR ANY CONSEQUENTIAL, INCIDENTAL, INDIRECT, OR SPECIAL DAMAGES OR LOSSES OR ANY PUNITIVE, EXEMPLARY, TREBLE, OR SIMILAR DAMAGES ARISING OUT OF OR RELATING TO THIS AGREEMENT OR THE PERFORMANCE OF, OR FAILURE TO PERFORM, ITS OBLIGATIONS HEREUNDER, EVEN IF SUCH DAMAGES OR LOSSES ARE CAUSED BY THE SOLE, JOINT, OR CONCURRENT NEGLIGENCE, STRICT LIABILITY, OR OTHER FAULT OF THE PARTY WHOSE LIABILITY IS BEING WAIVED HEREBY.']",Yes,"['EXCEPT WITH REGARD TO OBLIGATIONS TO INDEMNIFY A PARTY FOR CLAIMS MADE BY THIRD PARTIES, NEITHER PARTY SHALL BE LIABLE TO THE OTHER PARTY (OR ITS AFFILIATES) PURSUANT TO THIS AGREEMENT FOR ANY CONSEQUENTIAL, INCIDENTAL, INDIRECT, OR SPECIAL DAMAGES OR LOSSES OR ANY PUNITIVE, EXEMPLARY, TREBLE, OR SIMILAR DAMAGES ARISING OUT OF OR RELATING TO THIS AGREEMENT OR THE PERFORMANCE OF, OR FAILURE TO PERFORM, ITS OBLIGATIONS HEREUNDER, EVEN IF SUCH DAMAGES OR LOSSES ARE CAUSED BY THE SOLE, JOINT, OR CONCURRENT NEGLIGENCE, STRICT LIABILITY, OR OTHER FAULT OF THE PARTY WHOSE LIABILITY IS BEING WAIVED HEREBY.']",Yes,[],No,[],No,[],No,[],No,[],No
ENTERPRISEPRODUCTSPARTNERSLP_07_08_1998-EX-10.3-TRANSPORTATION CONTRACT.PDF,['TRANSPORTATION CONTRACT'],[],No,"[""A claim must be filed with Carrier within     thirty (30) days from the date the shipment in question was delivered, and     (i) contain facts sufficient to identify the shipment (or shipments)     involved (ii) assert the grounds for Carrier's liability for alleged loss,     damage, injury, or delay, and (iii) request payment of a specified or     determinable amount of money."", 'In no event shall Carrier be liable for any lost profits or special, indirect or consequential damages.']",Yes,[],No,[],No,"['Carrier shall, at its sole cost and expense, procure and maintain liability insurance with a reputable and financially responsible insurance carrier or carriers properly insuring Carrier against liability and claims for injuries to persons (including injuries resulting in death) and for damage to property in amounts not less than the Minimum Levels of Financial Responsibility for Motor Carriers prescribed by the U. S. Department of Transportation (49 CFR (S)387 et seq.).']",Yes,[],No,[],No
MARTINMIDSTREAMPARTNERSLP_01_23_2004-EX-10.3-TRANSPORTATION SERVICES AGREEMENT.PDF,['MARINE TRANSPORTATION AGREEMENT'],[],No,"['The foregoing indemnities shall expressly exclude any liability for consequential, punitive, special or similar damages, including, without limitation, lost profits.']",Yes,[],No,"['Owner shall, before and at commencement of each voyage by any vessel under this Agreement, exercise commercially reasonable efforts to ensure that such vessel is seaworthy and in good operating condition, properly manned, equipped and supplied for the voyage, to ensure that the pipes, pumps and coils tight, staunch, are in good operating condition and fit for the voyage, and to ensure that the tanks and other spaces in which product is to be carried are in good operating condition and fit for the carriage and preservation of the same.']",Yes,"['Owner covenants that it will maintain at all times during the Term of this Agreement insurance coverage for sudden and accidental pollution of $500,000,000.']",Yes,[],No,[],No
ADAMSGOLFINC_03_21_2005-EX-10.17-ENDORSEMENT AGREEMENT.PDF,['ENDORSEMENT AGREEMENT'],[],No,[],No,[],No,[],No,[],No,[],No,[],No
AMBASSADOREYEWEARGROUPINC_11_17_1997-EX-10.28-ENDORSEMENT AGREEMENT.PDF,['Endorsement Agreement'],[],No,[],No,[],No,[],No,"['Any proposed change in certificates of insurance shall be submitted to KI, Inc. for its prior approval.', ""As proof of such insurance, a fully paid certificate of insurance naming KI, Inc. and KI as an insured party will be submitted to KI, Inc. by Diplomat for KI, Inc.'s prior approval before any product is distributed or sold, and at the latest within thirty (30) days after the date first written above."", 'KI, Inc. shall be entitled to a copy of the\n\n\n\n\n\nthen prevailing certificate of insurance, which shall be furnished KI, Inc. by Diplomat.', 'Diplomat agrees that it will obtain, at its own expense, product liability insurance from a recognized insurance company which is qualified to do business in the State of California providing adequate protection (at least in the amount of $         ) for KI, Inc., KI and Diplomat against any claims, suits, loss or damage arising out of any alleged defects in the products.']",Yes,"[""Diplomat agrees that it will not at any time during the term of this Agreement or thereafter attack (i) KI, Inc.'s title to, or rights in and to, KI's name or (ii) the validity of this license.""]",Yes,[],No
HOLIDAYRVSUPERSTORESINC_04_15_2002-EX-10.13-ENDORSEMENT AGREEMENT.PDF,['ENDORSEMENT AGREEMENT'],[],No,[],No,[],No,[],No,[],No,[],No,[],No
"MARSHALLHOLDINGSINTERNATIONAL,INC_04_14_2004-EX-10.15-ENDORSEMENT AGREEMENT.PDF",['ENDORSEMENT AGREEMENT'],[],No,[],No,[],No,[],No,[],No,[],No,[],No
MOVADOGROUPINC_04_30_2003-EX-10.28-ENDORSEMENT AGREEMENT.PDF,['ENDORSEMENT AGREEMENT'],[],No,[],No,[],No,[],No,[],No,[],No,[],No
MOSSIMOINC_04_14_2000-EX-10.14-ENDORSEMENT AGREEMENT.PDF,['ENDORSEMENT AGREEMENT'],[],No,"[""Notwithstanding anything to the contrary herein, in the event Company incurs any expenses, damages or other liabilities (including, without limitation, reasonable attorneys' fees) in connection with the performance or non-performance of any term or provision hereof, Licensor's liability to Company shall not exceed the remuneration, excluding reimbursement of expenses, actually paid to Licensor by Company."", 'In no event will Licensor be liable for any indirect, incidental, reliance, special or consequential damages arising out of the performance or non-performance of this Agreement, whether or not Licensor had been advised of the possibility of such damages.']",Yes,"['In the event Duval does not meet                   the Minimum Annual Performance Requirements for a Contract                   Year, $375,000 of the Additional License Fee will be deemed to                   be unearned.', 'In the event the Company terminates the                   Agreement in accordance with Section 16, any unearned                   Additional License Fee will be fully refundable and due the                   Company as set forth in Section 16.', 'Any unearned Additional License Fee is fully                 &bbsp; refundable and due Company no later then January 31st of the                   following year.']",Yes,[],No,"['Within thirty (30) days from the date hereof, Company will submit to Licensor evidence of such policy, requiring that the insurer shall not terminate or materially modify such without written notice to Licensor at least twenty (20) days in advance thereof.', 'Company agrees to provide and maintain, at its own expense, general commercial and product liability insurance with limits no less than Three Million Dollars ($3,000,000) and naming Licensor and Duval as additional named insureds.', 'A certificate of insurance evidencing such coverage shall be furnished to Duval within thirty (30) days of the full execution of this Agreement.', 'Such insurance policy shall provide that the insurer shall not terminate or materially modify such policy or remove Duval as an additional named insured without prior written notice to Duval at least twenty (20) days in advance thereof.', 'Company shall provide and maintain, at its own expense, commercial general liability insurance and advertising injury coverage, with limits of not less than One Million Dollars ($1,000,000.00), and shall cause such policy to be endorsed to state that Duval is an additional named insured thereunder.']",Yes,[],No,['It is understood that Duval is not a party hereto and has no liability hereunder but is an intended specific third party creditor beneficiary hereof.'],Yes
SPORTHALEYINC_09_29_1997-EX-10.2-10-ENDORSEMENT AGREEMENT.PDF,['ENDORSEMENT AGREEMENT'],[],No,[],No,[],No,[],No,[],No,[],No,[],No
TEARDROPGOLFCO_10_23_1996-EX-10.12-ENDORSEMENT AGREEMENT.PDF,['Endorsement Agreement'],[],No,[],No,"['In addition, TPC agrees that Consolidated Artists shall be entitled to the Retainer Fee prorated to the effective date of termination as well any Tournament Bonuses, Money List Bonuses and any Royalty Compensation earned by Consolidated Artists prior to the effective date of termination.']",Yes,[],No,[],No,[],No,[],No
WARNINGMANAGEMENTSERVICESINC_12_10_1999-EX-10-ENDORSEMENT AGREEMENT.PDF,['ENDORSEMENT AGREEMENT'],[],No,"[""In no event (including, but not limited to, Manning's or Pey Dirt's default hereunder) shall Manning or Pey Dirt be liable to Company (or any entity claiming through Company) for any amount in excess of the amounts of royalties actually received by Pey Dirt hereunder, excluding the reimbursement of expenses."", 'Under no circumstances will Manning or Pey Dirt, on the one hand, or Company, on the other hand, be liable to the other or any other entity for any special, consequential, indirect, exemplary and/or punitive damages, or for loss of good will or business profits.']",Yes,[],No,[],No,"[""Company agrees to provide and maintain, at its own expense, general liability insurance and product liability insurance with limits no less than $3,000,000 and within thirty (30) days from the date hereof, Company will submit to Pey Dirt a fully paid policy or certificate of insurance naming Pey Dirt, Pey Dirt's agent and Manning as additional insured parties, requiring that the insurer shall not terminate or materially modify such without written notice to Pey Dirt at least twenty (20) days in advance thereof.""]",Yes,[],No,[],No
