Filename,Document Name,Termination For Convenience,Termination For Convenience-Answer,Change Of Control,Change Of Control-Answer,Anti-Assignment,Anti-Assignment-Answer,Post-Termination Services,Post-Termination Services-Answer
CybergyHoldingsInc_20140520_10-Q_EX-10.27_8605784_EX-10.27_Affiliate Agreement.pdf,['MARKETING AFFILIATE AGREEMENT'],[],No,[],No,"['MA may not assign, sell, lease or otherwise transfer in whole or in party any of the rights granted pursuant to this Agreement without prior written approval of Company.']",Yes,[],No
EuromediaHoldingsCorp_20070215_10SB12G_EX-10.B(01)_525118_EX-10.B(01)_Content License Agreement.pdf,['VIDEO-ON-DEMAND CONTENT LICENSE AGREEMENT'],"[""Notwithstanding any other provision of this Agreement, Rogers may terminate this Agreement, at any time, upon sixty (60) days' prior written notice to Licensor.""]",Yes,[],No,"['This Agreement may not be assigned, sold or transferred without the prior written consent of the other party.', 'Notwithstanding the foregoing, Rogers may, without consent, assign its rights and obligations under this Agreement in whole or in part to: (i) a person that directly or indirectly controls, is controlled by or is under common control with Rogers; or (ii) a purchaser of all or substantially all of the assets used in connection with the ROD Service. A change of control of Rogers shall not be considered an assignment of this Agreement.', 'Any purported assignment, sale, or transfer in contravention of this Section shall be null and void.']",Yes,[],No
FulucaiProductionsLtd_20131223_10-Q_EX-10.9_8368347_EX-10.9_Content License Agreement.pdf,['CONTENT DISTRIBUTION AND LICENSE AGREEMENT'],[],No,[],No,[],No,[],No
GopageCorp_20140221_10-K_EX-10.1_8432966_EX-10.1_Content License Agreement.pdf,['WEBSITE CONTENT LICENSE AGREEMENT'],[],No,"[""For purposes of the preceding sentence, and without limiting its generality, any merger, consolidation or reorganization involving Licensee (regardless of whether Licensee is a surviving or disappearing entity) will be deemed to be a transfer of rights, obligations or performance under this Agreement for which Licensor's prior written consent is required.""]",Yes,"['Any purported assignment, delegation or transfer in violation of this Section 11.7 is void from the outset and shall be of no force or effect.', ""Licensee shall not assign or otherwise transfer any of its rights, or delegate or otherwise transfer any of its obligations or performance, under this Agreement, in each case whether voluntarily, involuntarily, by operation of law or otherwise, without Licensor's prior written consent.""]",Yes,[],No
IdeanomicsInc_20160330_10-K_EX-10.26_9512211_EX-10.26_Content License Agreement.pdf,['CONTENT LICENSE AGREEMENT'],[],No,[],No,"[""Except as otherwise specified in the previous sentence, Licensee may not sublicense any of its rights under Section 2(a) [License Grant] without Licensor's prior written consent, which shall not be unreasonably withheld or delayed."", ""Licensee shall have the right to assign or sublicense any or all of its rights granted under this Agreement, in whole or in part, to third parties exhibiting the Titles in the ordinary course of Licensee's business with prior written notice to Licensor and subject to the applicable limitations (if any) in Section 2(a)(i) [License Grant]"", ""Neither party may assign its rights, duties or obligations under this Agreement to any third party in whole or in part, without the other party's prior written consent, except that (i) Licensee may assign its rights and obligations to this Agreement to any of its Affiliate or subsidiaries with the prior written consent of the Licensor, and (ii) Licensor may assign its rights and obligations in this Agreement to its Affiliates or subsidiaries and either party may assign this Agreement in its entirety to any purchaser of all or substantially all of its business or assets pertaining to the line of business to which this Agreement relates or to any Affiliate of the party without the other party's approval.""]",Yes,[],No
DeltathreeInc_19991102_S-1A_EX-10.19_6227850_EX-10.19_Co-Branding Agreement_ Service Agreement.pdf,['CO-BRANDING AND SERVICES AGREEMENT'],[],No,"['The term of this Agreement shall be effective as of the date first stated above and shall continue for a term of three (3) years, unless terminated earlier in accordance with the provisions of this Agreement (the ""Term""); provided, however, that PrimeCall may elect to terminate this Agreement, upon thirty (30) days\' written notice, at any time from and after the time that collectively RSL Communications, Ltd. and/or its Affiliates holds less than fifty percent (50%) of the voting control of DeltaThree\'s outstanding shares.']",Yes,"['Except as provided in the preceding sentence, this Agreement may not be assigned by PrimeCall without the prior written consent of DeltaThree.', 'This Agreement may not be assigned by DeltaThree without the prior written consent of PrimeCall.']",Yes,[],No
EdietsComInc_20001030_10QSB_EX-10.4_2606646_EX-10.4_Co-Branding Agreement.pdf,['CO-BRANDING AGREEMENT'],[],No,"['For purposes of this Agreement, ""Change in Control"" means a merger or consolidation of the party with, or any sale of all or substantially all of the assets of such party to, any other person, corporation or entity, unless as a result of such merger, consolidation or sale of assets the holders of such party\'s voting securities prior thereto hold at least fifty percent (50%) of the total voting power represented by the voting securities of the surviving or successor corporation after such transaction.']",Yes,"['Any attempt to assign this Agreement other than as permitted above will be null and void.', ""Neither party may assign this Agreement, in whole or in part, without the other party's written consent (which will not be unreasonably delayed or withheld), except that no such consent will be required in connection with an assignment or transfer of this Agreement to (a) a party's successor in connection with a Change in Control of such party, provided that such successor is not a competitor of the other party, or (b) to any entity that is<omitted>controlled by, under common control with, or controls a party.""]",Yes,[],No
IntegrityMediaInc_20010329_10-K405_EX-10.17_2373875_EX-10.17_Co-Branding Agreement.pdf,['PRODUCT DEVELOPMENT AND CO-BRANDING AGREEMENT'],[],No,[],No,"['Either party may, at its election, assign this Agreement or          any of its rights or delegate any of its obligations hereunder, in          whole or in part, to any person, firm or corporation owning or          acquiring all or a substantial portion of its assets, to any person,          firm or corporation that is related to it as an affiliate,<omitted>subsidiary or otherwise, or to any person, firm or corporation into          which or with it might merge or consolidate.', 'In the event of such an<omitted>assignment by either party of its rights to an unrelated third party,          the other party shall be given written notice, then in such event the          other party may upon six-months (6-months) written notice terminate          this Agreement.']",Yes,[],No
MusclepharmCorp_20170208_10-KA_EX-10.38_9893581_EX-10.38_Co-Branding Agreement.pdf,['ENDORSEMENT LICENSING AND CO-BRANDING AGREEMENT'],[],No,"[""Nothwithstanding the foregoing, this Agreement may be assigned without the AS Parties' consent by MusclePharm in connection with a change of control transaction; provided that the acquirer of MusclePharm shall have financial resources substantially similar or greater than MusclePharm and shall specifically assume the obligations of MusclePharm under this Agreement in writing prior to the consummation of the change of control transaction."", 'Neither party shall voluntarily or by operation of law assign or otherwise transfer the rights and/or obligations incurred pursuant to the terms of this Agreement without the prior written consent of the other party.']",Yes,"['Any attempted assignment or transfer by a party of their rights and/or obligations without such consent shall be void.', 'The license granted by this Agreement is personal to MusclePharm.', 'Neither party shall voluntarily or by operation of law assign or otherwise transfer the rights and/or obligations incurred pursuant to the terms of this Agreement without the prior written consent of the other party.', 'This Agreement may also be terminated by MusclePharm, upon fifteen days prior written notice, if death, or physical disability, physical injury, or other incapacity lasting more than eight (8) weeks, causes Endorser to be unable to perform a material amount of the personal or consulting services described in this Agreement.', 'Except as set forth below, MusclePharm shall not assign or otherwise transfer, license, sublicense, or delegate any rights or obligations under this Agreement without the express prior written consent of the AS Parties.']",Yes,"['Notwithstanding the foregoing, in the event the expiration of this Agreement or termination of this Agreement by Musclepharm pursuant to paragraph 9(a), MusclePharm shall be entitled to sell-off the remaining Licensed Products for six (6) months after such expiration of this Agreement pursuant to paragraph 4(d) herein and shall continue to pay Endorser the Royalty set forth in paragraph 7 herein.', ""MusclePharm's obligations for the payment of a Royalty and the Guaranteed Minimum Royalty (as defined below) shall survive expiration or termination of this Agreement and will continue for so long as MusclePharm continues to manufacture, sell or otherwise market the Licensed Products."", 'During the Term, the right to use Endorser\'s Name and Appearance Rights granted to MusclePharm in this Section shall extend for six (6) months beyond the expiration of this Agreement (the ""Use-up Period"").', 'During the Term of this Agreement and during any sell-off period, MusclePharm shall pay Lender a royalty (the ""Royalty"") of 10% on Net Sales (as defined below) of Licensed Products sold through its wholesale Distribution Channels or retail Distribution Channels, as the case may be and 10% on Net Sales of the Training Video and any Products sold in connection with any Training Video as contemplated pursuant to the last sentence of Section 4(a)(i) above.', ""MusclePharm shall create no new advertising during the Use-up Period using Endorser's Name and Appearance, but shall have the right to use during the Use-up Period Endorser's Name and Appearance in advertisements and promotional materials created before the expiration date of this Agreement."", 'MusclePharm agrees to preserve and keep accessible and available to the AS Parties all relevant books and records for a period of at least three (3) years following the expiration or termination of the Agreement.']",Yes
TomOnlineInc_20060501_20-F_EX-4.46_749700_EX-4.46_Co-Branding Agreement.pdf,['CO-BRANDING AGREEMENT'],[],No,"[""Notwithstanding the foregoing, Skype or Skype Holding may assign this Agreement to a third party without such consent in the event of a merger, reorganization or sale of all or substantially all of Skype's or Skype Holding's assets or voting securities, provided that written notice of such assignment is delivered to Online BVI and the Company and the assignee assumes all the responsibilities and obligations provided herein.""]",Yes,"['Notwithstanding the foregoing, upon the prior written approval of Online BVI, which approval may be withheld in its sole discretion, the Company shall be permitted to sublicense its rights hereunder to a wholly-owned Subsidiary of the Company or a majority-owned Subsidiary of Tom Holding, for the same purpose and under the same terms and conditions as the license set forth herein.', 'This Agreement may not be assigned by a party to this Agreement to any other Person without the express written approval of the other parties to this Agreement and any attempt at assignment in violation of this section shall be null and void.']",Yes,"['The Parties (including Online BVI on behalf of the Online Group) agree to maintain records (i) of all information reasonably necessary to verify all calculations to be made under Section 8.3.2, and (ii) supporting, verifying and necessary to demonstrate the calculation and collection of fees and/or revenue, as well as any deductions thereto, and payments made hereunder, including, without limitation, budgets, purchase orders, expense records, invoices, correspondence, banking and financial and other records pertaining to the determination of Gross Revenue, Direct Expenses and Adjusted Net Revenue, during the term of this Agreement and for a period of two (2) years following the expiration or termination hereof.', 'Each Party shall (i) immediately stop displaying, featuring, linking or in any other manner using the Company-Skype Branded Application (provided in the case of Skype, other than the Skype Software in the Company-Skype Branded Application), Company-Skype Toolbar, Company-Skype Branded Web Site, Company-Skype Branded Content, any co-branded materials or any other Intellectual Property of the other Parties (including, without limitation, Intellectual Property deemed to be owned by the other Parties under Section 4.2.3.2); (ii) return such materials directly to the other Parties, or delete and overwrite any electronically stored copies of such materials within thirty (30) days from the date of termination of this Agreement; (iii) within such thirty (30) day period, deliver to the other Parties a certificate duly executed by its authorised officer certifying its compliance with the foregoing, and (iv) provide the other Parties with such information and access to data and databases as may be necessary to permit such other Parties to fulfil any contractual obligations by them to users of the Company-Skype Branded Application undertaken by such other Parties prior to the time of termination.', 'The Parties agree that notwithstanding any termination or expiration of this Agreement, the rights and licenses granted to any Company- Skype Branded Customers prior to termination or expiration of this Agreement pursuant to any EULA shall continue during the 24 months after such termination or expiration for the sole purpose of permitting such users to continue to access and utilize the Company-Skype Branded Application and the Company-Skype Toolbar, and so long as any Gross Revenue is received with respect to the Company-Skype Branded Application and/or the Company-Skype Toolbar, the provisions of Section 5 shall continue to be applicable after any termination or expiration.']",Yes
ConformisInc_20191101_10-Q_EX-10.6_11861402_EX-10.6_Development Agreement.pdf,['DEVELOPMENT AGREEMENT'],[],No,"[""Except as otherwise provided herein, a Party shall not have the right to   assign any of its rights or obligations under this Agreement (whether through a merger, sale of stock, or otherwise) without the   prior written consent of the other Party; except that, either Party shall be permitted, without any need for the other Party's   consent, to assign this Agreement (a) in whole or in part to an Affiliate (provided, however, that once such Person is no longer an   Affiliate of the assigning Party, such former Affiliate shall assign this Agreement back to the assigning Party), provided that the   assigning Party provides the other Party notice of any such assignment provided further that failure to provide such notice of such   assignment shall not render such assignment void; or (b) to a Third Party in connection with sale or transfer of all or substantially all   of the assigning Party's business or assets relating to the subject matter of this Agreement, whether by Change of Control, merger,   sale of assets or otherwise; provided, however, that, with respect to clause (b), (i) any assignment of this Agreement shall be void   and have no effect unless and until the assignee assumes the<omitted>obligations of the assigning Party in a written instrument, a copy of which is provided to the other Party; and (ii) any assignment of   this Agreement must be accompanied by a simultaneous assignment of the Other Agreements to the same assignee, and the   assigning Party's interest in the Purchased Assets to the same assignee unless otherwise agreed by Conformis in advance, which   agreement shall not be unreasonably withheld.""]",Yes,"['To the extent working with Agents or other Third Parties is permitted under the R&D Work   Plan, should a Party wish to engage an Agent or any other Third Party in connection with the R&D Work Plan or any other work   under this Agreement, such Party must obtain in advance a written agreement by such Agent or other Third Party (i) to assign to   the Party all Inventions conceived, created or generated by the Agent or other Third Party, and (ii) to maintain all Confidential   Information in confidence as set forth in Section 5.2.', ""Except as otherwise provided herein, a Party shall not have the right to   assign any of its rights or obligations under this Agreement (whether through a merger, sale of stock, or otherwise) without the   prior written consent of the other Party; except that, either Party shall be permitted, without any need for the other Party's   consent, to assign this Agreement (a) in whole or in part to an Affiliate (provided, however, that once such Person is no longer an   Affiliate of the assigning Party, such former Affiliate shall assign this Agreement back to the assigning Party), provided that the   assigning Party provides the other Party notice of any such assignment provided further that failure to provide such notice of such   assignment shall not render such assignment void; or (b) to a Third Party in connection with sale or transfer of all or substantially all   of the assigning Party's business or assets relating to the subject matter of this Agreement, whether by Change of Control, merger,   sale of assets or otherwise; provided, however, that, with respect to clause (b), (i) any assignment of this Agreement shall be void   and have no effect unless and until the assignee assumes the<omitted>assigning Party in a written instrument, a copy of which is provided to the other Party; and (ii) any assignment of   this Agreement must be accompanied by a simultaneous assignment of the Other Agreements to the same assignee, and the   assigning Party's interest in the Purchased Assets to the same assignee unless otherwise agreed by Conformis in advance, which   agreement shall not be unreasonably withheld."", 'Any   assignment not in accordance with this Section 10.2 shall be void.']",Yes,[],No
EtonPharmaceuticalsInc_20191114_10-Q_EX-10.1_11893941_EX-10.1_Development Agreement.pdf,['EXCLUSIVE LICENSE AND PRODUCT DEVELOPMENT AGREEMENT'],"[""ETON has the right to terminate this Agreement after approval of the Dossier or marketing application for the Product (or added new product), at its sole discretion, upon providing one hundred eighty (180) days' written notice to Aucta.""]",Yes,"['Notwithstanding the foregoing, each Party may assign the rights and obligations under this Agreement in whole, without consent of the other Party, to a Third Party or Affiliate in connection with the transfer or sale of all or substantially all of its business or in the event of a merger, consolidation or change in control provided that the assignee assumes in writing and becomes directly obligated to the other Party to perform all of the obligations of assignor under this Agreement.']",Yes,"['The Parties shall not assign, encumber or otherwise transfer this Agreement or any part of it to any Third Party, without the prior written consent of the other Party.']",Yes,"['In addition, within twenty-five (25) months after the termination or expiration of the Term and on a Product-by-Product basis, ETON shall perform a final ""true-up"" reconciliation and shall provide Aucta with a written report of such outlining the deductions specified in the definition of Net Sales.', ""After termination is effective and Aucta assumes control of the Product, ETON will provide, to the extent practicable, transition services to Aucta to include assistance with Product distribution, processing of rebates, drug safety, etc. at Aucta's cost for such services, for a reasonable period of time as mutually determined by the Parties but not to exceed one hundred eighty (180) days following termination so that Aucta can get its own such services in place."", ""If this Agreement is terminated by Aucta under Section 11.2 or 11.3, then (a) ETON shall have the right to, and Aucta shall hereby grant ETON a license to, Market or otherwise dispose of any existing inventory of any Products then in ETON's possession subject to paying all Royalties and other amounts due hereunder for such sales, (b) Aucta may keep all the payments under Section 6 paid by ETON up to the point of termination and for ETON's disposal of remaining inventory and Aucta is free to commercialize or relicense the Product with no further obligations owed to ETON, (c) ETON shall refrain from holding itself out as Aucta's distributor, in particular, eliminate any reference to the Product and Aucta from its business, trade style and promotional material, and (d) ETON shall transfer all rights, licenses within thirty (30) days of termination.""]",Yes
FuelcellEnergyInc_20191106_8-K_EX-10.1_11868007_EX-10.1_Development Agreement.pdf,['JOINT DEVELOPMENT AGREEMENT'],"['Accordingly, either Party may terminate this Agreement or all/part of a Project for any reason and at any time upon giving the other Party sixty (60) days prior written notice.']",Yes,"['Subject to requirements of applicable law, FCE will provide notice to ExxonMobil prior to, or promptly after, it becomes aware of any such Change in Control, and if prior notice is prohibited by applicable Law, as soon as practicable or after such notice is no longer prohibited, but in no event later than one (1) business day after any public announcement with respect to any such asset transfer or Change in Control.', 'ExxonMobil may terminate this Agreement upon fifteen (15) days written notice, without penalty, payment or prejudice to claims and obligations then accrued, if FCE undergoes a Change in Control.', 'Notwithstanding anything else in this Agreement, in the event of termination under this Paragraph 12.04 ExxonMobil may terminate any licenses granted to FCE under this Agreement that would otherwise survive termination, taking into account the circumstances surrounding the Change in Control.']",Yes,"['The Agreement is not assignable, including any assignment by operation of law (including but not limited to as a result of a merger or other corporate action), by either Party without the prior written consent of the other Party.', 'Notwithstanding the foregoing, ExxonMobil may assign this Agreement to its Affiliates and FCE may assign this Agreement to any of its wholly-owned and wholly-controlled Affiliates, with prior written notice to the other Party, provided that (i) such assignment by FCE shall be void if at any point such Affiliate ceases to be both wholly-owned and wholly- controlled by FCE, (ii) Article 12, including but not limited to Paragraphs 12.03, 12.04 and 12.05, shall be applicable to both FCE and any Affiliate assignee of FCE, and (iii) no assignment pursuant to this sentence will relieve the Parties of their obligations under this Agreement.']",Yes,"['Such books, records and accounts will be maintained for a period of at least three (3) years following the termination or expiration of this Agreement, provided there are no pending disputes between the Parties.']",Yes
ReedsInc_20191113_10-Q_EX-10.4_11888303_EX-10.4_Development Agreement.pdf,['RECIPE DEVELOPMENT AGREEMENT'],[],No,[],No,"[""Company may not assign or transfer its rights or obligations under this Agreement, whether by operation of law, contract or otherwise, without the prior written consent of Reed's, which shall not be unreasonably withheld (it being understood that a purported assignment to a Reed's competitor identified or referred to in Exhibit D of the Manufacturing and Distribution Agreement shall be considered to be a reasonable basis for withholding consent).""]",Yes,[],No
