Filename,Document Name,Termination For Convenience,Termination For Convenience-Answer,Change Of Control,Change Of Control-Answer,Anti-Assignment,Anti-Assignment-Answer,Post-Termination Services,Post-Termination Services-Answer
ThriventVariableInsuranceAccountB_20190701_N-6_EX-99.D(IV)_11720968_EX-99.D(IV)_Endorsement Agreement.pdf,['ENDORSEMENT'],[],No,[],No,['Society membership rights and privileges cannot be transferred or assigned.'],Yes,[],No
ArcaUsTreasuryFund_20200207_N-2_EX-99.K5_11971930_EX-99.K5_Development Agreement.pdf,['BLOCKCHAIN ADMINISTRATION AND DEVELOPMENT AGREEMENT'],[],No,[],No,"['This Agreement will automatically terminate in the event of its ""assignment"" (as such term is defined for purposes of Section 15(a) (4) of the Investment Fund Act).']",Yes,[],No
AimmuneTherapeuticsInc_20200205_8-K_EX-10.3_11967170_EX-10.3_Development Agreement.pdf,"['LICENSE, DEVELOPMENT AND COMMERCIALIZATION AGREEMENT']","[""Aimmune may terminate this Agreement in its entirety at any time for its convenience upon sixty (60) days' prior written notice to Xencor."", 'Without limitation of its rights under this ARTICLE 13, Xencor may also terminate this Agreement in its entirety as applicable, pursuant to the provisions of Section 9.7.']",Yes,[],No,"['Any assignment or transfer, or attempted assignment or transfer, by either Party in violation of the terms of this Section 15.6 shall be null and void and of no legal effect.', ""Neither Party may assign or transfer this Agreement or any rights or obligations hereunder without the prior written consent of the other Party, except that a Party may make such an assignment or transfer without the other Party's written consent to (a) any of its Affiliates, in whole or in part, or (b) any Third Party in connection with (i) the acquisition of such Party by or merger or consolidation of such Party with another entity or (ii) a merger, consolidation, sale of stock, sale of all or substantially all of such Party's assets or other similar transaction in which such Third Party either becomes the owner of all or substantially all of the business and assets of (y) such Party or (z) that portion of such Party's business or business unit relating to this Agreement.""]",Yes,"['Upon expiration of this Agreement with respect to a Product in a country, the licenses granted to Aimmune pursuant to this Agreement shall continue in full force and effect on a fully-paid basis.', 'Upon the termination of this Agreement:\n\n14.1.1 all rights and licenses granted to Aimmune hereunder shall immediately terminate and be of no further force and effect and Aimmune shall cease Developing, Commercializing, Manufacturing and Packaging and Labeling such Product in and for all applicable countries; provided, that Aimmune and its Affiliates will be entitled, during the period<omitted>ending on the last day of the [***] following the effective date of such termination, to sell any inventory of Product affected by such termination that remains on hand as of the effective date of the termination, so long as Aimmune pays to Xencor all amounts payable hereunder (including milestones) applicable to said subsequent sales, as applicable, in accordance with the terms and conditions set forth in this Agreement and otherwise complies with the terms set forth in this Agreement.']",Yes
CnsPharmaceuticalsInc_20200326_8-K_EX-10.1_12079626_EX-10.1_Development Agreement.pdf,['Development Agreement'],[],No,[],No,[],No,[],No
ClickstreamCorp_20200330_1-A_EX1A-6 MAT CTRCT_12089935_EX1A-6 MAT CTRCT_Development Agreement.pdf,['APPLICATION DEVELOPMENT AGREEMENT'],['Client has the unilateral right to cancel this agreement at any time within a 7-day notice period.'],Yes,[],No,"['The Developer may not, without the written consent of the Client, assign, subcontract, or delegate its obligations under this Agreement, except that the Developer may transfer the right to receive any amounts that may be payable to it for its Services under this Agreement, which transfer will be effective only after receipt by the Client of written notice of such assignment or transfer.']",Yes,[],No
CoherusBiosciencesInc_20200227_10-K_EX-10.29_12021376_EX-10.29_Development Agreement.pdf,['LICENSE AND DEVELOPMENT AGREEMENT'],"[""Licensee may terminate this Agreement for convenience upon eighteen (18) months' advance written notice to Bioeq; provided, however, that any such termination for convenience shall not become effective prior to twelve (12) months after the First Commercial Sale of the first Licensed Product.""]",Yes,"['Licensee shall notify Bioeq in writing within [***] ([***]) days after entry by Licensee into a definitive agreement which would result in a Competitor Change of Control.', 'Upon the consummation of such definitive agreement, if Licensee has not then divested all such Competitive Products such that a Competitor Change of Control has occurred, Bioeq may, upon sending written notice to Licensee within sixty (60) days thereafter, terminate this Agreement.', 'Bioeq may terminate this Agreement immediately upon written notice to Licensee, if Licensee conducts any clinical development of, markets, sells or distributes any Competitive Product in the Territory, whether directly or indirectly through the intermediary of a Third Party or its Affiliates (Restricted Activities); provided, that in the event that Restricted Activities are being or would be deemed to be conducted by Licensee solely in connection with a Competitor Change of Control, Bioeq may not terminate this Agreement in accordance with this Section 15.2.2 and instead may terminate this Agreement in accordance with Section 15.2.9.']",Yes,"[""Except as otherwise expressly provided under this Agreement, neither Party may assign or otherwise transfer this Agreement or any right or obligation hereunder (whether voluntarily, by operation of law or otherwise), without the prior express written consent of the other Party; except however, that either Party shall be permitted to effect such an assignment or transfer without the consent of the other Party to (a) any of its Affiliates or (b) in connection with a sale of all or substantially all of its assets to which this Agreement relates, whether by merger, acquisition, asset sale, stock purchase, or otherwise, but in any event subject to Bioeq's ability to terminate this Agreement in accordance with Section 15.2.9 (for the avoidance of doubt, such termination right pursuant to Section 15.2.9 shall apply mutatis mutandis in case of assignment of the Agreement to a Competitor in all cases listed under subsection (b) above)"", 'Any purported assignment or transfer in violation of this Section 16.4 shall be null and void.', 'Licensee shall be entitled to freely subcontract or delegate any of its rights or obligations under this Agreement to its Affiliates or to Third Parties, provided that (i) all sales of Licensed Products in the Field in the Territory continue to be made by Licensee or its Affiliates (or their wholesalers or distributors) and (ii) Licensee shall remain liable for the performance of its obligations under this Agreement.']",Yes,"[""Licensee shall, within [***] ([***]) days of the effective date of termination of the Agreement at the latest (and at no cost to Bioeq if this Agreement is terminated by Bioeq pursuant to Sections 15.2.1, 15.2.2, 15.2.3, 15.2.4, 15.2.8 or 15.2.9, or by Licensee pursuant to Section 15.2.5, or at Bioeq's cost and expense if this Agreement is terminated by Licensee pursuant to Sections 15.2.1, 15.2.6, 15.2.7 or 15.2.8, as applicable) transfer and assign to Bioeq or its designee all of Licensee's right, title and interest in and to any and all Biologics License Applications and Biologics License Application Approvals controlled by Licensee for the Licensed Products in the Field in the Territory as of the effective date of such termination, including any and all documentation pertaining to such filings and Biologics License Application Approvals (provided that the physical or electronic transfer of files and documentation in connection with such transfer and assignment of rights may occur after such [***] ([***]) day period without being deemed a breach of this Section 15.3.2 by Licensee)"", ""Licensee shall be permitted, at Bioeq's choice (if this Agreement is terminated by Bioeq pursuant to Sections 15.2.1, 15.2.2, 15.2.3, 15.2.4, 15.2.8 or 15.2.9, or by Licensee pursuant to Section 15.2.5) or at Licensee's choice (if this Agreement is terminated by Licensee pursuant to Sections 15.2.1, 15.2.6, 15.2.7 or 15.2.8), to cither (a) continue selling its and its Affiliates' inventory of Licensed Products existing on the termination effective date in accordance with this Agreement for a maximum period of [***] ([***]) days (in which case all terms and conditions of this Agreement, including Licensee's obligation to report and pay royalties, shall continue to apply to such continued sale) or (b) sell such inventory to Bioeq at the supply price paid by Licensee to Bioeq for such inventory in accordance with the Manufacturing and Supply Agreement."", ""Licensee shall (at no cost to Bioeq if this Agreement is terminated by Bioeq pursuant to Sections 15.2.1, 15.2.2, 15.2.3, 15.2.4, 15.2.8 or 15.2.9, or by Licensee pursuant to Section 15.2.5, or at Bioeq's cost and expense if this Agreement is terminated by Licensee pursuant to Sections 15.2.1, 15.2.6, 15.2.7 or 15.2.8, as applicable) use Commercially Reasonable Efforts to cooperate with Bioeq or its designee, and provide [***] reasonable assistance and support, to [***] Bioeq or its designee to take over the Commercialization of the Licensed Products in the Field in the Territory [***] following the effective date of such termination, including by (a) using Commercially Reasonable Efforts to provide [***], (b) disclosing and assigning (to the extent permitted under the relevant agreement) to Bioeq Licensee's existing agreements relating solely to the Commercialization of the Licensed Product in the Territory, including with [***], to the extent legally possible ([***]) and (c) transferring Licensed Product- specific marketing materials, including [***].""]",Yes
ElPolloLocoHoldingsInc_20200306_10-K_EX-10.16_12041700_EX-10.16_Development Agreement.pdf,['FRANCHISE DEVELOPMENT AGREEMENT (Non-exclusive/Exclusive)'],"[""This Agreement shall terminate immediately upon El Pollo Loco's receipt of Developer's notice to terminate."", 'Franchisor may terminate or modify any rights that Developer may have with respect to protected exclusive rights in the Territory, as granted under Section 1.1 above, effective ten (10) days after delivery of written notice thereof to Developer.']",Yes,"['Franchisor reserves the right to approve or disapprove any Transfer as its sole and absolute right.', 'The following events shall constitute a default by Developer, which shall result in El Pollo Loco\'s right to declare the termination of this Agreement, if such default is not cured within thirty (30) days after written notice by Franchisor to Developer:<omitted>d. Any change, transfer or conveyance (""Transfer"") in the ownership of Developer, which Transfer has not been approved in advance by Franchisor.', ""For purposes of this Section, a sale of stock, or any membership or partnership interest in Developer, or a merger or other combination of Developer shall be considered a transfer of Developer's interest prohibited hereunder.""]",Yes,"[""The following events shall constitute a default by Developer, which shall result in El Pollo Loco's right to declare the immediate termination of this Agreement.<omitted>b. Any assignment, transfer or sublicense of this Agreement by Developer without the prior written consent of El Pollo Loco."", ""Therefore, the rights, privileges and interests of Developer under this Agreement shall not be assigned, sold, transferred, leased, divided or encumbered, voluntarily or involuntarily, in whole or in part, by operation of law or otherwise without the prior written consent of El Pollo Loco, which consent may be given or withheld as El Pollo Loco's sole and absolute right.""]",Yes,[],No
EmeraldHealthBioceuticalsInc_20200218_1-A_EX1A-6 MAT CTRCT_11987205_EX1A-6 MAT CTRCT_Development Agreement.pdf,['Consulting and Product Development Agreement'],"['EHS or EHN, on the one hand, and Dr. Murray, on the other, may terminate any Services Term of this Agreement by delivering 60 days written notice to the other party.']",Yes,[],No,"[""Dr. Murray has unique qualifications to provide the services contemplated herein, and shall not assign any of its or his rights or obligations to any other person or entity without EHS's written consent, which may be withheld or granted in EHS's discretion.""]",Yes,[],No
HarpoonTherapeuticsInc_20200312_10-K_EX-10.18_12051356_EX-10.18_Development Agreement_Option Agreement.pdf,['DEVELOPMENT AND OPTION AGREEMENT'],"[""AbbVie may terminate this Agreement in its entirety, or on a country or other jurisdiction -by-country or other jurisdiction basis, for any or no reason, upon ninety (90) days' prior written notice to Harpoon.""]",Yes,"['Notwithstanding the provisions of Section 5.8, if, during the Term, (a) Harpoon or any of its Affiliates acquires, as the result of an Acquisition, rights to a Competing Product, such Acquisition, and the development, manufacture or commercialization of such Competing Product thereafter, shall not constitute a breach of Section 5.8 if Harpoon or such Affiliate, as applicable, [***]; or (b) Harpoon undergoes a Change in Control and the relevant acquirer is either then commercializing a Competing Product, or has in development any Competing Product, such Change in Control, and the commercialization (or development and subsequent commercialization, if such Competing Product receives Regulatory Approval) of such Competing Product by such relevant acquirer or any of its Affiliates, shall not constitute a breach of Section 5.8; provided that such (x) acquirer Segregates the Competing Product and (y) AbbVie shall have the right, in its sole and absolute discretion, by written notice delivered to Harpoon (or its successor) at any time during the [***] following the written notice contemplated by Section 13.2.1, to (i) terminate any or all provisions of this Agreement providing for any delivery by AbbVie to Harpoon of Confidential Information of AbbVie relating to activities contemplated by this Agreement, save only for (A) Article 6, (B) information regarding sublicenses pursuant to Section 5.3, (C) information regarding the prosecution, enforcement, defense, litigation, infringement and licensing of Patents pursuant to (1) Sections 7.2.1, 7.2.3, 7.3.1, 7.3.5, 7.4, and 7.5.2, (2) solely with respect to Joint Patents, Sections 7.2.2, 7.3.2, and 7.5.3, and (3) solely with respect to Joint Patents and Harpoon Patents, Sections 7.3.4 and 7.5.1, (D) notice of any license pursuant to Section 5.9.2, (E) safety data pursuant to Section 8.1, (F) proposed disclosures pursuant to Section 9.5, (G) communications under Section 11.4 and (H) notices pursuant to Sections 11.3 and 13.1; and (ii) disband the JGC and terminate its activities, in which case the provisions set forth in the last sentence of Section 2.3 shall apply.', 'Harpoon (or its successor) shall provide AbbVie with written notice of any Change in Control of Harpoon or Acquisition by Harpoon within [***] following the closing date of such transaction.']",Yes,"['AbbVie may use one (1) or more of its Affiliates to perform its obligations and duties hereunder and such AbbVie Affiliates are expressly granted certain rights herein; provided that each such Affiliate shall be bound by the corresponding obligations of AbbVie and, subject to an assignment to such Affiliate pursuant to Section 13.4, AbbVie shall remain liable hereunder for the prompt payment and performance of all their respective obligations hereunder.', ""Without the prior written consent of the other Party, such consent not to be unreasonably withheld, conditioned, or delayed, neither Party shall sell, transfer, assign, delegate, pledge, or otherwise dispose of, whether voluntarily, involuntarily, by operation of law or otherwise, this Agreement or any of its rights or duties hereunder; provided that either Party may make such an assignment without the other Party's consent to its Affiliate or to a successor, whether in a merger, sale of stock, sale of assets or any other transaction, of the business to which this Agreement relates."", 'Any attempted assignment or delegation in violation of this Section 13.4 shall be void and of no effect.']",Yes,"[""If AbbVie terminates this Agreement with respect to a country or other jurisdiction, or in its entirety pursuant to Section 12.3, AbbVie shall have the right for at least [***] and no more than [***], which period shall be determined by Harpoon in its sole discretion, after the effective date of such termination with respect to such country or other jurisdiction to sell or otherwise dispose of all Licensed Compound or Licensed Product then in its inventory and any in-progress inventory, in each case that is intended for sale or disposition in such country or other jurisdiction, as though this Agreement had not terminated with respect to such country or other jurisdiction, and such sale or disposition shall not constitute infringement of Harpoon's or its Affiliates' Patent or other intellectual property or other proprietary rights."", 'The insurance policies shall be under an occurrence form, but if only a claims-made form is available to a Party, then such Party shall continue to maintain such insurance after the expiration or termination of this Agreement for the longer of (a) a period of [***] following termination or expiration of this Agreement in its entirety, or (b) with respect to a particular Party, [***] by a Party.']",Yes
IbioInc_20200313_8-K_EX-10.1_12052678_EX-10.1_Development Agreement.pdf,['MASTER JOINT DEVELOPMENT AGREEMENT'],[],No,[],No,"['Neither Party may assign its rights or delegate any of its duties under this Agreement without the prior written consent of the other Party.', 'Any unauthorized assignment of this Agreement is void.']",Yes,[],No
HfEnterprisesInc_20191223_S-1_EX-10.22_11931299_EX-10.22_Development Agreement.pdf,['OUTSOURCE TECHNOLOGY DEVELOPMENT AGREEMENT'],"[""Either party may terminate this Agreement prior to expiration of the Term: (i) upon thirty (30) days prior written notice, or (ii) immediately upon written notice to the other party if: (a) the other party declares or a petition is filed in any court for insolvency or bankruptcy and such petition is not dismissed in thirty (30) days; (b) the other party reorganizes under the relevant bankruptcy act or any similar statute in such party's jurisdiction of incorporation; (c) the other party consents to the appointment of a trustee in bankruptcy or a receiver or similar entity; or (d) the Developer breaches DSS's Technology or Intellectual Property rights contained herein.""]",Yes,"['The rights of Developer under this Agreement shall immediately cease and be terminated upon the sale or transfer of all or substantially all of the assets of Developer unless an assignment of such rights pursuant to such sale or transfer has been previously approved in writing by DSS.', 'The rights of Developer under this Agreement shall immediately cease and be terminated upon the sale or transfer of no less than a majority of, or a controlling interest in or over, the voting capital or ownership capital of Developer unless an assignment of such rights pursuant to such sale or transfer has been previously approved in writing by DSS.']",Yes,"['The rights of Developer under this Agreement shall immediately cease and be terminated upon the sale or transfer of all or substantially all of the assets of Developer unless an assignment of such rights pursuant to such sale or transfer has been previously approved in writing by DSS.', 'The rights of Developer under this Agreement shall immediately cease and be terminated upon the sale or transfer of no less than a majority of, or a controlling interest in or over, the voting capital or ownership capital of Developer unless an assignment of such rights pursuant to such sale or transfer has been previously approved in writing by DSS.', 'Developer may not assign or transfer this Agreement, nor its rights and obligations hereunder, by operation of law or otherwise, to any third party without the prior express written approval of DSS. Any purported assignment without the consent of DSS shall be void.']",Yes,[],No
LegacyEducationAllianceInc_20200330_10-K_EX-10.18_12090678_EX-10.18_Development Agreement.pdf,['REAL ESTATE EDUCATION TRAINING PROGRAM DEVELOPMENT AGREEMENT'],[],No,[],No,"['T&B shall not, during the Term, grant any third party a license to use the Licensed Intellectual Property within the Exclusive Field of Use.', ""Notwithstanding the foregoing, either party may assign this Agreement without the other party's prior written consent in the event of a merger, acquisition, reorganization, change in control, or sale of substantially all of the assets or business of such assigning part"", ""Neither party may assign this Agreement without the other party's prior written consent."", 'Any assignment in conflict with this provision shall be void.']",Yes,"['LEA shall, for a period of six (6) months (""Sell-Off Period"") following the effective date of termination of the license granted by T&B hereunder, have the right to fulfill commitments made to customers during the Term']",Yes
LiquidmetalTechnologiesInc_20200205_8-K_EX-10.1_11968198_EX-10.1_Development Agreement.pdf,['BUSINESS DEVELOPMENT AGREEMENT'],['Either Party may terminate this Agreement for any reason upon providing 180 days prior written notice to the other Party prior to the expiration of the then-current term or unless sooner terminated in accordance with the terms of this Agreement.'],Yes,[],No,"['Neither this Agreement nor any rights or obligations hereunder shall be transferred or assigned by either Party without the written consent of the other Party, which consent shall not be unreasonably withheld; provided, however, that Liquidmetal shall have the right, without the prior written consent of Eutectix, to assign its warranty rights and other rights hereunder with respect to specific Liquidmetal Products to the Customers of such Liquidmetal Products.']",Yes,"['To the extent any insurance coverage required under this Agreement is purchased on a ""claims-made"" basis, such insurance shall cover all prior acts of Eutectix during the term of this Agreement, and such insurance shall be continuously maintained until at least two (2) years beyond the expiration or termination of the term of this Agreement, or Eutectix shall purchase ""tail"" coverage, effective upon termination of any such policy or upon termination or expiration of the term of this Agreement, to provide coverage for at least two (2) years from the occurrence of either such event.', 'Upon expiration or termination of this Agreement for any reason, Eutectix shall have the option to purchase some or all of the Licensed Equipment at fair market value, less any amounts owed to Eutectix by Liquidmetal, except the equipment listed under Section 2.1(b) above', ""Upon reasonable prior notice to Eutectix and at Liquidmetal's expense, no more than once per year, during the Term of this Agreement and for one (1) year following the expiration or termination of this Agreement, Liquidmetal or its designee shall have the right from time to time to confirm and validate: (a) that Eutectix has complied with the pricing provisions of this Agreement; (b) Eutectix's financial condition, successorship planning, and ability to continue operations; (c) that Eutectix's performance is consistent with the Agreement; (d) that Eutectix has complied with Article 10 (Compliance) of this Agreement."", 'Notwithstanding the foregoing, with regard to orders received and accepted by Eutectix before expiration or notice of termination, Eutectix may finish making any products in process, may conclude any orders in process, including finishing manufacturing of such products and shipping such products to the customer for up to 6 months after termination or expiration of this Agreement;', 'In the event this Agreement expires or is terminated for any reason other than a breach by Eutectix, Liquidmetal shall purchase from Eutectix existing raw material inventory at the purchase price (including delivery charges) paid by Eutectix to its suppliers in connection with the Orders accepted by Eutectix hereunder.']",Yes
