Filename,Document Name,Termination For Convenience,Termination For Convenience-Answer,Change Of Control,Change Of Control-Answer,Anti-Assignment,Anti-Assignment-Answer,Post-Termination Services,Post-Termination Services-Answer
"THERAVANCEBIOPHARMA,INC_05_08_2020-EX-10.2-SERVICE AGREEMENT.PDF",['SERVICE AGREEMENT'],"['The Company may, in its sole and absolute discretion, terminate the Executive\'s employment under this Agreement at any time and with immediate effect by notifying the Executive that the Company is exercising its right under this clause 17 and that it will make a payment in l ieu of  not ice (""PILON"") to the Executive.']",Yes,[],No,[],No,[],No
DOMINIADVISORTRUST_02_18_2005-EX-99.(H)(2)-SPONSORSHIP AGREEMENT.PDF,['SPONSORSHIP AGREEMENT'],"[""This Agreement may be terminated at any time, without the payment of any penalty, with respect to any series or the Trust, by the Board of Trustees of the Trust, or by the Sponsor, in each case on not less than 60 days' written notice to the other party.""]",Yes,[],No,[],No,[],No
"CANOPETROLEUM,INC_12_13_2007-EX-10.1-Sponsorship Agreement.PDF",['Sponsorship Agreement'],[],No,[],No,['This Agreement may not be assigned by either party without the prior written consent of the other party.'],Yes,[],No
"HALITRON,INC_03_01_2005-EX-10.15-SPONSORSHIP AND DEVELOPMENT AGREEMENT.PDF",['SPONSORSHIP AND DEVELOPMENT AGREEMENT'],[],No,"[""Except with Smith's prior written approval, this Agreement may not be assigned by TDA: (i) in connection with a merger, a sale of all or substantially all of the assets of TDA or other similar corporate reorganization, or the sale of substantially all of TDA's rights to all of its Golf Instruction Related Products; or (ii) to<omitted>an affiliated, parent, subsidiary, related company (or in the case of the production of Advertising Materials to an advertising agency representing TDA) so as to effectuate the intent of this Agreement and the subject matter hereof, although TDA will continue to be liable for all financial obligations hereunder.""]",Yes,"[""Except with Smith's prior written approval, this Agreement may not be assigned by TDA: (i) in connection with a merger, a sale of all or substantially all of the assets of TDA or other similar corporate reorganization, or the sale of substantially all of TDA's rights to all of its Golf Instruction Related Products; or (ii) to<omitted>an affiliated, parent, subsidiary, related company (or in the case of the production of Advertising Materials to an advertising agency representing TDA) so as to effectuate the intent of this Agreement and the subject matter hereof, although TDA will continue to be liable for all financial obligations hereunder.""]",Yes,"['All books of account and records of Licensee covering all transactions relating to the Licensee shall be retained by the Licensee until at least two (2) years after the expiration or termination of the Term for possible inspection by Smith.', ""Upon expiration of this Agreement, TDA shall cease all uses of the Rights and/or Smith's Likeness with respect to advertising, endorsing and/or promoting TDA, but TDA shall be free to continue to distribute and sell its Golf Instruction Related Products which incorporate Smith's Likeness for up to 180 days after the expiration of the Term (although TDA may not use the Rights or Smith's Likeness to promote or advertise TDA or any of TDA's non-Golf Instruction Related Products when selling the Golf Instruction Related Products, nor can TDA highlight Smith's Likeness in its packaging or sales efforts); provided, however, that TDA shall have no such right of post-Term sales unless TDA is not in default of any of its obligations hereunder as of the date of expiration or termination.""]",Yes
GAINSCOINC_01_21_2010-EX-10.41-SPONSORSHIP AGREEMENT.PDF,['SPONSORSHIP AGREEMENT'],"['Notwithstanding the provisions of Section 1 hereof, the Sponsor shall have the right at any time prior to  December 31, 2010 to terminate this Agreement by giving written notice of such termination to Racing.']",Yes,[],No,['Neither party shall assign any of its rights or obligations hereunder without the prior written consent of the other party.'],Yes,[],No
"IPAYMENT,INC_05_14_2007-EX-10.1-SPONSORSHIP AGREEMENT.PDF",['SPONSORSHIP AGREEMENT'],"['ISO may terminate this Agreement prior to its expiration for cause upon prior written notice to SERVICERS as follows:<omitted>(j)   At any time upon one hundred eighty (180) days prior written notice to the SERVICERS with no penalty.', 'SERVICERS may terminate this Agreement prior to its expiration for cause upon prior written notice to ISO as follows:<omitted>(k)   Upon the termination of the Service Agreement for any reason with one hundred eighty (180) days prior written notice to ISO;']",Yes,"['In addition, ISO shall provide written notice to SERVICERS within three (3) Business Days of any Change of Control of ISO.', 'SERVICERS may terminate this Agreement prior to its expiration for cause upon prior written notice to ISO as follows:<omitted>(l)   Upon a Change of Control of ISO with one hundred eighty (180) days prior written notice to ISO, unless the SERVICERS had previously consented to such change in control.']",Yes,"[""SERVICERS may terminate this Agreement prior to its expiration for cause upon prior written notice to ISO as follows:<omitted>(g)   Upon an assignment of this Agreement by ISO without SERVICERS' prior written consent;"", ""Except as expressly set forth herein, ISO shall not subcontract, assign, license or in any other manner extend or transfer to any third party any right or obligation ISO has with respect to SERVICERS' Program."", 'Except as expressly set forth herein, ISO shall not assign or otherwise transfer this Agreement or any of its rights or obligations hereunder, by operation of law or otherwise, or contract with any third party (other than the third parties named herein) to perform any of its responsibilities or obligations relating to this Agreement without the prior written consent of SERVICERS, which consent will not be unreasonably withheld.', ""ISO may terminate this Agreement prior to its expiration for cause upon prior written notice to SERVICERS as follows:<omitted>(f)   Upon an assignment of this Agreement by SERVICERS without ISO's prior written consent;""]",Yes,[],No
LOOKSMARTLTD_07_20_2012-EX-99.(D)(I)-SPONSORSHIP AGREEMENT.PDF,['SPONSORSHIP AGREEMENT'],[],No,[],No,"['This Agreement may not be assigned by any party or by operation of law or otherwise without the prior written consent  of each of the other parties.', 'Any attempted assignment in violation of this Section shall be null and void.']",Yes,[],No
STAMPSCOMINC_06_24_1999-EX-10.18-SPONSORSHIP AGREEMENT.PDF,['Sponsorship Agreement'],[],No,[],No,"[""Neither party may assign this Agreement, in whole or in part,      ----------      without the other party's written consent (which will not be unreasonably\n\n\n\n\n\n     withheld or delayed); provided however, that either party may assign its      rights and obligations hereunder in the event of a sale of all, or      substantially all of such party's assets related to this Agreement, whether      by merger, reorganization, operation of law or otherwise, or (2) either      party's assignment and/or delegation of its rights and responsibilities      hereunder to a wholly-owned subsidiary or joint venture in which the      assigning party holds an interest."", 'Any attempt to assign this Agreement      other than as permitted above will be null and void.']",Yes,['The audit      rights set forth herein shall continue for one (1) year following the      termination of this Agreement for any reason.'],Yes
VIOLINMEMORYINC_12_12_2012-EX-10.14-SPONSORSHIP AGREEMENT.PDF,['SPONSORSHIP AGREEMENT'],[],No,[],No,"[""The rights and obligations of Forty Niners SC under this Agreement may be assigned by Forty Niners SC without the consent of Sponsor so long as the assignment shall be the assignment of Team's rights and obligations hereunder (i) as collateral security for financing arrangements, (ii) to any Affiliate or successor entity, or (iii) to any purchaser of Team's interest in its NFL franchise."", ""This Agreement and the rights granted hereunder may not be assigned, sold, transferred, pledged or exchanged by Sponsor by operation of law or otherwise without the prior written consent of Forty Niners SC, which consent shall be in Forty Niners SC's sole discretion; provided, however, that Forty Niners SC shall consent to an assignment to any entity that acquires Sponsor (or a substantial portion of Sponsor's assets) via merger, acquisition or other similar transaction so long as (i) such entity's sponsorship would not cause Forty Niners SC to breach any existing agreement, (ii) Sponsor is not in default under this Agreements, and (iii) such sponsorship shall not otherwise cause a breach under this Agreement."", 'Sponsor shall have no right to assign any right granted hereunder to use Team Marks, or any other Sponsorship Rights granted hereunder, to any third party, except as otherwise explicitly set forth herein.']",Yes,[],No
XYBERNAUTCORP_07_12_2002-EX-4-SPONSORSHIP AGREEMENT.PDF,['SPONSORSHIP AGREEMENT'],[],No,[],No,"['Any such  assignment or delegation  made without the written consent of the  other  party  hereto  shall  be ab  inito  null and void and of no force or effect.', 'Neither this Agreement nor any of the rights,  duties and obligations  of the parties  hereunder may be assigned or delegated by XC or the AJR, as the case may be,  without the prior  written  consent of the other party hereto.']",Yes,[],No
"CURAEGISTECHNOLOGIES,INC_05_26_2010-EX-1-CORPORATE SPONSORSHIP AGREEMENT.PDF",['CORPORATE SPONSORSHIP AGREEMENT'],[],No,[],No,"[""Any attempt to assign without the other party's consent will be null and void and will afford the non-assigning  party the right to immediately cancel and terminate this Agreement."", 'Neither party may assign its rights or powers under this Agreement without the express written consent of the other, which consent shall<omitted>not be unreasonably withheld.']",Yes,[],No
DRKOOPCOMINC_04_21_1999-EX-10.28-SPONSORSHIP AGREEMENT.PDF,['SPONSORSHIP AGREEMENT'],[],No,[],No,"[""Neither party may assign this Agreement, in whole or in part, without the other party's written consent, which consent will not be unreasonably withheld, except that: (a) a party's rights and obligation hereunder may be transferred to a successor of all or substantially all of the\n\n\n\n\n\nbusiness and assets of the party regardless of how the transaction or series of related transactions is structured, provided, that the successor party agrees to be bound by all of the terms and conditions of this Agreement; and (b) Sponsor may assign its rights and obligations under this Agreement to any entity (i) which operates the Sponsor Website and (ii) which agrees to bound by all of the terms and conditions of this Agreement.""]",Yes,[],No
GSVINC_05_15_1998-EX-10-SPONSORSHIP AGREEMENT.PDF,['SPONSORSHIP AGREEMENT'],[],No,[],No,"[""Neither party may assign this Agreement, in whole or in             part, without the other party's written consent (which will not be             unreasonably withheld), except that no such consent will be required             in connection with (i) a merger, reorganization or sale of all, or             substantially all, of such party's assets or (ii) either party's             assignment and/or delegation of its rights and responsibilities             hereunder to a wholly-owned subsidiary or joint venture in which the             assigning party holds an interest."", 'Any attempt to assign this             Agreement other than as permitted above will be null and void.']",Yes,[],No
IVILLAGEINC_03_17_1999-EX-10.16-SPONSORSHIP AGREEMENT.PDF,['Sponsorship Agreement'],[],No,[],No,"['Neither Party shall sell, transfer or assign this Agreement or the rights or obligations hereunder, without the prior written consent of the other Party, such consent not to be unreasonably withheld or delayed.']",Yes,[],No
LOGANSROADHOUSEINC_03_27_1998-EX-10.17-SPONSORSHIP AGREEMENT.PDF,['SPONSORSHIP AGREEMENT'],[],No,[],No,"[""This Agreement may not be modified or assigned except in writing signed by SRP and Logan's.""]",Yes,[],No
MERCATAINC_03_09_2000-EX-10.21-SPONSORSHIP AGREEMENT.PDF,['SPONSORSHIP AGREEMENT'],[],No,[],No,"[""Neither this Agreement nor any of the rights or     -------------------     obligations of either FNW or Sponsor hereunder may be assigned, transferred     or conveyed by operation of law or otherwise by either party, nor shall such     agreements or rights inure to the benefit of any trustee in bankruptcy,     receiver, creditor, or trustee of either party's business or its properties     whether by operation of law or otherwise, except with the prior written\n\n\n\n\n\n    consent of the other party, which consent shall not be unreasonably     withheld, and the delivery of a written document in which the assignee     assumes all of the obligations of the assigning party and the assigning     party acknowledges that it will continue to be bound to such obligations if     not performed by the assignee."", 'Notwithstanding the     foregoing, no assignment or attempted assignment by Sponsor shall be valid     except to a party which intends to continue the business of Sponsor as     presently conducted.']",Yes,[],No
HYDRONTECHNOLOGIESINC_03_31_1997-EX-10.47-SPONSORSHIP AGREEMENT.PDF,['SPONSORSHIP AGREEMENT'],[],No,[],No,"[""No party may assign any of its rights or obligations\n\nhereunder without the prior written consent of the other party, except that Hydron may assign its rights and obligations under this Agreement to its parent, its successor or to an affiliate (as such term is defined under the rules and regulations promulgated under the federal securities laws of the U.S.) upon the reasonable consent of the Dolphins that such affiliate assignee has the financial means and corporate authority to perform such obligations and Hydron may not withhold its consent to an assignment of this Agreement in the event of a merger or reorganization of the Dolphins, a sale of all or substantially all of the Dolphins' assets or a consolidation of the Dolphins with any of its affiliates or related parties.""]",Yes,[],No
N2KINC_10_16_1997-EX-10.16-SPONSORSHIP AGREEMENT.PDF,['SPONSORSHIP AGREEMENT'],[],No,[],No,"[""Neither party may assign this Agreement, in whole                   or in part, without the other party's written consent (which                   will not be unreasonably withheld), except that no such                   consent will be required in connection with (i) a merger,                   reorganization or sale of all, or substantially all, of such                   party's assets or (ii) either party's assignment and/or                   delegation of its rights and responsibilities hereunder to a                   wholly-owned subsidiary or joint venture in which such party                   holds a controlling interest."", 'Any attempt to assign this                   Agreement other than as permitted above will be null and void.']",Yes,[],No
"XLITECHNOLOGIES,INC_12_11_2015-EX-10.1-Sponsorship Agreement.PDF",['Sponsorship Agreement'],[],No,[],No,[],No,[],No
VITAMINSHOPPECOMINC_09_13_1999-EX-10.26-SPONSORSHIP AGREEMENT.PDF,['SPONSORSHIP AGREEMENT'],[],No,[],No,"[""Neither party may assign this Agreement,                           in whole or in part, without the other party's                           written consent (which will not be unreasonably                           withheld or delayed), except that no such consent                           will be required in connection with (i) a merger,                           reorganization or sale of all, or substantially all,                           of such party's assets or its<omitted>Internet business assets (ii) either party's                           assignment and/or delegation of its rights and\n\n\n\n\n\n                       responsibilities hereunder to a wholly-owned                           subsidiary or affiliate or joint venture in which the                           assigning party holds an interest."", 'Any attempt to                           assign this Agreement other than as permitted above                           will be null and void.']",Yes,[],No
ASPIRITYHOLDINGSLLC_05_07_2012-EX-10.6-OUTSOURCING AGREEMENT.PDF,['OUTSOURCING AGREEMENT'],"['The Company or the Contractor may terminate this Agreement at any time in whole or in part as more  specifically provided below, and in such case, the Contractor will be paid fees incurred up to the date of such termination plus its expenses  accrued as of such date within 30 days of such termination.', ""The Contractor will have the ability to terminate this Agreement by giving 90 days' prior written notice to the  Company."", ""The Company will have the ability to terminate this Agreement by giving 60 days' prior  written notice to the Contractor.""]",Yes,[],No,"['Neither party may assign its rights and obligations under this Agreement without the written consent of  the other party.', 'The Contractor shall not assign this Agreement or any of its rights, powers, duties or obligations hereunder without the  express prior written consent of the Company, which shall not be unreasonably withheld.', 'In the event that the Company engages a third party to perform any of the obligations of the  Contractor under this Agreement, the Company      19\n\n\n\n\n\n     shall provide written notice to the Contractor of such engagement, the Contractor shall thereafter be relieved of any such obligations for which the  third party was engaged.']",Yes,"['In addition to  delivering such data and monies, the Contractor shall use its best efforts to effect the orderly and efficient transfer of the administration  of the Notes to the Company or other party designated by the Company to assume responsibility for such administration, including,  without limitation, directing Holders to remit all repurchase or other notices to the address designated by the Company.', 'If this Agreement is terminated, or otherwise at the instruction of the Company, the Contractor shall promptly  deliver to the Company or its designee, as the case may be, all Note files and records (including, without limitation, copies of  computerized records and servicing and other software, except as may be prohibited by any third party contract or license) related to  the administration of the Notes and all monies collected by it relating to the Renewable Note Program (less any fees or expenses due to  the Contractor).']",Yes
BNLFINANCIALCORP_03_30_2007-EX-10.8-OUTSOURCING AGREEMENT.PDF,['Outsourcing Agreement'],[],No,[],No,"['Neither party to this Agreement shall assign, subcontract, or otherwise conveyor delegate its rights or duties hereunder to any third party without the prior written consent of the other party hereto, such consent not to be unreasonably withheld.']",Yes,"[""From and after notice of termination is received by VIP, any new reports or other services provided by VIP other than routine processing services which have been done for BNL under this Agreement shall be deemed to be additional services and shall be performed by VIP at VIP's then current rates for such termination services as specified on Schedule A."", 'Upon termination or expiration of this Agreement, BNL shall return all software and related manuals, if any, provided by VIP to BNL during the term of this Agreement.']",Yes
CCAINDUSTRIESINC_04_14_2014-EX-10.1-OUTSOURCING AGREEMENT.PDF,['Services Outsourcing Agreement'],"[""Either party hereto may terminate this Agreement after the Initial Period upon at least six (6) months' prior written notice to the other party thereof."", ""The Company may terminate this Agreement in accordance with the immediately preceding sentence but with less than six (6) months' prior written notice to Contractor; provided, that in such event, the Company shall pay Contractor an amount equal to the Termination Fee.""]",Yes,[],No,"[""This Agreement may not be assigned by either party without the prior written consent of the other party, except that, without such consent, (i) Company may make an assignment of this Agreement as collateral security in favor of its lenders, and (ii) the Company may assign this Agreement to a purchaser of all or substantially all of the assets of the Company's business related to the Products.""]",Yes,"['Such insurance requirements shall be maintained during the Term and shall continue for a minimum of three years following termination of this Agreement.', 'During the Term of this agreement, and for a period of twenty four (24)months after Termination (the ""Withholding Period""), Contractor may retain monies (collections in Accounts Receivable) against any reasonable anticipated deductions for product recalls, unsalables, rebates, allowances or any audits or other adjustments it deems necessary.', ""After the Withholding Period, Company will remain liable to Contractor for any additional audits, deductions, rebates, credits, allowances or other adjustments taken by the Customers against the Company's Products.""]",Yes
ELANDIAINTERNATIONALINC_04_25_2007-EX-10.21-Outsourcing Agreement.PDF,['Network Management Outsourcing Agreement'],"['Datec may terminate the whole or any part of this agreement for convenience at any time by giving the BSP at least 6 months prior written notice.', 'The BSP may terminate the whole or any part of this agreement for convenience at any time by giving Datec at least 6 months prior written notice.']",Yes,"['The BSP may after giving due consideration to all circumstances and not acting unreasonably, terminate this agreement by giving written notice to Datec if there is a change of control or major shareholding of Datec.', 'If the BSP gives such a notice of termination, then:\n\n  (a) if the change of control:\n\n  (i) results in a competitor of the BSP controlling Datec or\n\n  (ii) is reasonably likely in the BSP\'s opinion, to have a detrimental effect on Datec\'s ability to provide the Services in accordance with the agreement,\n\nthen the BSP will pay Datec according to Section 14 - ""Termination"" of this agreement and the Termination Table in Schedule C.']",Yes,"[""Datec must not assign this agreement or any right under this agreement unless Datec\n\n  (a) is not in breach of this agreement;\n\n  (b) obtains the prior written consent of the BSP\n\n  (c) ensures that the assignee agrees to be bound by all of the Datec's obligations under this agreement; and\n\n  (d) acknowledges that it remains bound by this agreement"", ""BSP may:\n\n  (a) assign all or part of this agreement to any person as part of a restructure; and\n\n  (b) assign or novate all or part of the rights and obligations under this agreement to any of the BSP's Related Company's as part of a re- organisation of its business.""]",Yes,[],No
NICELTD_06_26_2003-EX-4.5-OUTSOURCING AGREEMENT.PDF,['MANUFACTURING OUTSOURCING AGREEMENT'],"['Notwithstanding the aforesaid in Section 16.1. and any possible           implication to the contrary herein or as a result of the course of           conduct of the parties, Contractor shall be entitled, at its sole           discretion, to terminate this Agreement only during the Extended Term,           with or without cause, upon a prior written notice of termination to           NICE of not less than six (6) months.', 'Notwithstanding the aforesaid in Section 16.1. and any possible           implication to the contrary herein or as a result of the course of           conduct of the parties, NICEshall be entitled, at its sole discretion,           to terminate this Agreement, in whole or in part, at any time during           the Initial Term or the Extended Term, with or without cause, upon a           prior written notice of termination to Contractor of not less than           forty-five (45) Days.']",Yes,[],No,"['Neither party shall in any way sell, transfer, assign,           sub-contract or otherwise dispose of any of the rights, privileges,           duties and obligations granted or imposed upon it under this           Agreement. However, NICE may, at its discretion, transfer and/or           assign any of its rights, privileges, duties and obligations granted           or imposed upon it under this Agreement to any NICE Affiliate,           provided that NICE remains responsible towards Contractor, jointly and           severally with the Affiliate, for all of its obligations hereunder so           assigned, and provided further that the assignee signs this Agreement.']",Yes,[],No
SYKESHEALTHPLANSERVICESINC_04_24_1998-EX-10.14-OUTSOURCING AGREEMENT.PDF,['OUTSOURCING AGREEMENT'],[],No,[],No,"['This Agreement shall be binding on the parties and their respective successors and assigns, but neither party may, or shall have the power to, assign this Agreement without the prior written consent of the other, which consent shall not be unreasonably withheld.']",Yes,[],No
