Filename,Document Name,Termination For Convenience,Termination For Convenience-Answer,Change Of Control,Change Of Control-Answer,Anti-Assignment,Anti-Assignment-Answer,Post-Termination Services,Post-Termination Services-Answer
ZEBRATECHNOLOGIESCORP_04_16_2014-EX-10.1-INTELLECTUAL PROPERTY AGREEMENT.PDF,['INTELLECTUAL PROPERTY AGREEMENT'],[],No,"['If as a result of the Change of Control Event such party is merged into the Buyer (other than if the Buyer is formed or created for the purpose of the Change of Control Event) or another Person (other than if such Person is formed or created for the purpose of the Change of Control Event or if such Person is a then-<omitted>current Affiliate of such party) or otherwise does not remain a separate, independent legal entity (except if such party is merged into another Person, where such Person was formed or created for the purpose of the Change of Control Event or where such Person is a then-current Affiliate of such party), then (i) the license rights granted to such party under Article II shall be limited to the operation of the business and the products, systems, and services (including Smart Sensing Network Equipment and Public Safety LTE Smartphone Devices, as applicable) of such party existing as of the effective date of the Change of Control Event and Derivative Works and natural evolutions thereof (but, in all cases, with respect to such license rights, subject to Section 2.1(e) or Section 2.2(e), as applicable), and (ii) no rights or licenses granted to such party under Article II may be extended to the Buyer or any of its Affiliates existing immediately prior to the Change of Control Event in connection with any of its or their past, current, or future products, systems or services.', 'If as a result of the Change of Control Event such party remains a separate, independent legal entity (or is merged into another Person, where such Person was formed or created for the purpose of the Change of Control Event or where such Person is a then-current Affiliate of such party), then the license rights granted to such party under Article II shall continue in full force and effect.', 'Upon a merger or change of control of a party (including, for purposes of this Section 6.3, with respect to Purchaser any Purchaser Licensee and with respect to Seller any Seller Party) (a ""Change of Control Event"") with or to a Person (other than a Person that is a then-current Affiliate of such party) (the ""Buyer""), the license rights granted under Article II to such party shall not extend to the Buyer or any of its Affiliates existing immediately prior to the Change of Control Event or any of its or their past, current, or future products, systems or services.']",Yes,"['If a Seller Party assigns or transfers any Licensed IP, the Seller shall (or shall cause the applicable Seller Party to) expressly condition such assignment or transfer on the express acknowledgement and agreement of the assignee or transferee that all such Licensed IP is bound by the license grants set forth herein.', 'If Purchaser or a Purchaser Assignee assigns or transfers any Intellectual Property licensed to the Seller Parties pursuant to Section 2.1(c) or Section 2.1(d), the Purchaser shall (or shall cause the applicable Purchaser Assignee to) expressly condition such assignment or transfer on the express acknowledgement and agreement of the assignee or transferee that all such Intellectual Property is bound by such license grants.', 'Neither party may assign (whether by operation of law or otherwise) this IP Agreement, or any of its licenses, rights, privileges or obligations hereunder, without the prior written consent of the other party, and any such attempted assignment shall be void; provided, however, that, following the Initial Closing Date, without any such prior written consent but upon prior written notice to the other party, each party may assign this IP Agreement to: (i) an Affiliate; (ii) a lender for collateral security; (iii) a Person that succeeds to all or substantially all of its business or assets to which this IP Agreement relates in connection with a merger or sale of all or substantially all of its assets to which this IP Agreement relates; or (iv) corporate reorganization of the party in which the ultimate ownership of the party immediately prior to such reorganization is the same as the ultimate ownership of the party immediately after such reorganization.']",Yes,[],No
AIRSPANNETWORKSINC_04_11_2000-EX-10.5-Distributor Agreement.PDF,['Distributor Agreement'],[],No,[],No,"[""Neither party may assign this Agreement or subcontract its obligations under this Agreement to another party without the other party's prior, written consent executed by a duly authorized officer.""]",Yes,"['Airspan will recognize payments due to Distributor for orders received up to ninety (90) days after the termination or expiration of this Agreement.', 'For at least two (2) years after termination of this Agreement,      Distributor will maintain its records, contracts, and accounts relating to      distribution of Airspan Products, and will permit examination thereof by      authorized representatives of Airspan at all reasonable times.']",Yes
ACCURAYINC_09_01_2010-EX-10.31-DISTRIBUTOR AGREEMENT.PDF,['Multiple LINAC and Multi-Modality Distributor Agreement'],[],No,[],No,"['Neither this Agreement, nor any of the rights, interests, or obligations under this Agreement may be assigned or  delegated, in whole or in part, by operation of law or otherwise, by any party without the prior written consent of the other party,  and any such assignment without such prior written consent shall be null and void; provided, however, that this Agreement may be  assigned by a Party in connection with a Change in Control of such party, subject to the specific termination and other rights set  forth in the Strategic<omitted>Alliance Agreement upon such Change in Control; provided, further, that Siemens may assign its rights and obligations under this  Agreement to any Distributor that agrees, in writing, to be bound by and comply with the terms and conditions of this Agreement  and the provisions of the Strategic Alliance Agreement, provided, that no such assignment shall relieve Siemens of its obligations  hereunder or thereunder if such Distributor does not perform such obligations.']",Yes,"['Furthermore, each of the parties agree to cooperate fully with the other for  any reasonable transition assistance required in the case of termination or expiration of this Agreement.', 'Upon a termination of this Agreement, Accuray shall continue to make available to Customers support services on  commercially reasonable terms, including, without limitation, spare parts for the Systems for a minimum period of 10 years after the  last shipment of a System pursuant to this Agreement.', ""Accuray and Distributor agree to negotiate in good faith an orderly transition of Distributor's  distribution responsibilities and activities to Accuray or a third party designated by Accuray and Distributor agrees to  assist in the transition.""]",Yes
BLACKBOXSTOCKSINC_08_05_2014-EX-10.1-DISTRIBUTOR AGREEMENT.PDF,['DISTRIBUTOR AGREEMENT'],[],No,['This Agreement may be terminated only:<omitted>By the Company if: there is an unacceptable change in the control or management of the Distributor;'],Yes,"['Distributor shall not assign the rights granted in this Section 1.01 without the prior written consent of the Company.', 'Distributor shall not assign this Agreement or any rights or obligations hereunder without the prior written consent of the Company.']",Yes,[],No
ENTERTAINMENTGAMINGASIAINC_02_15_2005-EX-10.5-DISTRIBUTOR AGREEMENT.PDF,['DISTRIBUTOR AGREEMENT'],"['This Agreement may be terminated subject to the following clauses:\n\n  1.1.1. By either Vendor or Distributor, upon written notice of termination of this Agreement no later than ninety (90) calendar days prior to the expiration of the relevant Term, then in effect;']",Yes,"['This Agreement may be terminated subject to the following clauses:<omitted>Subject to Section 1.6, by Vendor (or successor to Vendor), upon written notice to Distributor of a change of control of Vendor and the election by Vendor (or successor to Vendor) to terminate this Agreement, where a ""change of control"" shall mean a change in ownership of the Vendor such that an unaffiliated third party acquires a majority of the voting power of Vendor;']",Yes,"['Distributor shall not sell or otherwise transfer any of the rights granted pursuant to this Agreement to any third party without the prior written consent of Vendor; provided, however, Distributor may enter into distribution arrangements with regional distributors within the Territory in its efforts to promote, advertise and distribute the Products in accordance with this Agreement;', 'No assignment by either Party of any rights, including rights to money due or to become due under this Agreement, or delegation of any duties under this Agreement or under any purchase orders subject to this Agreement, shall be binding on the nonassigning Party unless and until a written consent has been obtained from the nonassigning Party.']",Yes,"['The Monthly Compensation shall be paid for the remaining monthly periods remaining in the Term, as if the termination of this Agreement had not occurred, or twenty four (24) calendar months, which ever period is less, where payment shall be made no later than thirty (30) calendar days after the end of the relevant monthly period.', ""Distributor agrees not to use in any manner whatsoever the marks, logos, images and copy of Vendor following the expiration or termination of this Agreement, except as may be needed to sell any Products remaining in Distributor's inventory."", 'In the event that this Agreement is terminated pursuant to either Section 1.1.4 or 1.1.5 of this Agreement, this shall not of itself be deemed a breach hereof but Distributor shall have the right to receive monthly compensation from Vendor, or successor to the Vendor, representing the amount of profit to Distributor lost as a result of the termination (the ""Monthly Compensation"").']",Yes
"ETELOS,INC_03_09_2004-EX-10.8-DISTRIBUTOR AGREEMENT.PDF",['DISTRIBUTOR AGREEMENT'],['Tripath or Distributor may terminate this Agreement for any reason with thirty days written notice.'],Yes,[],No,"['This Agreement is not assignable by Distributor without prior written consent of Tripath, which will not be unreasonably withheld.']",Yes,"[""Upon termination of this Agreement, Distributor will immediately cease all further use of Tripath's trademarks, trade names or service marks except as may be required in the sale of Products in inventory."", ""If Distributor terminates pursuant to Subsection 18.1 or 18.2, or if Tripath terminates pursuant to Subsection 18.3, Tripath may, at its option, purchase and Distributor will resell to Tripath all or part of Distributor's inventory at the price set forth in Subsection 18.4, less a ten percent restocking charge."", ""If Tripath terminates pursuant to Subsection 18.1 or 18.2, or if Distributor terminates pursuant to Subsection 18.3, Tripath will purchase and Distributor will resell to Tripath Distributor's inventory of Products (excluding\n\n-6-\n\n\n\n\n\n\n\nDistributor Agreement\n\ndiscontinued and demonstration Products) which Tripath determines to be undamaged and in good condition (including, at Tripath's option on-site inspection). The price for such inventory will be the price actually paid by the Distributor, less any prior credit or allowances.""]",Yes
EUROPEANMICROHOLDINGSINC_03_06_1998-EX-10.6-DISTRIBUTOR AGREEMENT.PDF,['DISTRIBUTOR AGREEMENT'],"[""Upon the occurrence of any of the following, WGT may      terminate the Term by giving Distributor written notice of such termination      for:<omitted>WGT giving Distributor ninety (90) days' advance written notice of      termination at any time after the expiration of the Initial Term."", ""Upon the occurrence of any of the following,      Distributor may terminate the Term by giving WGT written notice of such      termination;<omitted>for convenience whether or not extended beyond the Initial Term, provided      Distributor gives WGT thirty (30) days' advance written notice and, within      such thirty (30) day period, Distributor pays to WGT a lump-sum payment      equal to fifty (50%) of the unpaid balance of cumulative Guaranteed Minimum      Purchase amounts.""]",Yes,"['Upon the occurrence of any of the following, WGT may      terminate the Term by giving Distributor written notice of such termination      for:<omitted>(b)  any material change in the general management, ownership or control of      Distributor, including without limitation the sale, transfer or      relinquishment by Distributor of any substantial interest in the ownership      of the business to be carried on by Distributor under this Agreement,      unless such change is approved in advance and in writing by an officer of      WGT;']",Yes,"['Distributor will not assign all or any part of this Agreement      or any of its rights under this Agreement without the prior written consent      of WGT.', 'Upon the occurrence of any of the following, WGT may      terminate the Term by giving Distributor written notice of such termination      for:', 'any assignment or attempted assignment of this Agreement by Distributor      without the prior written consent of WGT;']",Yes,"['In the event of termination, Distributor will:<omitted>return to WGT within twenty (20) days following the expiration or      termination of the Term, any and all (i) demonstration Product provided to      Distributor; (ii) Products not already paid for in full by Distributor; and      (iii) promotional literature, data, information and other items received by      Distributor under this Agreement;']",Yes
HYPERIONSOFTWARECORP_09_28_1994-EX-10.47-EXCLUSIVE DISTRIBUTOR AGREEMENT.PDF,['EXCLUSIVE DISTRIBUTOR AGREEMENT'],[],No,[],No,"['This Agreement is not assignable by either party hereto without the prior written consent of the other, except that this Agreement shall be assignable by Developer to an affiliated entity or upon the sale of the fight to license and sublicense the Products to the purchaser of said right.']",Yes,['Distributor may continue running the Products solely for purposes of providing maintenance to End-Users granted licenses pursuant to an End-User License Agreement prior to termination.'],Yes
"LEGACYTECHNOLOGYHOLDINGS,INC_12_09_2005-EX-10.2-DISTRIBUTOR AGREEMENT.PDF",['EXCLUSIVE DISTRIBUTOR AGREEMENT'],[],No,[],No,"['Any other assignment          by the parties, requires the prior written consent of the other Party.']",Yes,"['Upon  termination,  ENVISION shall have eighteen (18) months to exhaust          any  inventories,  packaging  and  advertising  materials  bearing  the          ""SierraSil""  trademark  and SIERRA  shall have first option to buy back          any inventory at ENVISION\'s net purchase pric']",Yes
LUCIDINC_04_15_2011-EX-10.9-DISTRIBUTOR AGREEMENT.PDF,['Distributor Agreement'],['Either party may terminate this agreement by providing Ninety days Written Notice.'],Yes,"['In addition, Lucid may terminate this agreement by giving the Distributor Written Notice if there is any change of control, ownership or  management of the Distributor.']",Yes,[],No,[],No
LIMEENERGYCO_09_09_1999-EX-10-DISTRIBUTOR AGREEMENT.PDF,['DISTRIBUTOR AGREEMENT'],[],No,[],No,"['In  the  event  either  party  (a)  becomes                   adjudicated insolvent,  (b) discontinues its business, (c) has                   voluntary of  involuntary  bankruptcy  proceedings  instituted                   against  it, or (d) makes an  assignment  for the  benefit  of                   creditors, the other party shall be entitled to terminate this                   Agreement effective immediately upon written notice.', 'No  assignment  of this  Agreement  or any  right                   accruing  hereunder  shall be made by the Distributor in whole                   or in part,  without the prior written consent of the Company,                   which  consent  shall  not  be  unreasonably  withheld.']",Yes,"['Following  expiration or                   termination of this Agreement, the Distributor may continue to                   sell any Products in the Market which are in its inventory<omitted>and which the Company has not repurchased.', 'Upon the expiration or termination of                   this  Agreement,  pursuant to Section  4.1 or 4.2 hereof,  the                   Company may, at its option to be  exercised  within 30 days of                   the date of the termination of this Agreement, and in its sole                   discretion,  repurchase  any Products in the possession of the                   Distributor  at the net invoice price paid by the  Distributor                   to  the  Company  less  any  applicable  special   allowances,                   discounts, shipping or allowances for cooperative advertising.', ""If Company  terminates  the  Agreement  without  cause and for                   reasons other than  Distributor's  failure to meet its minimum                   expectations;   it  shall   repurchase  from  Distributor  any                   unopened  Product,  and shall bear all shipping,  handling and                   related  costs  notwithstanding  any other  remedies  to which                   Distributor  may be  entitled.""]",Yes
NEOMEDIATECHNOLOGIESINC_12_15_2005-EX-16.1-DISTRIBUTOR AGREEMENT.PDF,['DISTRIBUTOR AGREEMENT'],[],No,[],No,"['PPG SHANGHAI shall have the right to terminate this Agreement and/or          suspend its performance hereunder immediately upon giving notice to          DISTRIBUTOR, which termination shall be effective upon receipt of          notice, if any one of the following occurs:<omitted>(iii) DISTRIBUTOR becomes insolvent, assigns or attempts to assign its          business assets for the benefit of creditors, institutes or has          instituted against it proceedings in bankruptcy, or dissolves or          liquidates the business of DISTRIBUTOR<omitted>.']",Yes,[],No
NANOPHASETECHNOLOGIESCORP_11_01_2005-EX-99.1-DISTRIBUTOR AGREEMENT.PDF,['DISTRIBUTOR AGREEMENT'],['The initial term of this Agreement shall be for a period of five (5) years from the date first set forth above and shall thereafter automatically renew for additional two (2) year terms unless a party provides the other party with notice of non-renewal no less than 6 months prior to the expiration of the initial term or any renewal term unless earlier terminated as follows:<omitted>13.1.3 By either party for any reason by providing six (6) months prior written notice expressly terminating this Agreement.'],Yes,[],No,['The rights and obligations of the parties under this Agreement shall not be assignable unless consent to the assignment is in writing and signed by the parties.'],Yes,"['Upon termination of this Agreement for any reason, ALFA AESAR may i) return its current inventory of Products for reimbursement by NTC or ii) keep its current inventory of Products and continue to sell such Products pursuant to the terms hereof until depletion of inventory.', ""Upon termination of this Agreement, ALFA AESAR may continue to advertise and promote the Products, using the NTC's Trademarks and NTC content until ALFA AESAR's inventory depletion.""]",Yes
"OPTIMIZEDTRANSPORTATIONMANAGEMENT,INC_07_26_2000-EX-6.6-DISTRIBUTOR AGREEMENT.PDF",['DISTRIBUTOR AGREEMENT'],"['except as  specifically  described  elsewhere  in this  agreement,      either ITS or COMWARE shall have the right to terminate this Agreement with      30 days written notice from the other party, for any reason whatsoever.']",Yes,[],No,[],No,[],No
"VISIUMTECHNOLOGIES,INC_10_20_2004-EX-10.20-DISTRIBUTOR AGREEMENT.PDF",['DISTRIBUTOR AGREEMENT'],[],No,[],No,['This Agreement may not be assigned by either party without the prior written consent of the other party.'],Yes,"['Upon expiration of this Agreement or termination by either party, Power2Ship may sell off any remaining inventory of the Products or Licensed Software acquired prior to termination.']",Yes
ENERGYXXILTD_05_08_2015-EX-10.13-Transportation AGREEMENT.PDF,['Transportation Agreement'],"[""Subject to the other provisions of this Agreement, the term of this Agreement shall commence on the Effective Date and shall remain in effect until terminated by either Party upon thirty (30) days' prior written notice.""]",Yes,[],No,"[""Shipper shall have the right to assign, or transfer all, but not less than all, of its rights and obligations under this Agreement with the prior written consent of Transporter, which consent may be withheld in Transporter's sole discretion."", 'No assignment or transfer of this Agreement shall be effective as to Transporter unless and until Transporter has been provided written notice thereof.']",Yes,[],No
ENTERPRISEPRODUCTSPARTNERSLP_07_08_1998-EX-10.3-TRANSPORTATION CONTRACT.PDF,['TRANSPORTATION CONTRACT'],"['This contract shall be for a term of one year commencing on the date first above written; thereafter, it shall automatically continue until terminated by either party upon not less than thirty (30) days prior written notice to the other party.']",Yes,[],No,"['This contract shall not be assigned in whole or in part by either party without the prior written consent of the other, except that a party may assign this contract to a successor entity as a result of a merger or consolidation or to another entity which acquires substantially all of the assets of that party.']",Yes,[],No
MARTINMIDSTREAMPARTNERSLP_01_23_2004-EX-10.3-TRANSPORTATION SERVICES AGREEMENT.PDF,['MARINE TRANSPORTATION AGREEMENT'],[],No,[],No,"['Charterer shall not be permitted to sublet the use of any vessels to any third party.', 'Neither party shall assign this Agreement without the express written consent of the other party.']",Yes,[],No
ADAMSGOLFINC_03_21_2005-EX-10.17-ENDORSEMENT AGREEMENT.PDF,['ENDORSEMENT AGREEMENT'],[],No,[],No,"['Neither ADAMS GOLF nor CONSULTANT shall have the right to grant sublicenses hereunder or to assign, alienate or otherwise transfer any of its rights or obligations hereunder.']",Yes,[],No
AMBASSADOREYEWEARGROUPINC_11_17_1997-EX-10.28-ENDORSEMENT AGREEMENT.PDF,['Endorsement Agreement'],[],No,[],No,"['This Agreement and all rights and duties hereunder are personal to Diplomat and shall not, without the written consent of KI, Inc., be assigned, mortgaged, sublicensed or otherwise encumbered by Diplomat or by operation of law.', 'KI, Inc. may assign its rights hereunder, but shall furnish written notice of such assignment to Diplomat.']",Yes,"['Upon and after the termination of the license, and except as otherwise provided in this Agreement, Diplomat may dispose of products covered by this Agreement which are on hand, or in process at the time notice of termination is received, for a period of one hundred and twenty (120) days after notice of termination, provided advances and royalties with respect to that period are paid and statements are furnished for that period in accordance with paragraph 3.', 'Upon the termination of this license,       notwithstanding anything to the contrary herein, all royalties on sales       theretofore made shall become immediately due and payable and no minimum       royalties shall be repayable.']",Yes
HOLIDAYRVSUPERSTORESINC_04_15_2002-EX-10.13-ENDORSEMENT AGREEMENT.PDF,['ENDORSEMENT AGREEMENT'],"['In the event that the Company desires to terminate the Agreement prior to the Termination Date, it shall provide AGI with at least 60 days prior written notice of its intention to terminate this Agreement and this Agreement shall so terminate following the expiration of this 60-day period, without any further responsibility by either Party except as provided in Section 5.']",Yes,[],No,['Neither this Agreement nor the rights of either Party hereunder shall be assigned by either Party without the prior written consent of the other Party.'],Yes,"['In the event of such withdrawal, the Company agrees forthwith to take such action as AGI may request to publicly evidence that the Endorsement has been withdrawn and the Company agrees not to hold the Business out as having the Endorsement.']",Yes
"MARSHALLHOLDINGSINTERNATIONAL,INC_04_14_2004-EX-10.15-ENDORSEMENT AGREEMENT.PDF",['ENDORSEMENT AGREEMENT'],[],No,"['The COMPANY and CELEBRITY may terminate this Agreement under the following      conditions:<omitted>(B)  By CELEBRITY<omitted>(ii) If the COMPANY ceases business or, other than in an Initial                Merger, sells a controlling interest to a third party, or agrees                to a consolidation or merger of itself with or into another                corporation, or enters into such a transaction outside\n\n               of the scope of this Agreement, or sells substantially all of its                assets to another corporation, entity or individual outside of                the scope of this Agreement;']",Yes,['Neither this Agreement nor any right created by it shall<omitted>be assignable by either party without the prior written consent of the           other or as stated herein.'],Yes,[],No
MOVADOGROUPINC_04_30_2003-EX-10.28-ENDORSEMENT AGREEMENT.PDF,['ENDORSEMENT AGREEMENT'],[],No,[],No,[],No,"['In the event this Agreement is terminated in accordance with this Section 11, the Company shall transfer the Policy to the Trust as soon as is administratively practicable.']",Yes
